state,feature
Alabama,"1. Rhoticity: Alabama English is typically characterized by the pronunciation of the /r/ sound at the end of words and before consonants. This means that words like ""car"" or ""store"" would be pronounced with a strong /r/ sound, unlike in some other dialects where the /r/ is often dropped."
Alabama,"2. Southern Vowel Shift: Alabama English often exhibits the Southern Vowel Shift, a phenomenon that affects the pronunciation of several vowel sounds, particularly the short front vowels. For example, words like ""pen"" and ""pin"" may be pronounced similarly, with a centralized /ɪ/ sound."
Alabama,"3. Monophthongization of Diphthongs: Alabama English commonly features monophthongization, which refers to the pronunciation of diphthongs as single vowel sounds. For instance, words like ""ride"" or ""time"" may be pronounced as ""r"" and ""tahm"" respectively, with a long single vowel sound."
Alabama,"4. T-glottaling: In Alabama English, the /t/ sound at the end of words or before consonants is often pronounced as a glottal stop, /ʔ/. For example, ""cat"" may be pronounced as ""cahʔ""."
Alabama,"5. Vocabulary: Alabama English has certain unique vocabulary items and expressions, influenced by Southern dialect features. This includes terms like ""ya'll"" (you all), ""fixin' to"" (about to), or ""bless your heart"" (often used in a sympathetic or sometimes condescending manner). These specific lexical choices contribute to the distinctiveness of Alabama English."
Alaska,"1. R-dropping: Many speakers of Alaska English have a tendency to drop the ""r"" sound at the end of words or syllables. For example, ""car"" may be pronounced as ""caw"" and ""water"" as ""wawtuh."""
Alaska,"2. Vowel pronunciation: Alaska English often exhibits a unique vowel pronunciation, particularly in the way that the ""a"" sound is pronounced. It can be pronounced as a long ""a"" sound, similar to ""ay"" in words like ""day"" or ""bay,"" or as a flattened ""a"" sound, similar to the ""a"" in ""cat"" or ""pat."""
Alaska,"3. Lexical borrowing from indigenous languages: Alaska is home to a rich array of indigenous languages, and it is not uncommon for Alaskan English to incorporate vocabulary from these languages. Words such as ""muktuk"" (a traditional Inuit food) or ""qayaq"" (an Alaskan kayak) have been adopted into the lexicon."
Alaska,"4. T-glottalization: Similar to other dialects of English, Alaskan English speakers often glottalize the ""t"" sound that comes between vowels or at the end of words. This results in the replacement of the standard ""t"" sound with a glottal stop, represented by an apostrophe. For example, ""bottle"" may be pronounced as ""bo'le."""
Alaska,"5. Vocabulary related to the Alaskan environment: Given Alaska's unique geography and environment, it is common for Alaskan English to have terms and vocabulary related to its natural surroundings. Words such as ""bush"" (referring to rural, undeveloped areas), ""snowmachine"" (snowmobile), or ""salmonberry"" (a local berry), are examples of vocabulary specific to the region."
Arizona,"1. Vowel Shift: One key linguistic feature of Arizona English is the presence of the Northern Cities Vowel Shift. This vowel shift affects the pronunciation of certain vowels, such as the ""a"" sound in words like ""bat"" and ""cat"", which becomes more like ""ae"", as in ""bet"" and ""met"". This shift is commonly heard in Arizona English speakers."
Arizona,"2. Yod-Dropping: Another notable feature is yod-dropping, where the ""y"" sound in words like ""tune"" and ""suit"" is often reduced or completely dropped. Therefore, words like ""tuna"" and ""suit"" are pronounced as ""toona"" and ""soot"" in Arizona English."
Arizona,"3. Flapping: Flapping is a phonological process where the ""t"" and ""d"" sounds between vowel sounds are pronounced as a soft ""d"" sound. In Arizona English, this is commonly observed in words like ""butter"" and ""ladder"", which are pronounced as ""budder"" and ""ladder"" respectively."
Arizona,"4. Nasalization: Arizona English may exhibit nasalization, where certain vowel sounds are influenced by nearby nasal consonants such as ""m"" or ""n"". For example, the vowel in the word ""man"" can sound slightly nasalized in Arizona English."
Arizona,"5. Vocabulary influences: Arizona English has unique vocabulary influenced by the state's geographical and cultural factors. For instance, regional terms for desert flora and fauna, Native American influences, and Spanish loanwords can be found in the lexicon of Arizona English speakers. Examples include words like ""saguaro"" (type of cactus), ""mesa"" (flat-topped tableland), and ""cholla"" (type of cactus)."
Arkansas,"1. Vowel Shifts: In Arkansas English, there are distinct vowel shifts that can be observed. For example, the vowel sound in words like ""pen"" and ""pin"" may merge into a single vowel sound, so that both words sound more like ""pin."" This vowel shift is known as the ""pen-pin merger."""
Arkansas,"2. Rhoticity: Arkansas English is generally rhotic, which means that the ""r"" sound is retained and pronounced at the end of words and before consonants. So, words like ""car"" and ""far"" will have a pronounced ""r"" sound at the end."
Arkansas,"3. Monophthongs: Monophthongs are single, unchanging vowel sounds. In Arkansas English, there may be a tendency to use monophthongs instead of diphthongs, which are two-part vowel sounds. For example, the diphthong in words like ""price"" and ""ride"" may be pronounced as a monophthong."
Arkansas,"4. Southern-Regional Lexicon: Arkansas English includes vocabulary and lexicon that is specific to the southern region. This may involve unique terms and phrases, such as ""fixin' to"" (meaning about to), ""y'all"" (you all), or ""bless your heart"" (a phrase with various meanings depending on context)."
Arkansas,"5. Syllable-Timed Rhythm: While not exclusive to Arkansas English, there tends to be a syllable-timed rhythm in the speech patterns of many Arkansas speakers. This means that each syllable is given equal weight and length, resulting in a somewhat more relaxed and evenly-paced speaking style compared to stress-timed rhythms often found in other English dialects."
California,"1. Vowel Merger: California English is known for its vowel merger, where certain vowel sounds are pronounced similarly. For example, the ""cot/caught"" merger is common, meaning that words like ""cot"" and ""caught"" are pronounced identically."
California,"2. Intervocalic /t/ Deletion: Another characteristic feature of California English is the deletion of /t/ sounds in certain instances between vowels. For instance, words like ""butter"" may be pronounced as ""bu'er"" or ""be'er."""
California,"3. ""Valley Girl"" Intonation: California English is often associated with the stereotypical ""Valley Girl"" accent, characterized by a distinct rising intonation at the end of statements, as if asking a question. This feature is commonly heard in Southern California."
California,"4. Lax Pronunciation of /æ/ Sound: Californians often have a different pronunciation of the /æ/ sound found in words like ""cat"" and ""trap."" Instead of a standard ""æ"" sound, it is often pronounced as a more open ""a"" sound, closer to ""ah."" So, ""cat"" may be pronounced as ""cot."""
California,"5. Vocal Fry: Another linguistic feature often associated with California English is the use of vocal fry, which is a creaky, low-pitched coda at the end of sentences or phrases. This trend gained popularity in California and has become widespread among young speakers in other regions as well."
Colorado,"1. The cot-caught merger: In Colorado English, the vowels in the words ""cot"" and ""caught"" are often pronounced the same, merging into a single vowel sound. This is known as the cot-caught merger, and it is a prominent feature of the dialect."
Colorado,"2. The non-rhotic ""r"": Like many other dialects in the western United States, Colorado English is non-rhotic. This means that the ""r"" sound is not pronounced at the end of words or before consonants, resulting in words like ""car"" being pronounced as ""cah."""
Colorado,"3. Vocabulary influenced by the West: Colorado English includes vocabulary that reflects the region's Western influence, such as terms related to ranching, mining, outdoor activities, and the natural environment. Words like ""ranch,"" ""buckaroo,"" ""high country,"" and ""fourteener"" are commonly used in the state."
Colorado,"4. Fronted ""o"" and ""u"" vowels: In some areas of Colorado, especially in the Denver metropolitan region, there is a tendency to front the ""o"" and ""u"" vowels. This means that words like ""dog"" and ""bus"" can be pronounced with a slightly more forward tongue placement than in other English dialects."
Colorado,"5. T-glottalization: T-glottalization is a phonological feature present in Colorado English, where the ""t"" sound is pronounced as a glottal stop (represented by the symbol [ʔ]) in certain positions, such as at the end of words and before another consonant. This can be heard in pronunciations like ""mountain"" pronounced as ""moun'ain"" or ""button"" pronounced as ""bu'on."""
Connecticut,"1. Non-rhoticity: One prominent linguistic feature of Connecticut English is non-rhoticity, meaning that speakers tend to drop the ""r"" sound at the end of words or before a consonant. For example, the word ""car"" may be pronounced as ""cah"" or ""park"" as ""pahk."""
Connecticut,"2. Vowel pronunciation: Connecticut English has distinct vowel pronunciation patterns. One common feature is the pronunciation of the ""long o"" sound as a diphthong, often heard as ""oh"" or ""oo"" followed by a soft ""u"" sound. For example, the word ""boat"" may be pronounced as ""boht"" or ""buh-ut."""
Connecticut,"3. Cot-caught merger: Many Connecticut English speakers exhibit the cot-caught merger, which means they pronounce the words ""cot"" and ""caught"" with the same vowel sound. Both words are often pronounced as ""caht."""
Connecticut,"4. Word stress: Connecticut English tends to exhibit a characteristic pattern of word stress, known as the Connecticut Shift. This means that the stress is often placed on the first syllable of two-syllable words. For example, ""buddy"" could be pronounced with the stress on the first syllable instead of the second."
Connecticut,"5. Vocabulary: Connecticut English has certain regional vocabulary items that are distinct from other varieties of English. For instance, terms like ""package store"" (referring to a liquor store), ""grinder"" (submarine sandwich), or ""jimmies"" (sprinkles) are commonly used in the state. These vocabulary choices contribute to the unique linguistic flavor of Connecticut English."
Delaware,"1. Vowel Shifts: Delaware English is known for its unique vowel shifts, where certain vowel sounds undergo changes in pronunciation. For example, the ""o"" sound may shift to an ""a"" sound in words like ""caught"" or ""long."""
Delaware,"2. Post-vocalic 'r': Delaware English often exhibits the absence of the post-vocalic ""r"" sound. This is commonly observed in words like ""car"" or ""store,"" where the ""r"" sound is not pronounced."
Delaware,"3. Vocabulary: Delaware English features specific regional vocabulary that distinguishes it from other dialects. For instance, terms like ""jawn"" (used as a noun to refer to any person, place, or thing), ""hoagie"" (a type of sandwich), or ""yous"" (a plural form of ""you"") are commonly used."
Delaware,"4. Grammar: Delaware English may differ from Standard American English in terms of grammar. For example, the use of double negatives is more prevalent, as in phrases like ""I don't got none"" to mean ""I don't have any."""
Delaware,"5. Intonation: The intonation patterns in Delaware English might exhibit unique characteristics compared to other dialects. This includes specific pitch patterns, emphasis, and changes in tone that can convey different meanings or nuances in communication."
Florida,"1. Monophthongization: Florida English tends to exhibit monophthongization, where diphthongs (vowel sounds made up of two vowels) are simplified into single vowel sounds. For example, in words like ""ride"" and ""time,"" the diphthongs [aɪ] and [aɪ̯] are often pronounced as a single vowel [a]."
Florida,"2. Vowel raising: Another characteristic of Florida English is vowel raising, where certain vowels are pronounced higher in the mouth. This can be observed in words like ""caught"" and ""cot,"" where the vowel [ɔ] in ""caught"" is often raised towards [ɑ] or [ɒ], and the vowel [ɑ] in ""cot"" is pronounced closer to [ɒ]."
Florida,"3. Flapping: Flapping is a common feature in Florida English, where the voiceless alveolar stop [t] is pronounced as a voiced alveolar flap [ɾ] between vowels or before a syllabic [r]. For instance, in words like ""butter"" or ""water,"" the ""tt"" sound is often pronounced like a quick ""d"" sound."
Florida,"4. Vowel deletion: There is a tendency towards vowel deletion in unstressed syllables of certain words in Florida English. For instance, in words like ""family"" or ""vegetable,"" the vowel in the second syllable is often not pronounced, resulting in a reduction of the word to something like ""fam-ly"" or ""veg-ta-ble."""
Florida,"5. Yod-dropping: In Florida English, there is a tendency to drop the /j/ sound (known as the ""yod"") in words like ""dew,"" ""tune,"" and ""news,"" where the /juː/ diphthong is often pronounced simply as a /uː/ sound. Hence, ""dew"" would sound like ""do,"" ""tune"" like ""toon,"" and ""news"" like ""noos."""
Georgia,"1. Southern Vowel Shift: Georgia English exhibits the Southern Vowel Shift, a phonological process that affects the pronunciation of certain vowel sounds. For example, the /aɪ/ sound in words like ""ride"" is often pronounced more like ""rahd"" or ""rud"" in Georgia English."
Georgia,"2. Y'all: The pronoun ""y'all"" is a distinctive feature of Georgia English. It is used as the second person plural pronoun, replacing ""you all"" or ""you guys"" found in other varieties of English. For example, ""Are y'all ready for dinner?"""
Georgia,"3. Rhoticity: Georgia English is generally a rhotic dialect, which means that the /r/ sound is pronounced in most contexts. This contrasts with non-rhotic varieties of English found in other regions, where the /r/ sound is dropped after vowels."
Georgia,"4. Vocabulary: Georgia English has some unique vocabulary terms that are not commonly found in other varieties of English. For instance, ""soda"" is often referred to as ""coke"" regardless of the specific brand, and ""buggy"" is used to describe a shopping cart."
Georgia,"5. Lexical variations: There are also regional variations in vocabulary and pronunciation within Georgia itself. For example, in the mountainous areas of North Georgia, some speakers may use distinct words or pronunciations compared to those in the coastal regions. This reflects the influence of local dialects and historical migration patterns in shaping the linguistic landscape of Georgia English."
Hawaii,"1. Hawaiian Pidgin influence: One key linguistic feature of Hawaii English is the influence of Hawaiian Pidgin, a Creole language that developed in Hawaii as a means of communication between various ethnic groups. Many Hawaii English speakers incorporate Hawaiian Pidgin vocabulary, sentence structure, and grammar into their speech."
Hawaii,"2. Pronunciation: Hawaii English often features distinct pronunciation patterns. For instance, the Hawaiian English dialect commonly exhibits a tendency to pronounce the final ""r"" sound as a soft ""l"" sound. Additionally, vowel sounds may be elongated or pronounced differently, influenced by the Polynesian language spoken in Hawaii."
Hawaii,"3. Loanwords from Hawaiian: Another linguistic feature of Hawaii English is the incorporation of loanwords from the Hawaiian language. Many Hawaiian terms related to geography, nature, and cultural practices have been integrated into the English lexicon in Hawaii. Words like ""aloha,"" ""mahalo,"" and ""luau"" are examples of Hawaiian loanwords commonly used in Hawaii English."
Hawaii,"4. Interference from Asian languages: Due to the significant Asian population in Hawaii, there is often interference from Asian languages in Hawaii English. This can be observed through the adoption of certain vocabulary, syntactic structures, and intonation patterns from languages such as Japanese, Chinese, and Tagalog."
Hawaii,"5. Cultural references and expressions: Hawaii English incorporates cultural references and expressions specific to the Hawaiian context. Concepts like ""ohana"" (family), ""kanaka"" (person), ""haole"" (foreigner), and ""talk story"" (casual conversation) are examples of expressions that reflect unique cultural concepts and practices in Hawaii."
Idaho,"1. Vowel Shift: One prominent linguistic feature of Idaho English is the vowel shift. This involves the pronunciation of certain vowel sounds differently than in other dialects. For example, the vowel in words like ""cat"" and ""mat"" may be pronounced farther back in the mouth, resulting in a pronunciation closer to ""cot"" or ""caught."""
Idaho,"2. Non-rhoticity: Idaho English is non-rhotic, meaning the ""r"" sound is not pronounced at the end of syllables or words. This is similar to other dialects in the American West and is often associated with a softer or more relaxed pronunciation."
Idaho,"3. Palatalization of /t/ and /d/: Another characteristic feature of Idaho English is the palatalization of the /t/ and /d/ sounds when they occur before the vowel /u/. This can be heard in words like ""tube"" and ""dew,"" where the /t/ and /d/ sounds become slightly palatalized, sounding more like ""tyoob"" and ""dyoo."""
Idaho,"4. Lexical Innovations: Idaho English has also developed its own set of regional lexicon. For example, terms such as ""spud"" (referring to a potato), ""holler"" (meaning a small valley), and ""mud season"" (referring to the period of wet, muddy conditions in early spring) are commonly used and reflect the unique cultural and environmental aspects of the region."
Idaho,"5. Canadian Raising: In certain areas of Idaho, particularly near the Canadian border, there is a notable influence from Canadian English. One manifestation is the feature known as ""Canadian Raising."" This involves raising the starting point of the diphthongs /aɪ/ (as in ""ride"") and /aʊ/ (as in ""loud""). So, instead of pronouncing these diphthongs as ""ah-ee"" or ""ah-ow,"" they may sound more like ""ay-ee"" or ""ay-ow."""
Illinois,"1. The Northern Cities Vowel Shift: This characteristic feature of Illinois English involves shifting the vowel sounds in words such as ""cot"" and ""caught."" The vowel in ""cot"" is pronounced more like ""cat,"" while the vowel in ""caught"" is pronounced more like ""cot."" This vowel shift is also prominent in other northern US states."
Illinois,"2. Rhoticity: In Illinois English, the ""r"" sound is generally retained at the end of words and before consonants. This means that words like ""car"" and ""park"" are pronounced with a distinct ""r"" sound, unlike in some other English dialects where the ""r"" may be dropped."
Illinois,"3. Nasality: Illinois English is known for its nasal vowels, particularly the ""a"" and ""e"" vowels. This means that words like ""cat"" and ""pen"" may sound more nasalized compared to other dialects."
Illinois,"4. Canadian Raising: Similar to other northern US dialects, Illinois English exhibits Canadian Raising. This phonetic feature affects the pronunciation of certain diphthongs, particularly those found in words like ""ride"" and ""tight,"" where the ""i"" sound is raised before voiceless consonants like ""t"" and ""s."""
Illinois,"5. Lexical and phonological influences from German and other immigrant communities: Due to historical immigration patterns in Illinois, the dialect has been influenced by languages like German. This can be seen in words such as ""sauerbraten"" and ""kindergarten"" that have been adopted into the local vocabulary, as well as some phonological features influenced by German pronunciation patterns."
Indiana,"1. Midwestern Vowel Shift: One key linguistic feature of Indiana English is the presence of the Midwestern Vowel Shift, which involves the pronunciation changes of certain vowel sounds. For example, the ""i"" sound in words like ""pin"" may be pronounced more like ""pen,"" and the ""a"" sound in words like ""cat"" may be longer and closer to ""kay-at."""
Indiana,"2. Merging of certain vowel sounds: In Indiana English, there is a tendency to merge certain vowel sounds. For example, speakers may merge the vowel sounds in words like ""cot"" and ""caught,"" pronouncing them both as ""ah"" sounds."
Indiana,"3. Pronunciation of ""r"": Another feature of Indiana English is the pronunciation of the ""r"" sound. Some speakers may exhibit non-rhotic pronunciation, meaning they do not pronounce the ""r"" sound at the end of words, as in ""car"" or ""far."""
Indiana,"4. Nasalization of vowels: Indiana English often exhibits a nasalization of vowels, particularly the ""a"" sound. This means that vowels may be pronounced with an ""n"" sound before or after them, such as in words like ""bank"" (pronounced more like ""bangk"") or ""hand"" (pronounced more like ""hend"")."
Indiana,"5. Vocabulary and idiomatic expressions: Indiana English also includes certain vocabulary and idiomatic expressions specific to the region. For example, terms like ""high-schooler"" (referring to a high school student) and ""jelly"" (meaning ""jam"" or ""preserves"") are commonly used. Additionally, there may be unique idiomatic expressions or phrases that are specific to Indiana English, reflecting the regional culture and history."
Iowa,"1. Midland accent: In Iowa English, the accent typically falls within the Midland accent continuum. This means that vowels may be pronounced with a ""flat"" or ""neutral"" quality, lacking the distinctive features of other regional accents."
Iowa,"2. Nasalization: Iowa English often includes a noticeable degree of nasalization. This means that vowels before nasal consonants (such as /n/ or /m/) may have a nasal quality, in which air escapes through the nose during their pronunciation."
Iowa,"3. Monophthongization: Many Iowa English speakers exhibit a tendency towards monophthongization, particularly with diphthongs. This means that diphthongs, which are normally pronounced with a glide or shift in sound, are simplified to single vowel sounds. For example, the diphthong /aɪ/ in ""time"" might be pronounced as a single vowel sound, closer to /a:/."
Iowa,"4. Flapping: Flapping is a common feature in Iowa English. This refers to the pronunciation of /t/ and /d/ sounds as a tap or flap sound [ɾ] in certain contexts, such as between vowels or after a stressed syllable. For example, ""butter"" might be pronounced as ""budder."""
Iowa,"5. T-glottalization: T-glottalization is another feature found in Iowa English. This refers to the replacement of /t/ sounds with a glottal stop [ʔ] in certain positions, such as at the end of words like ""cat"" or before syllabic /n/ sounds, as in ""button."""
Kansas,"1. Midland Accent: Kansas English is typically characterized by the Midland accent, which is known for its lack of strong regional features. The speech is generally perceived as neutral and similar to General American English, making it relatively easy for Kansans to understand and be understood by speakers from other parts of the United States."
Kansas,"2. Vowel Shifts: Kansas English is influenced by the Northern Cities Vowel Shift (NCS), a phonological pattern observed in many parts of the Midwest and Great Lakes regions. The NCS involves changes in the pronunciation of certain vowel sounds, such as the short ""a"" (as in ""cat"") becoming more nasalized and pronounced further forward in the mouth."
Kansas,"3. Flat ""A"": In Kansas English, the ""a"" sound in words like ""bath"" and ""dance"" becomes more open and flat compared to other regional accents. This is often noticed by non-Kansans as a distinct feature of the local dialect."
Kansas,"4. Rhoticity: Kansas English is a rhotic accent, meaning that the ""r"" sound is pronounced in all contexts. This contrasts with non-rhotic accents where the ""r"" sound is dropped after a vowel or in certain positions."
Kansas,"5. Lexical Differences: While Kansas English does not have a significant number of unique words or vocabulary, there are a few regional terms that are more commonly used in the state. For example, ""jayhawk"" refers to a fan of the University of Kansas (KU) sports teams. Additionally, Kansans might use terms like ""tornado alley"" to refer to the region known for its frequent tornado activity, or ""flint hills"" to describe the unique geological area in eastern Kansas."
Kentucky,"1. Pronunciation: One key linguistic feature of Kentucky English is the pronunciation of certain vowel sounds. A noticeable characteristic is the ""a"" sound often found in words like ""cat"" and ""bat,"" which is pronounced as a nasalized vowel, similar to the ""a"" in ""cat"" in Northern Cities Vowel Shift. Additionally, the vowel in words like ""cot"" and ""caught"" may be merged, resulting in a pronunciation close to ""cot."""
Kentucky,"2. Vocabulary: Kentucky English has a unique lexicon that reflects its regional heritage and cultural influences. Various terms and phrases that are specific to Kentucky, such as ""holler"" (a small valley or hollow), ""poke"" (bag), ""bless your heart"" (a southern expression meaning sympathy or pity), and ""fixin’ to"" (about to do something), are part of everyday speech."
