state,feature
North Carolina,"3. Monophthongization of /ai/ and /au/: North Carolina English is also characterized by monophthongization, which means that the diphthong sounds /ai/ (as in ""ride"") and /au/ (as in ""loud"") are simplified into single vowel sounds. So, ""ride"" may be pronounced as ""rahd"" and ""loud"" as ""lahd."""
North Carolina,"4. Use of ""y'all"": North Carolina English is known for its use of ""y'all"" as the plural form of ""you."" This term is not only used in casual speech but is also found in formal situations. It is a distinct feature of Southern dialects."
North Carolina,"5. Lexical variations: North Carolina English includes some regional vocabulary variations. For example, ""barbecue"" may be used as a noun referring to a specific style of slow-cooked meat, and ""mash"" is used instead of ""press"" to describe applying pressure or stepping on something. Additionally, regional words like ""bless his/her heart"" may be used to soften a negative or critical statement about someone."
North Dakota,"1. Nasalization: One prominent linguistic feature of North Dakota English is nasalization, meaning that vowels are pronounced with a nasal quality. This is particularly pronounced when followed by a nasal consonant, such as ""pen"" sounding like ""pin""."
North Dakota,"2. Canadian Raising: North Dakota English also exhibits the Canadian Raising phenomenon, where the diphthongs /aɪ/ and /aʊ/ are pronounced with a different vowel quality compared to other English varieties. For example, ""ride"" may be pronounced with a raised /aɪ/ so it sounds more like ""royed""."
North Dakota,"3. Flat intonation: Another feature is the use of a flat intonation pattern, which means that speakers tend to have a relatively even pitch contour without significant rising or falling tones. This can give their speech a more monotone or ""flatter"" sound compared to other dialects."
North Dakota,"4. Vocabulary: Some vocabulary peculiarities also exist in North Dakota English. For instance, words such as ""pop"" for ""soda"" and ""hotdish"" for ""casserole"" are frequently used, reflecting the influence of the region's Scandinavian heritage."
North Dakota,"5. Pronunciation of ""cot"" and ""caught"" vowel merger: Speakers of North Dakota English may exhibit the cot-caught merger, where the vowels /ɑ/ and /ɔ/ are merged into a single vowel sound. This means that words like ""cot"" and ""caught"" are pronounced the same way, typically as /ɑ/."
Ohio,"1. Central vowel merger: One key linguistic feature of Ohio English is the central vowel merger, commonly known as the ""cot-caught"" merger. In this merger, the vowel sounds /ɑ/ (as in ""cot"") and /ɔ/ (as in ""caught"") merge into a single vowel sound, typically pronounced as /ɑː/. So, the words ""cot"" and ""caught"" are pronounced the same, as ""caht"" in Ohio English."
Ohio,"2. Canadian shift: Ohio English exhibits the Canadian shift, a phonetic phenomenon whereby the pronunciation of certain vowel sounds shifts. In this shift, the vowel sounds /æ/ (as in ""cat"") and /ɛ/ (as in ""met"") move towards the pronunciation of /ɑ/ (as in ""cot"") and /æ/ respectively. For example, ""cat"" may sound more like ""cot"" and ""met"" may sound more like ""mat."""
Ohio,"3. Rhoticity: Ohio English is generally rhotic, meaning that the r sound is pronounced at the end of words and before consonants. This differs from non-rhotic accents like General American English, where the r sound is not pronounced in these positions."
Ohio,"4. Northern Cities Vowel Shift: Ohio English, particularly in urban areas like Cleveland, Columbus, and Cincinnati, exhibits the Northern Cities Vowel Shift (NCVS). This shift affects the pronunciation of several vowel sounds. For example, the vowel sound /ɑ/ in ""cot"" moves towards /æ/ (as in ""cat""). Additionally, the vowel sound /ɪ/ (as in ""kit"") moves towards /i/ (as in ""keet""). These shifts can result in pronunciations like ""caht"" for ""cot"" and ""keet"" for ""kit."""
Ohio,"5. Use of ""please?"" for repetition or confirmation: A notable linguistic feature of Ohio English is the use of ""please?"" at the end of a sentence to request repetition or confirmation. For example, if someone didn't hear or understand what was said, they might respond with ""What did you say, please?"" This usage is specific to Ohio and is not commonly found in other dialects."
Oklahoma,"1. Non-Rhotic Pronunciation: One of the key linguistic features of Oklahoma English is the non-rhotic pronunciation, where speakers do not pronounce the 'r' sound at the end of words or before a consonant. For example, ""car"" may be pronounced as ""cah"" or ""mother"" as ""mothah."""
Oklahoma,"2. Southern Vowel Shift: Oklahoma English exhibits a Southern vowel shift, where certain vowel sounds are pronounced differently compared to other varieties of American English. For instance, the vowel in words like ""pen"" and ""ten"" may be pronounced with a more open sound, closer to ""pin"" and ""tin."""
Oklahoma,"3. Yod-Dropping: Another feature is the tendency to drop the 'y' sound before the vowel sound in words like ""new"" or ""tune,"" resulting in pronunciations like ""noo"" and ""toon."""
Oklahoma,"4. Monophthongization of /aɪ/: In Oklahoma English, the diphthong /aɪ/, as in ""ride"" or ""time,"" is often pronounced as a monophthong, or a single vowel sound. This may result in pronunciations such as ""rahd"" instead of ""ride"" or ""tahm"" instead of ""time."""
Oklahoma,"5. Vocabulary: Oklahoma English also has distinct vocabulary influenced by its rural and Indigenous history. Terms such as ""poke"" (bag), ""fixin'"" (getting ready), ""bless your heart"" (often used sarcastically), or ""ya'll"" (you all) are commonly used in this dialect. Additionally, Native American loanwords from languages like Choctaw or Cherokee may also be integrated into speech in certain regions of Oklahoma."
Oregon,"1. Pacific Northwest Vowel Shift: One key linguistic feature of Oregon English is the Pacific Northwest Vowel Shift. This shift involves changes in vowel sounds, with words like ""cat"" and ""bag"" pronounced with a slightly raised ""a"" sound, sounding more like ""cet"" and ""beg"" respectively."
Oregon,"2. Nasalized Vowels: Another feature of Oregon English is the presence of nasalized vowels. In certain contexts, vowels like ""a,"" ""e,"" and ""o"" can become nasalized, with a slight nasal quality. For example, the word ""can"" may sound more like ""cahn"" or ""cam."""
Oregon,"3. Canadian Raising: Oregon English also exhibits Canadian Raising, a feature where the diphthongs /aɪ/ (as in ""ride"") and /aʊ/ (as in ""mouth"") are pronounced with a higher starting position in the mouth, similar to the Canadian accent. This can lead to pronunciations like ""rihd"" instead of ""ride"" and ""mohth"" instead of ""mouth."""
Oregon,"4. Flapping: Flapping is another linguistic feature found in Oregon English. In this process, the ""t"" and ""d"" sounds are pronounced as a soft ""r"" sound between vowels and in certain positions. For example, the word ""water"" may be pronounced more like ""wader"" or ""wahder."""
Oregon,"5. Lack of Yod-Dropping: Unlike some American English varieties, Oregon English does not commonly exhibit yod-dropping. The ""y"" sound is preserved in words like ""tune,"" ""dew,"" and ""new,"" resulting in pronunciations like ""tyoon,"" ""dyoo,"" and ""nyoo."""
Pennsylvania,"1. The ""cot-caught"" merger: In Pennsylvania English, the distinction between the ""short o"" sound in words like ""cot"" and the ""aw"" sound in words like ""caught"" is often lost. Both sounds are pronounced as an ""aw"" sound, resulting in words like ""cot"" and ""caught"" being homophones."
Pennsylvania,"2. The ""youse"" plural pronoun: Pennsylvania English sometimes uses the second-person plural pronoun ""youse"" instead of the standard ""you"" to address a group of people. For example, instead of saying ""Are you coming to the party?"", someone speaking Pennsylvania English might say ""Are youse coming to the party?"""
Pennsylvania,"3. The ""to be"" construction: In Pennsylvania English, the infinitive ""to be"" is often omitted in certain contexts. For instance, instead of saying ""I am going to the store,"" someone might say ""I'm going to the store,"" omitting the ""to be"" verb."
Pennsylvania,"4. The ""dahn"" and ""ahn"" pronunciations: Pennsylvania English often exhibits the pronunciation of words like ""down"" as ""dahn"" and ""on"" as ""ahn."" This is particularly true in Pittsburgh English, where these vowel shifts can be more prevalent."
Pennsylvania,"5. The ""rhotic"" accent: Unlike other regional accents where the ""r"" sound is often dropped or weakened, Pennsylvania English is typically characterized by a strong and rhotic ""r"" sound. This means that the ""r"" is pronounced clearly in words like ""car"" or ""park,"" distinguishing it from accents where the ""r"" sound is reduced or dropped."
Rhode Island,"1. Non-rhoticity: One of the most distinctive features of Rhode Island English is the absence of the ""r"" sound at the end of words and before consonants. For example, ""car"" may sound more like ""cah"" or ""idea"" like ""idee-uh""."
Rhode Island,"2. Cot-caught merger: Rhode Island English is characterized by the merger of the vowel sounds in the words ""cot"" and ""caught"", so both words are pronounced with the same vowel sound. This is in contrast to some other dialects where these words have distinct vowel sounds."
Rhode Island,"3. Vocabulary: Rhode Island English has some unique vocabulary and phrases that are specific to the region. For example, the word ""bubbler"" is often used to refer to a drinking fountain, ""jimmies"" are sprinkles on ice cream, and ""coffee milk"" refers to coffee-flavored milk."
Rhode Island,"4. Distinctive intonation patterns: Rhode Island English has a particular intonation pattern, often characterized by a ""downstep"". This means that the pitch at the end of phrases or sentences tends to drop lower than the pitch at the beginning, giving the speech a distinct melodic quality."
Rhode Island,"5. Use of the word ""wicked"": In Rhode Island English, the word ""wicked"" is commonly used as an intensifier to mean ""very"" or ""extremely"". For example, someone might say, ""That roller coaster was wicked fast!"" This usage is influenced by the region's historical ties to New England and its regional dialect features."
South Carolina,"1) Vowel ""raising"" or ""fronting"": In South Carolina English, certain vowels are raised or fronted in pronunciation. For example, the vowel in words like ""ride"" might be pronounced closer to ""rad"" or ""red."""
South Carolina,"2) Monophthongization of diphthongs: South Carolina English often simplifies diphthongs, which are two adjacent vowel sounds occurring within the same syllable, into monophthongs. For instance, the pronunciation of words like ""tide"" might become ""tahd"" or ""tod."""
South Carolina,"3) Non-rhoticity: The southern dialects, including South Carolina English, exhibit non-rhoticity, where the ""r"" sound is not pronounced at the end of words or before a consonant. Therefore, words like ""car"" would be pronounced as ""cah."""
South Carolina,"4) Use of double modals: South Carolina English often employs the use of double modals such as ""might could"" or ""might would"" for expressing possibility or making suggestions. For example, a speaker may say, ""Y'all might could go to the store"" instead of ""You might be able to go to the store."""
South Carolina,"5) Vocabulary and expressions: South Carolina English has its own unique vocabulary and expressions. For instance, ""fixin' to"" is commonly used to denote the intention to do something, as in ""I'm fixin' to go to the store."" Additionally, phrases like ""bless your heart"" can have different meanings in South Carolina English compared to standard English, often conveying sympathy or understanding."
South Dakota,"1. Vowel Merger: One key feature of South Dakota English is the vowel merger, commonly known as the ""cot-caught merger."" In this dialect, the vowel sounds in the words ""cot"" and ""caught"" are pronounced the same."
South Dakota,"2. Nasalization: South Dakotans tend to nasalize vowels that are followed by nasal consonants like ""m"" or ""n."" For example, the word ""man"" might sound more like ""maan"" in this dialect."
South Dakota,"3. Monophthongization: South Dakota English also displays monophthongization, which means that certain diphthongs are simplified into single vowel sounds. For instance, the diphthong in words like ""boil"" or ""coil"" might be pronounced more like a single vowel sound, similar to ""bowl"" or ""cowl."""
South Dakota,"4. T-glottalization: In South Dakota English, the ""t"" sound is often pronounced as a glottal stop, particularly at the end of words or before a consonant. For example, in the word ""cat,"" the ""t"" might be pronounced like a slight pause or a catch in the throat."
South Dakota,"5. Reduced final consonant clusters: South Dakota English tends to simplify or eliminate final consonant clusters. For instance, words like ""past"" might be pronounced as ""pas"" or ""ask"" might be pronounced as ""ax."" This feature is often associated with the broader dialect region known as the Upper Midwest."
Tennessee,"1. Southern Vowel Shift: Tennessee English exhibits the Southern Vowel Shift, which involves changes in vowel pronunciation. For example, the short ""i"" sound in words like ""hit"" is often pronounced as an ""e"" sound, so it may sound like ""het"" to non-Tennessee speakers."
Tennessee,"2. Y'all: The use of ""y'all"" as a second-person plural pronoun is a prominent feature of Tennessee English. It is used to address a group of people, rather than using ""you guys"" or ""youse"" as in other dialects."
Tennessee,"3. Rhoticity: Tennessee English is generally rhotic, meaning that the ""r"" sound is pronounced at the end of words and before consonants. So, words like ""car"" and ""hard"" will have a pronounced ""r"" sound in Tennessee English."
Tennessee,"4. Monophthongization of the diphthongs: Tennessee English often exhibits the monophthongization of diphthongs, where two vowel sounds merge into one. For example, the diphthong ""ow"" in words like ""cow"" may sound like a single vowel, closer to ""cah"" in Tennessee English."
Tennessee,"5. Lexical features: Tennessee English has distinct regional vocabulary, including terms such as ""bless your heart"" (a phrase used to express sympathy or condescension), ""fixin' to"" (meaning ""about to"" or ""intending to""), and ""holler"" (a term for a small valley or a loud yell). These lexical features help distinguish Tennessee English from other dialects."
Texas,"1. Consonant and vowel reduction: Texas English exhibits a tendency towards reducing or softening certain sounds. For example, the ""r"" sound is often dropped at the end of words (e.g., ""car"" pronounced as ""cah""), and the vowel sounds in words like ""pin"" and ""pen"" may merge, both pronounced as ""pin."""
Texas,"2. Monophthongization of the diphthongs: Texas English speakers sometimes simplify diphthongs to single vowel sounds. For instance, ""boy"" can be pronounced as a monophthong [boi] instead of a diphthong [boɪ]."
Texas,"3. Y'all and fixin' to: The use of ""y'all"" as the second person plural pronoun is a distinctive feature of Texas English. Additionally, the phrase ""fixin' to"" is used to indicate intention or future action, like ""I'm fixin' to go to the store"" meaning ""I'm about to go to the store."""
Texas,"4. Vocabulary: The lexicon of Texas English incorporates unique words and phrases, often influenced by Mexican Spanish and Southern American English. Terms such as ""mosey,"" ""bless your heart,"" and ""yonder"" frequently occur in Texas English usage."
Texas,"5. Intonation patterns: Texans tend to have a distinctive intonation pattern characterized by a rising-falling contour. This rise and fall in pitch can be observed at the end of sentences, where a statement might rise in pitch initially, then fall at the end. This intonation pattern is sometimes referred to as the ""Texan drawl,"" contributing to the regional accent."
Utah,"1) Intermountain West Vowel Shift: One key linguistic feature of Utah English is the Intermountain West Vowel Shift. This shift involves changes in the pronunciation of certain vowel sounds. For example, the /æ/ sound in words like ""cat"" may be pronounced as a more centralized /ɛ/ sound, leading to pronunciations like ""ket""."
Utah,"2) Alveolar flap: Another feature of Utah English is the use of the alveolar flap, which is the pronunciation of the /t/ and /d/ sounds as a tap ([ɾ]) between vowels or at the end of words. For instance, in words like ""butter"" or ""water"", the /t/ sound is pronounced as a quick tap against the roof of the mouth instead of a full stop."
Utah,"3) Pronunciation of /uː/: Utah English speakers often have a distinct pronunciation of the /uː/ vowel sound. Instead of the standard American pronunciation as in ""boot,"" Utah English speakers often have a more rounded pronunciation, similar to the sound in ""book"" or ""good""."
Utah,"4) Vocabulary: Utah English has some unique vocabulary and expressions that are specific to the region. For example, terms like ""bishop's storehouse"" (a Mormon welfare system) or ""LDS"" (abbreviation for Latter-day Saints, referring to the dominant Mormon religion) are commonly used and understood in Utah."
Utah,"5) Use of ""The"": Utah English speakers often use the definite article ""the"" before proper nouns referring to highways or freeways. This is known as the ""Utah-ism"" and can be heard when locals refer to roads like ""The I-15""."
Vermont,"1. Vermont Raising: In Vermont English, the vowel sound /aʊ/ in words like ""house"" and ""about"" is often pronounced with a raised tongue, resulting in a sound closer to /əʊ/. This linguistic feature is commonly referred to as ""Vermont Raising."""
Vermont,"2. Nasalized Vowels: Vermont English displays a tendency for nasalizing vowels, particularly before nasal consonants. For example, the vowel sound /æ/ in words like ""cat"" might be pronounced with a nasal quality, similar to the ""a"" in the word ""dance."""
Vermont,"3. Non-rhoticity: Like many other New England dialects, Vermont English is non-rhotic, meaning that the letter ""r"" is not pronounced at the end of syllables or before consonants. For example, the word ""car"" may be pronounced as ""cah"" or ""ca"" without the final ""r"" sound."
Vermont,"4. Vocabulary and Expressions: Vermont English incorporates unique regional vocabulary and expressions, some of which reflect the state's rural and agricultural heritage. Terms like ""sugarhouse"" (a building for maple syrup production) or ""mud season"" (the muddy period during spring) are specific to the Vermont dialect."
Vermont,"5. Pronunciation of /u/: In many parts of Vermont, the vowel sound /u/ in words like ""boot"" and ""rural"" is pronounced similarly to the ""oo"" in ""book."" This feature is commonly referred to as the ""Vermont Boot-Book merger."" However, it is important to note that the merger may not be consistent across all speakers and regions in Vermont."
Virginia,"1. The Tidewater accent: Virginia English is characterized by a distinct Tidewater accent, often associated with the eastern coastal region of the state. This accent is marked by a distinctive pronunciation of certain vowels and diphthongs, such as the ""ou"" sound in words like ""house"" being pronounced as something closer to ""hoos."""
Virginia,"2. Non-rhoticity: Virginia English is traditionally a non-rhotic dialect, meaning that the ""r"" sound is often not pronounced at the end of words or before consonants. For example, the word ""car"" might be pronounced as ""cah"" by speakers of Virginia English."
Virginia,"3. Vocabulary influenced by agriculture and tobacco industry: The history of agriculture and tobacco production in Virginia has influenced the vocabulary of Virginia English. Words related to farming, crops, and the tobacco industry are often more prevalent in the regional lexicon."
Virginia,"4. Use of ""y'all"": Similar to other Southern dialects, Virginia English frequently uses the contraction ""y'all"" as a plural form of ""you."" It is used to address a group of people, and has become a common and distinctive feature of the language in Virginia."
Virginia,"5. Interchangeability of ""is"" and ""are"": In Virginia English, the verb forms ""is"" and ""are"" are often used interchangeably in non-standard speech. For example, a sentence like ""The tomatoes is ripe"" might be heard instead of the standard ""The tomatoes are ripe."" This usage is characteristic of the dialect and reflects variation in verb agreement."
Washington,"1. Intervocalic flapping: One of the key linguistic features of Washington English is the tendency to flap the /t/ and /d/ sounds when they appear between vowels. For example, words like ""butter"" and ""ladder"" may be pronounced as ""budder"" and ""ladder"" respectively."
Washington,"2. Fronted /oʊ/ vowel: Washington English speakers often front the /oʊ/ vowel sound found in words like ""boat"" and ""coat,"" pronouncing it more like /ɛʊ/ or /ɛoʊ/. This results in words sounding closer to ""beat"" and ""beat"" respectively."
Washington,"3. Pin-pen merger: Like many other regional dialects in the United States, Washington English exhibits the pin-pen merger. This means that speakers pronounce words like ""pin"" and ""pen"" with the same vowel sound, often closer to ""pin."""
Washington,"4. Complex vowel system: Washington English has a relatively complex vowel system with more vowel distinctions compared to other English varieties. For example, in words like ""cot"" and ""caught,"" the vowels are pronounced more distinctly, with ""cot"" having a shorter vowel sound like /ɑ/ and ""caught"" having a longer vowel sound like /ɔ/ or /ɒ/."
Washington,"5. Nasalization of vowels: Washington English speakers tend to nasalize their vowels more than speakers of other dialects. Nasalization occurs when sounds pass through the nose, and it is commonly observed in words like ""jam"" or ""man,"" which may be pronounced with a slight nasal twang."
West Virginia,"1. Appalachian Vowel Shift: One of the most prominent features of West Virginia English is the Appalachian Vowel Shift. This refers to a set of vowel shifts, where certain vowels are pronounced differently compared to standard English. For example, the vowel in words like ""cat"" may be pronounced closer to ""kyat"" or ""kayut"" in West Virginia English."
West Virginia,"2. Rhoticity: West Virginia English is typically rhotic, meaning that the ""r"" sound is pronounced at the end of syllables, even when it is followed by a consonant or comes before a consonant in the next syllable. For instance, ""car"" may be pronounced as ""carr."""
West Virginia,"3. Vocabulary: West Virginia English has its own unique vocabulary, influenced by the Appalachian region. Some examples of West Virginia specific words or phrases include ""holler"" (a small valley between mountains), ""redd up"" (to clean up or tidy), and ""poke"" (a paper bag or sack)."
West Virginia,"4. Grammatical Features: West Virginia English may exhibit certain grammatical features that differ from standard American English. For instance, the use of a double negative can be observed, such as ""I don't know nothin'."" Additionally, the use of the construction ""to be + past participle"" instead of ""have + past participle"" is sometimes seen, for example, ""I'm done my homework."""
West Virginia,"5. Pronunciation of the ""O"" sound: The pronunciation of the ""o"" sound in West Virginia English often differs from standard English. It may be pronounced closer to an ""ah"" sound in words like ""cot"" (pronounced as ""caht"") or ""coffee"" (pronounced as ""caffee""). This feature is sometimes referred to as the ""cot-caught"" merger."
Wisconsin,"1) The Northern Cities Vowel Shift: One prominent linguistic feature of Wisconsin English is the Northern Cities Vowel Shift (NCVS), which involves changes in vowel pronunciation. For instance, the vowel in words like ""bag"" or ""cat"" may be pronounced with a nasal quality, similar to the ""a"" in ""crab"" or ""trap."""
Wisconsin,"2) ""Ope"" as an interjection: Another feature of Wisconsin English is the use of the interjection ""ope"" to express mild surprise or acknowledgment. It is commonly used when someone accidentally bumps into someone or needs to pass by, such as saying ""Ope, sorry!"" or ""Ope, let me just squeeze by."""
Wisconsin,"3) ""Ya Know"": The phrase ""ya know"" is frequently used in Wisconsin English as a tag question or a way to seek affirmation from the listener. For example, someone might ask, ""It sure is hot today, ya know?"" or ""You're coming to the party, ya know?"""
Wisconsin,"4) Tonicization of certain words: In Wisconsin English, certain words may receive emphasis or be tonicized differently than standard English. For instance, instead of saying ""I want to go to the store,"" a speaker might say ""I wanna go to the STORE."""
Wisconsin,"5) Lenition of final consonants: Lenition refers to the softening or weakening of consonant sounds. In Wisconsin English, there is often a tendency to lenite or partially drop final consonants in words. For example, ""hand"" may be pronounced as ""han,"" or ""cat"" as ""cah."""
Wyoming,"1. Vowel Shifts: Wyoming English exhibits vowel shifts, particularly in the pronunciation of the ""a"" sound. The vowel in words like ""cat"" is often pronounced with a more centralized and raised sound, closer to the ""æ"" sound in words like ""trap"" rather than the standard American English pronunciation."
