state,feature
Kentucky,"3. Grammar: Kentucky English exhibits certain grammatical features that distinguish it from other dialects. One example is the usage of double modals, where two modal auxiliary verbs, such as ""might could"" or ""might should,"" are used together to express possibility or speculation. Another grammatical feature is the elimination of the verb ""to be"" in certain contexts, such as saying ""The car needs washed"" instead of ""The car needs to be washed."""
Kentucky,"4. Syntax: Kentucky English may have some distinct syntactic patterns. For instance, using ""them"" as a demonstrative pronoun in phrases like ""Look at them apples"" instead of ""Look at those apples"" or using the word ""aim"" in place of ""intend"" in sentences like ""I aim to go to the store."""
Kentucky,"5. Regional Accent: Kentucky English is characterized by a regional accent with specific phonetic features. This includes a Southern drawl, with elongated vowel sounds and a slightly slower pace of speech. The merging of certain vowel sounds and variations in rhotic pronunciation, where the ""r"" sound may be dropped or only lightly pronounced, are also common in the accent."
Louisiana,"1. Cajun French Influence: Louisiana English is heavily influenced by Cajun French, particularly in the southern part of the state. This influence is evident in aspects such as vocabulary, pronunciation, and grammar. Words borrowed from Cajun French, like ""lagniappe"" (something extra or a small gift), are common in Louisiana English."
Louisiana,"2. Pronunciation and Vowel Shifts: Louisiana English displays unique vowel shifts and pronunciations. For example, the vowel in words like ""coat"" and ""boat"" is typically pronounced with a distinct ""ow"" sound, more like ""code"" and ""bode."" Additionally, the vowels in words like ""pen"" and ""pin"" may merge, both being pronounced as ""pin"" or ""peen."""
Louisiana,"3. Distinct Accent: Louisiana English is known for its distinct accent, often called the ""Yat accent"" in the Greater New Orleans area. This accent is characterized by unique regional pronunciations, such as dropping the ""r"" sound at the end of words and using a distinct combination of vowel sounds."
Louisiana,"4. Vocabulary: Louisiana English has a rich vocabulary influenced by the region's history and cultural diversity. Words like ""beignet"" (a type of French pastry) and ""gumbo"" (a traditional Louisiana stew) are examples of vocabulary specific to the region. Additionally, Louisiana English incorporates words and phrases from French, Spanish, and African languages."
Louisiana,"5. Grammar and Sentence Structure: Louisiana English exhibits unique grammar and sentence structure features. For instance, the use of double negatives, like ""I don't want none"" instead of ""I don't want any,"" is common. Additionally, there may be variations in verb conjugation, such as saying ""I seen"" instead of ""I saw."""
Maine,"1. R-dropping: One notable linguistic feature of Maine English is the pronunciation of ""r"" sounds. Like in other non-rhotic accents, speakers tend to drop the ""r"" sound at the end of words or before consonants. For example, ""car"" is pronounced as ""cah"" and ""butter"" as ""buttah."""
Maine,"2. Vowel pronunciation: Maine English also exhibits distinct vowel sounds. The ""a"" in words like ""bag"" and ""cat"" is often pronounced with a distinct nasal quality, almost sounding like ""Ay,"" known as the Maine accent. Additionally, the ""o"" in words like ""caught"" and ""walk"" can be pronounced as ""ah"" or ""aw,"" resulting in pronunciations like ""cahht"" (""caught"") and ""wahk"" (""walk"")."
Maine,"3. Canadian influence: Due to its geographical proximity to Canada, Maine English shows some influence from Canadian English. Certain vocabulary items and pronunciation patterns associated with neighboring Canadian provinces such as New Brunswick and Quebec can be observed in the local dialect."
Maine,"4. Vocabulary: Maine English has a few unique words and phrases that are specific to the state or the region. For example, ""downeast"" refers to the easternmost coastal areas of Maine, while ""lobstah"" is a commonly used term for lobster. Other regional words include ""buckey"" (mosquito), ""tump"" (tip over), and ""wicked"" (intensifier, as in ""wicked good"")."
Maine,"5. Syntactic structures: Another linguistic feature in Maine English is the use of certain syntactic structures. For instance, speakers often use the word ""anymore"" to signal the negative change or decline of something, such as ""The quality of the product isn't what it used to be anymore."" Additionally, the dropping of the word ""to"" in infinitive verb phrases is a characteristic feature, as in ""I need go to the store"" instead of ""I need to go to the store."""
Maine,"It's important to note that linguistic features can vary among individuals and communities within Maine, and not all speakers will exhibit all of these features to the same extent."
Maryland,"1. Vowel merger: Maryland English is known for its back vowel merger, particularly the merger of the /ɔ/ and /ɑ/ vowels. This means that words like ""cot"" and ""caught"" are pronounced the same way (""cot"") in Maryland English."
Maryland,"2. Baltimore accent: The Baltimore accent is a distinctive feature of Maryland English. It is characterized by a unique pronunciation of certain sounds, such as the ""o"" and ""r"" sounds. For example, words like ""dog"" may be pronounced as ""dawg"" and ""water"" as ""wooder"" in the Baltimore accent."
Maryland,"3. Nasalization: Maryland English tends to have increased nasalization, meaning that speakers produce more sounds through their nose. This can be heard in words like ""candy"" sounding more like ""candy-n""."
Maryland,"4. Vocabulary: Maryland English has its own set of regional vocabulary words that are not commonly used in other dialects. For example, ""hon"" is a term of endearment used to refer to someone (usually a woman) in Baltimore. ""Jimmies"" are referred to as the colored sprinkles used on ice cream."
Maryland,"5. Non-rhoticism: Maryland English exhibits non-rhotic pronunciation, meaning that ""r"" sounds are often not pronounced or only weakly pronounced at the ends of words or in certain positions. This is similar to other dialects in the Mid-Atlantic region."
Massachusetts,"1. Non-rhoticity: One of the most distinctive features of Massachusetts English is the non-rhotic pronunciation. This means that the final ""r"" sound is often dropped or softened at the end of words or before a consonant. For example, ""car"" may be pronounced more like ""cah."""
Massachusetts,"2. Broad ""a"" vowel: Massachusetts English exhibits a distinct vowel shift known as the ""broad a."" This is characterized by pronouncing the ""a"" sound in words like ""bath,"" ""dance,"" and ""castle"" with a rounded and elongated quality. So, ""bath"" might be pronounced as ""bahth."""
Massachusetts,"3. ""Aw"" vowel: Another distinctive vowel sound is the ""aw"" sound, which is often pronounced as a rounded ""or"" sound. For example, ""caught"" may be pronounced more like ""corrt."""
Massachusetts,"4. Stress on the first syllable: Massachusetts English often exhibits a tendency to stress the first syllable of words, especially multisyllabic words. For instance, ""tomato"" may be pronounced as ""tuh-MAY-to."""
Massachusetts,"5. Vocabulary: Massachusetts English has its own unique vocabulary. For example, the word ""frappe"" is used to refer to a milkshake-like beverage, while ""bubbler"" is used to describe a public drinking fountain. Various regional terms such as ""wicked"" (very), ""packie"" (liquor store), and ""grinder"" (submarine sandwich) are also commonly used in Massachusetts."
Michigan,"1. The Northern Cities Vowel Shift: One key linguistic feature of Michigan English is the Northern Cities Vowel Shift, which is a distinct vowel shift affecting the pronunciation of certain vowel sounds. For example, the short ""a"" sound in words like ""cat"" is pronounced with a higher and more nasalized quality, similar to the sound in words like ""bag"". Similarly, the short ""o"" sound in words like ""lot"" is pronounced with a more fronted and raised position in the mouth, approaching a sound similar to the ""aw"" in words like ""law""."
Michigan,"2. Canadian Raising: Another characteristic of Michigan English is the phenomenon of Canadian Raising. This feature affects the pronunciation of certain diphthongs, particularly the ""ow"" and ""ay"" sounds in words like ""house"" and ""ride"". Instead of pronouncing these sounds as they are in standard American English, Michigan English speakers raise the starting point of these diphthongs, resulting in a subtle change in pronunciation."
Michigan,"3. Pin-Pen Merger: Michigan English also exhibits the pin-pen merger, where the distinction between the ""i"" sound in words like ""pin"" and the ""e"" sound in words like ""pen"" is minimized or completely eliminated. This means that Michigan English speakers may pronounce both of these vowel sounds with a single vowel sound, typically closer to the ""i"" sound."
Michigan,"4. Nasalized Consonants: Another feature of Michigan English is the nasalization of certain consonants, particularly ""m"" and ""n"" sounds at the end of words or before other nasal sounds. For example, words like ""them"" and ""man"" may sound slightly more nasalized in Michigan English compared to standard American English."
Michigan,"5. Michigander Terminology: In addition to these phonetic features, Michigan English has specific lexical items and regional terms that are unique to the state. For instance, the term ""Yooper"" is used to refer to people from the Upper Peninsula of Michigan, while ""Trolls"" refers to people living below the Mackinac Bridge. These regional terms reflect the distinctive identity and cultural landscape of Michigan."
Minnesota,"1. Northern Cities Vowel Shift: One of the most noticeable linguistic features of Minnesota English is the Northern Cities Vowel Shift. It involves changes in the pronunciation of certain vowel sounds, particularly the vowels in words like ""bag,"" ""bed,"" and ""cat."" The vowel in ""bag"" may sound more like ""beg,"" the vowel in ""bed"" may sound more like ""bid,"" and the vowel in ""cat"" may sound more like ""cot."""
Minnesota,"2. Tense/Lax Vowel Distinction: Another linguistic feature is the distinction between tense and lax vowels. For example, the vowel sounds in words like ""cot"" and ""caught"" are pronounced differently, with ""cot"" having a shorter, more lax vowel sound and ""caught"" having a longer, tenser vowel sound."
Minnesota,"3. ""You betcha"": The phrase ""you betcha"" is a distinctive feature of Minnesota English. It is used as a form of positive affirmation or agreement and is often associated with the friendliness and politeness of Minnesotans."
Minnesota,"4. Nasalization: Minnesotans also tend to nasalize certain vowel sounds. This means they pronounce vowels with a slight nasal quality, such as in words like ""pan"" or ""man."""
Minnesota,"5. Lexical items: Minnesota English has some unique vocabulary and lexical items. For example, the word ""uff da"" is commonly used to express surprise, exhaustion, or frustration. Additionally, terms like ""hot dish"" (casserole), ""pop"" (soda), and ""Duck Duck Gray Duck"" (instead of ""Duck Duck Goose"") are also specific to Minnesota English."
Mississippi,"1. Pronunciation of /a/: One key feature of Mississippi English is the pronunciation of /a/ as a diphthong similar to /ai/. For example, the word ""cat"" may be pronounced as ""cai-at."""
Mississippi,"2. Vowel merger: Mississippi English is known for a merger of vowel sounds in certain words. For instance, the vowels in ""pin"" and ""pen"" are pronounced the same way, where both words may sound like ""pin."""
Mississippi,"3. Dropping of final consonants: In certain contexts, speakers of Mississippi English tend to drop final consonants, especially in word-final clusters. For instance, ""cold"" may be pronounced as ""co."""
Mississippi,"4. R-dropping: Another key feature of Mississippi English is the dropping of the /r/ sound in words that end with /r/. For example, ""car"" may be pronounced as ""ca."""
Mississippi,"5. Vocabulary: Mississippi English has a distinctive vocabulary, influenced by the region's history and cultural diversity. For instance, words like ""y'all"" (you all), ""fixin'"" (preparing), or ""tump"" (to overturn) are commonly used in Mississippi English."
Missouri,"1. Nasalization: One prominent feature of Missouri English is the nasalization of vowels, particularly in the Kansas City and St. Louis regions. This means that vowels before nasal consonants, such as /m/, /n/, and /ŋ/, are pronounced with a nasal quality. For example, the word ""pen"" might be pronounced more like ""pin."""
Missouri,"2. The cot-caught merger: Missouri English is characterized by the cot-caught merger, wherein the vowels /ɑ/ (as in ""cot"") and /ɔ/ (as in ""caught"") are pronounced the same. This means that words like ""hot"" and ""caught"" are pronounced with the same vowel sound, often as /ɑ/."
Missouri,"3. The Mary-marry-merry merger: A common feature in Missouri English is the merger of the ""Mary,"" ""marry,"" and ""merry"" vowel sounds. In standard American English, these three words have distinct vowel sounds /eə/, /æ/, and /ɛ/, respectively. However, in Missouri English, these sounds are often merged, resulting in all three words being pronounced with the same vowel sound."
Missouri,"4. T-glottalization: In some regions of Missouri, such as around St. Louis, the ""t"" sound in words like ""better"" or ""water"" is pronounced as a glottal stop /ʔ/ instead of a regular /t/. This means that the word ""better"" might be pronounced more like ""beʔer."""
Missouri,"5. The presence of Midland characteristics: Missouri English is also influenced by Midland dialect features, which include a lack of noticeable regional accent and a relatively unmarked pronunciation. This means that Missouri English may resemble a less distinct, more standardized form of American English compared to other regional dialects."
Montana,"1. Vowel Merger: One of the distinctive features of Montana English is the vowel merger, particularly the merging of the vowels in the words ""cot"" and ""caught."" This means that speakers of Montana English often pronounce both vowels with the same sound."
Montana,2. Flat Intonation: Montana English is characterized by a relatively flat intonation pattern. This means that speakers tend to have less variation in the pitch of their voice compared to other English dialects. The flat intonation can give Montana English a more monotone or even-keeled sound.
Montana,"3. Nasalization: Another feature of Montana English is the nasalization of vowels. Speakers may nasalize certain vowels, particularly when followed by nasal consonants such as ""m"" or ""n."" This can give a distinct quality to the pronunciation of words."
Montana,"4. Pronunciation of ""r"": Montana English exhibits rhotic pronunciation, where the ""r"" sound is pronounced at the end of words and syllables. However, the ""r"" sound can sometimes be softened or dropped in certain contexts, as is common in many North American English dialects."
Montana,"5. Lexical Influences: Montana English has been influenced by lexical items and phrases specific to the region. For example, terms related to ranching, outdoors activities, and the natural landscape are often used in everyday language. Additionally, words and phrases from Native American languages spoken in Montana, such as various Salish languages or Crow, may also be incorporated into Montana English."
Nebraska,"1. ""Flat A"" vowel: One distinct feature of Nebraska English is the pronunciation of the ""a"" vowel in words like cat, bag, and hat. It is often pronounced with a flatter sound compared to other dialects, making it closer to the ""æ"" sound found in words like apple or bat."
Nebraska,"2. ""Pin-pen"" merger: Many Nebraskans merge the pronunciation of the ""i"" vowel in words like pin and the ""e"" vowel in words like pen. Both words are pronounced with the same vowel sound, commonly referred to as the ""short i"" sound."
Nebraska,"3. Nasalization: The speech of some Nebraskans tends to have nasalization, meaning that the sound is produced through the nose as well as the mouth. This can be particularly noticeable in words like ""long,"" where the ""o"" vowel may have a nasal quality."
Nebraska,"4. Non-rhoticity: Nebraska English is generally non-rhotic, meaning that the ""r"" sound at the end of words or before consonants is often not pronounced. For example, words like ""car"" may be pronounced as ""cah"" or ""paht"" instead of ""car"" or ""part."""
Nebraska,"5. Vocabulary and idiomatic expressions: Nebraska English has its own unique vocabulary and idiomatic expressions. For example, terms like ""catty-corner"" (meaning diagonal), ""jimmies"" (sprinkles), or ""pop"" (soda) are commonly used in the state. These regional terms and expressions contribute to the distinct linguistic feature of Nebraska English."
Nevada,"1. Vowel Shift: One key linguistic feature of Nevada English is the vowel shift. This is characterized by the pronunciation of certain vowel sounds differently compared to other dialects. For example, the ""o"" sound in words like ""cot"" and ""caught"" is often merged, resulting in the same pronunciation for both words."
Nevada,"2. Intonation Patterns: Another feature of Nevada English is its unique intonation patterns. Speakers often have a distinctive rise in pitch towards the end of a sentence, which can give their speech a sing-song quality."
Nevada,"3. Lexical Borrowings: Nevada English incorporates lexical borrowings from Spanish and Native American languages that have historically influenced the region. Words like ""arroyo,"" ""mesquite,"" and ""adobe"" are commonly used and have become part of the Nevada English lexicon."
Nevada,"4. Dropping of G: A common feature of Nevada English, particularly in informal speech, is the dropping of the ""g"" sound at the end of words ending in ""-ing."" For example, ""fishing"" may be pronounced as ""fishin'"" or ""running"" as ""runnin'."""
Nevada,"5. Mining Jargon: Being a historically significant mining state, Nevada English incorporates mining jargon into its lexicon. Terms such as ""claim,"" ""prospector,"" and ""panning"" may be used uniquely or have specific meanings in the context of Nevada English due to their association with the mining industry in the region."
New Hampshire,"1. Nasalization: New Hampshire English is known for its distinctive nasalized vowels, especially the /æ/ sound. This means that words like ""cat"" may be pronounced with a nasalized ""a"" sound, resulting in something closer to ""ca-aht."""
New Hampshire,"2. R-dropping: Similar to other New England accents, New Hampshire English displays a tendency to drop the /r/ sound at the end of words and syllables. This can be heard in words like ""car,"" which can sound more like ""cah."""
New Hampshire,"3. Vocabulary: New Hampshire dialect includes some unique regional vocabulary. For example, ""wicked"" is commonly used as an intensifier, such as ""wicked cold"" meaning very cold. ""Jimmies"" are chocolate or rainbow-colored sprinkles used as ice cream toppings."
New Hampshire,"4. Pronunciation of certain words: New Hampshire English also exhibits distinct pronunciations for some specific words. For instance, ""mountain"" is often pronounced as ""moun-ten"" rather than ""moun-tin."" ""Chowder"" may be pronounced with an ""au"" sound, becoming ""chow-dah."""
New Hampshire,"5. Flattened vowels: In New Hampshire English, vowels tend to be pronounced with a more flattened or centralized quality. This means that the vowel sounds in words like ""cot"" and ""caught"" may sound similar or even merge, resulting in a pronunciation like ""cawt"" for both."
New Jersey,"1. Pronunciation: One key linguistic feature of New Jersey English is the pronunciation of certain vowel sounds. For example, the vowel in words like ""coffee"" and ""dog"" is often pronounced as a ""aw"" sound, known as the ""cot-caught merger."" This means that the vowels in words like ""caught"" and ""cot"" are pronounced the same way, as opposed to in other varieties of English where they are pronounced differently."
New Jersey,"2. Vocabulary: New Jersey English includes certain unique vocabulary items or regionalisms. For instance, ""jughandle"" is a term used to describe the road system used for making left turns, rather than making a direct left turn at an intersection. Similarly, the use of terms like ""sub"" instead of ""hoagie"" or ""grinder"" to refer to a long sandwich is also a characteristic of New Jersey English."
New Jersey,"3. Syntax: The syntax or word order of New Jersey English can also display some distinguishing features. For instance, the use of ""The"" before a highway number is typical in New Jersey, as in ""Take the Interstate 95"" instead of simply saying ""Take Interstate 95."""
New Jersey,"4. Rhoticity: New Jersey English is generally rhotic, meaning that the ""r"" sound is pronounced at the end of words and before consonants. This contrasts with non-rhotic varieties of English, where the ""r"" sound is often dropped in these positions."
New Jersey,"5. Intonation: The intonation patterns of New Jersey English can differ from other varieties of English. For instance, the use of rising intonation at the end of sentences, similar to a question, is sometimes characteristic of New Jersey speech. Additionally, New Jersey English speakers may employ slight pitch raises or falls in certain words or phrases for emphasis or to convey emotion."
New Mexico,"1. Vowel Merger: One of the distinctive linguistic features of New Mexico English is the vowel merger, specifically the merger of the vowels in words like ""cot"" and ""caught"" for many speakers. This means that the vowel sounds /ɑ/ and /ɔ/ are pronounced the same way, typically as [ɑ]."
New Mexico,"2. Spanish Influence: Due to the historical and ongoing presence of Spanish in New Mexico, there are several linguistic features influenced by the Spanish language. This includes the pronunciation of certain consonants, such as the ""r"" sound which is typically trilled or tapped, similar to the Spanish pronunciation. There are also borrowings and code-switching between Spanish and English, where some Spanish words or phrases are incorporated into English speech."
New Mexico,"3. Yod-Dropping: In New Mexico English, the /j/ sound, known as the ""yod,"" is often dropped or reduced when it occurs before the sound /u/. For example, in words like ""tune"" or ""duty,"" the ""y"" sound is often not pronounced, resulting in [tuːn] or [duːti]."
New Mexico,"4. Lexical Differences: New Mexico English has various lexical differences compared to other varieties of English. For example, ""arroyo"" refers to a stream or gully, ""acequia"" refers to an irrigation ditch, and ""plaza"" refers to a public square. These terms come from Spanish and are commonly used in New Mexico."
New Mexico,"5. Melodic Accent: New Mexican English exhibits a distinctive melodic accent or intonation pattern. This involves a higher pitch accent on the stressed syllables, particularly on content words. The intonation tends to be more musical and rhythmic compared to other dialects of English."
New Mexico,It is important to note that New Mexico English encompasses a range of linguistic features and variations within the state. These features may be more prevalent or noticeable in certain regions or among specific communities of speakers.
New York,"1. Non-rhoticity: One prominent feature of New York English is the non-rhotic pronunciation, where the /r/ sound is either reduced or eliminated at the end of syllables and words. For example, ""car"" may be pronounced as ""cah"" or ""butter"" as ""budda."""
New York,"2. Nasal vowels: New York English is known for its nasalized vowels, particularly the ""a"" sound. For instance, ""cat"" can be pronounced as ""cæt"" with a nasalized ""æ"" sound instead of a more standard pronunciation of ""kæt."""
New York,"3. Cot-caught vowel distinction: Many New Yorkers have a merged vowel pronunciation for words like ""cot"" and ""caught."" Instead of distinguishing between the two sounds, they may pronounce them both as ""cot"" or ""caught"" with a sound closer to ""cot."""
New York,"4. T-glottalization: In New York English, the /t/ sound may be pronounced as a glottal stop /ʔ/ rather than a true /t/. This means that words like ""bottle"" or ""water"" can sound like ""boʔle"" and ""waʔer"" respectively."
New York,"5. A-prefixing: Another feature of New York English is the use of the prefix ""a-"" before verbs to indicate ongoing or continuous action. For example, instead of saying ""I'm walking,"" a speaker might say ""I'm a-walkin'"" or ""She's a-talkin'"" to convey ongoing action."
North Carolina,"1. Southern Vowel Shift: One characteristic feature of North Carolina English is the Southern Vowel Shift, which involves shifts in vowel pronunciation. For example, the vowel sound in words like ""cat"" and ""trap"" may be pronounced more open, sounding more like ""keat"" and ""treap"" respectively."
North Carolina,"2. Palatalization of /r/: In many parts of North Carolina, the /r/ sound is palatalized or ""softened."" This means that speakers may pronounce the /r/ sound as a slight ""y"" or ""w"" sound, particularly when it appears after a vowel. For example, ""car"" may sound like ""cay-uh"" or ""cah-wuh."""
