state,feature
Kentucky,"3. Monophthongization: A distinctive feature of Kentucky English is the monophthongization of certain diphthongs. For instance, the /aɪ/ diphthong in words like ""ride"" and ""time"" is sometimes pronounced as a single vowel, similar to the ""ah"" sound in ""father."""
Kentucky,"4. Lexical Variation: Kentucky English displays unique lexical variations, such as using terms like ""holler"" (for a small, narrow valley) or ""crick"" (instead of ""creek"") for a small stream. These regional terms are specific to certain areas of Kentucky and reflect the local cultural and linguistic heritage."
Kentucky,"5. Syntactic Patterns: Kentucky English exhibits some distinct syntactic patterns as well. One example is the usage of ""might could"" as a modal construction, meaning ""might be able to"" or ""possibly can."" For instance, a Kentuckian might say, ""I might could go to the store later"" instead of ""I might be able to go to the store later."""
Louisiana,"1. Vowel Shift: Louisiana English is known for its unique vowel shift, particularly the merger of the vowel sounds in words like ""caught"" and ""cot"". This results in a pronunciation similar to ""caht"" for both words."
Louisiana,"2. Yat Accent: The ""yat"" accent, primarily found in and around New Orleans, is characterized by features such as the dropping of the final ""r"" sound and the substitution of ""th"" with ""d"". For example, ""car"" may be pronounced as ""cah"" and ""this"" as ""dis""."
Louisiana,"3. French Influence: Due to Louisiana's historical ties with French-speaking settlers, Louisiana English has also been influenced by French. This includes borrowings from French vocabulary and certain phonetic features, such as the tendency to pronounce ""v"" as ""w""."
Louisiana,"4. Cajun English: In the Acadian region of Louisiana, specifically among Cajun populations, Cajun English has developed as a distinct variety. It is characterized by features such as a strong, distinctive accent, the use of French-based vocabulary, and syntactic structures influenced by French."
Louisiana,"5. Creole Influence: The influence of Louisiana Creole, a language descended from French and primarily spoken by African-American communities in the state, is evident in Louisiana English. This can be seen in vocabulary borrowings, such as ""gumbo"" and ""okra"", as well as certain grammatical and syntactic structures."
Maine,"1. Non-rhotic accent: One of the most distinctive features of Maine English is the non-rhotic accent, where the post-vocalic ""r"" sound is often dropped or only lightly pronounced. For example, ""car"" may sound like ""cah"" and ""park"" like ""pahk."""
Maine,"2. Vocabulary: Maine English has a unique vocabulary, influenced by regional traditions and the state's maritime history. Words like ""barnacle,"" ""lobstah,"" ""downeast"" (referring to the eastern coastal regions), and ""wicked"" (meaning ""very"" or ""extremely"") are commonly used in everyday conversation."
Maine,"3. Pronunciation of consonants: Mainers often exhibit a noticeable pronunciation of certain consonants. For instance, the ""t"" sound in words like ""mountain,"" ""button,"" or ""kitten"" can be replaced with a glottal stop, resulting in pronunciations like ""moun'in,"" ""bu'un,"" and ""ki'in."""
Maine,"4. Vowel shifts: Maine English features distinctive vowel shifts, particularly in the caught/cot and father/bother mergers. The caught/cot merger means that Mainers pronounce words like ""cot"" and ""caught"" the same way, while the father/bother merger leads to the pronunciation of both words as ""fah-thuh."""
Maine,"5. Intonation and rhythm: The intonation and rhythm of Maine English are often noted as distinct. Mainers may have a tendency to use a ""downeast"" intonation pattern, where the pitch tends to fall at the end of a sentence. The rhythm of speech can also be slower and more deliberate compared to other regional accents."
Maryland,"1. Raised ""o"": One distinctive feature of Maryland English is the raised ""o"" vowel sound. Words like ""dog"" and ""coffee"" are pronounced with a raised ""o"" sound, similar to the vowel in ""caught"" or ""law."""
Maryland,"2. Nasalization: Maryland English exhibits a slight degree of nasalization, particularly in vowels before nasal consonants. For example, words like ""man"" and ""ran"" may be pronounced with a nasal quality."
Maryland,"3. Non-rhoticity: Like many other East Coast dialects, Maryland English is non-rhotic, meaning that the ""r"" sound is not pronounced at the end of words or before consonants. Thus, words such as ""car"" or ""better"" may be pronounced without the ""r"" sound or with a soft, almost imperceptible ""r."""
Maryland,"4. /ɪər/ merger: Maryland English often exhibits the merger of the /ɪər/ vowel sound with the /ɛr/ sound. Words such as ""mirror"" and ""year"" may be pronounced with the same /ɛr/ sound."
Maryland,"5. Vocabulary: Maryland English has a unique vocabulary influenced by both Southern and Mid-Atlantic dialects. For example, terms like ""hon"" (a friendly term for a woman), ""downy oshun"" (referring to the Chesapeake Bay), and ""stoop"" (referring to a porch or steps) are commonly used in the region."
Massachusetts,"1. Non-rhoticity: Like many other dialects in the northeastern United States, Massachusetts English is traditionally non-rhotic. This means that the ""r"" sound is either pronounced as a soft /ɹ/ or omitted entirely at the end of a syllable, such as in words like ""car"" pronounced as ""cah."""
Massachusetts,"2. Fronted /oʊ/: Massachusetts English features a characteristic vowel shift known as the ""Eastern New England shift."" This shift involves the fronting of the /oʊ/ vowel sound, so words like ""boat"" are pronounced as ""boht"" or ""bowt."""
Massachusetts,"3. Broad ""a"": Another notable feature of Massachusetts English is the use of a broad ""a"" sound, particularly in certain words like ""father"" pronounced as ""fah-thah,"" ""bath"" pronounced as ""bahth,"" or ""dance"" pronounced as ""dahnce."""
Massachusetts,"4. Vowel mergers: Massachusetts English exhibits certain vowel mergers, similar to other dialects in the region. For example, the ""caught-cot"" merger results in the pronunciation of both words as ""cot."" Additionally, the ""Mary-marry-merry"" merger might lead to the same pronunciation for all three words."
Massachusetts,"5. Vocabulary and expressions: Massachusetts English is characterized by its unique vocabulary and expressions. For example, the use of ""wicked"" as an intensifier, meaning ""very"" (e.g., ""wicked hot"" for ""very hot""). The term ""frappe"" is also commonly used instead of ""milkshake."" Additionally, Massachusetts English includes regional terms like ""P-town"" for Provincetown and ""Southie"" for South Boston."
Michigan,"1. The Northern Cities Vowel Shift (NCVS): One of the most prominent linguistic features of Michigan English is the NCVS, a vowel shift that affects the pronunciation of several vowel sounds. For example, the ""short a"" sound in words like ""cat"" is pronounced more like ""eh"" (e.g., ""cet""). Similarly, the ""short o"" sound in words like ""not"" is pronounced more like ""ah"" (e.g., ""naht"")."
Michigan,"2. Canadian Raising: Due to its proximity to Canada, Michigan English exhibits Canadian Raising, which affects the pronunciation of certain diphthongs. In words like ""about"" or ""house,"" for instance, the diphthongs are pronounced with a higher starting point than in standard American English."
Michigan,"3. The ""Yoopers"" Accent: The residents of Michigan's Upper Peninsula, often referred to as ""Yoopers,"" have their own distinct accent. Features of this accent include a more pronounced rounding of the ""o"" sound (e.g., ""boat"" sounds like ""boht""), a slight Canadian-like raising of the ""a"" sound, and an elongation of vowel sounds in general."
Michigan,"4. Nasalization: Michigan English speakers often nasalize certain vowels, particularly the ""short a"" sound. This means that the sound is produced through the nose rather than solely through the mouth. For example, the word ""bag"" may sound more like ""baeg."""
Michigan,"5. ""Da"" instead of ""The"": In some varieties of Michigan English, especially in heavily urban areas, the word ""the"" is often pronounced as ""da."" This is an example of the Northern Cities Vowel Shift influencing another aspect of speech. So, for instance, ""the car"" would be pronounced as ""da car."""
Minnesota,"1. Minnesota Vowel Shift: One prominent linguistic feature in Minnesota English is the Minnesota Vowel Shift. This shift affects the pronunciation of several vowel sounds, including the short ""a"" sound, which is commonly pronounced as a nasalized ""æ"" sound (e.g., ""bag"" sounds like ""beg""). Additionally, the ""o"" sound can shift towards a nasalized ""oʊ"" sound (e.g., ""cot"" sounds like ""coat"")."
Minnesota,"2. Rhoticity: Minnesota English is generally characterized by rhoticity, meaning that /r/ sounds are pronounced in all situations. Unlike some other dialects where /r/ might be dropped in certain positions (e.g., ""car"" pronounced as ""cah""), in Minnesota English, the /r/ sound is preserved consistently."
Minnesota,"3. Monophthongs in tense vowels: Minnesota English also tends to have monophthongs rather than diphthongs in certain tense vowel sounds. For instance, the ""ai"" sound in words like ""ride"" is typically pronounced as a pure vowel instead of a diphthong (e.g., ""ride"" may sound like ""raad"")."
Minnesota,"4. Nasalization: Another distinguishing feature of Minnesota English is the nasalization of certain vowel sounds. This means that sounds that are typically pronounced with air flow through the nose (such as ""n"" and ""m"") can affect the surrounding vowel sounds, making them nasalized (e.g., ""hat"" may sound like ""hæt̬"")."
Minnesota,"5. Lexical items: Minnesota English has some unique lexical items and regional vocabulary. For example, the term ""hot dish"" is commonly used to refer to a casserole, and the word ""pop"" is often used instead of ""soda"" to refer to carbonated beverages. Local flora and fauna may also have regionally specific names, such as ""skunk cabbage"" referring to a plant known as Symplocarpus foetidus."
Minnesota,It's important to note that these features may vary in intensity and usage among different speakers and regions within Minnesota.
Mississippi,"1. Southern Vowel Shift: Mississippi English exhibits the Southern Vowel Shift, a phonological phenomenon commonly found in the Southern United States. This shift affects the pronunciation of certain vowels, such as the /aɪ/ diphthong, which is often pronounced as a monophthong /aː/ (""ride"" becomes ""rad"")."
Mississippi,"2. Rhoticity: Mississippi English is rhotic, meaning that the /r/ sound is consistently pronounced at the end of syllables and words. This contrasts with non-rhotic accents, where the /r/ sound is often dropped."
Mississippi,"3. Pin-pen merger: Like many other Southern dialects, Mississippi English merges the distinct vowel sounds of ""pin"" and ""pen."" Both words are pronounced with the same vowel sound, typically represented by /ɪ/ (""pen"" and ""pin"" are homophones)."
Mississippi,"4. Y'all: Mississippi English, like other Southern dialects, commonly uses the term ""y'all"" as a second-person plural pronoun. It is a contraction of ""you all"" and is used extensively in both casual and formal speech."
Mississippi,"5. Southern lexicon: Mississippi English includes unique vocabulary and expressions that are distinct to the region. These terms reflect the cultural and historical influences of Mississippi and the Deep South, including words like ""holler"" (a small valley), ""fixin'"" (getting ready to do something), and ""grits"" (a corn-based food)."
Missouri,"1. The Missouri Shift: One key linguistic feature of Missouri English is the pronunciation shift known as the ""Missouri Shift."" This shift involves the raising and fronting of certain vowel sounds, particularly the ""a"" sound. For example, ""cat"" might be pronounced as ""ket"" and ""bag"" as ""beg"" in Missouri English."
Missouri,"2. Nasalization: Another distinctive feature of Missouri English is nasalization, where sounds become nasalized or ""nose-like"" in pronunciation. This can be observed in words like ""can"" or ""man."""
Missouri,"3. Rounded ""o"": Missouri English often features a rounded or ""backed"" pronunciation of the vowel sound ""o."" Words like ""dog"" or ""coffee"" may be pronounced with a more rounded vowel, closer to ""dawg"" or ""cawffee."""
Missouri,"4. Yod-Dropping: Yod-dropping refers to the omission of the /j/ sound (or y-sound) before a vowel or syllabic /l/. This is commonly heard in words like ""tune"" pronounced as ""toon"" or ""duel"" pronounced as ""dool."""
Missouri,"5. Syllable merger: Missouri English may exhibit a merger of certain syllables, specifically the merger of the ""pin"" and ""pen"" sounds. This means that speakers of Missouri English may pronounce words like ""pen"" and ""pin"" similarly, sounding like ""pin"" for both words."
Montana,"1. Vowel pronunciation: Montana English is characterized by certain vowel shifts. For example, the ""a"" sound in words like ""cat"" and ""hat"" is often pronounced more like an ""a"" in words like ""father"" and ""bath."" This is known as the ""cat-hat merger."""
Montana,"2. Nasal vowels: Another feature of Montana English is the use of nasal vowels. For instance, words like ""pen"" and ""pin"" may be pronounced with a nasalized ""i"" sound, similar to the French ""un."""
Montana,"3. Rhoticity: Montana English is also rhotic, meaning that the ""r"" sound is consistently pronounced at the end of words and syllables. This is in contrast to non-rhotic dialects, where the ""r"" sound is often dropped (e.g., ""car"" pronounced as ""cah"")."
Montana,"4. Vocabulary: Montana English has its own set of regional vocabulary that is distinct from other English dialects. For example, terms like ""gee-up"" (encouragement to a horse to go faster), ""chote"" (a young bull), and ""honyocker"" (a newcomer or short-term resident) are commonly used in Montana."
Montana,"5. Syntax and grammar: Montana English exhibits certain syntactic and grammatical features. It may employ double negatives, such as ""I didn't see nobody,"" and use different prepositions than other dialects. For instance, instead of ""on the weekend,"" someone from Montana might say ""at the weekend."""
Nebraska,"1. Vowel mergers: One prominent linguistic feature of Nebraska English is the merger of certain vowel sounds. For instance, the ""cot"" and ""caught"" vowels tend to merge into a single vowel, resulting in words like ""don"" and ""dawn"" sounding the same."
Nebraska,"2. Nasalization of vowels: Nebraska English often exhibits nasalization of vowels, where nasal sounds from neighboring consonants affect the quality of the vowel pronunciation. This can be heard, for example, in words like ""man"" sounding more like ""mahn."""
Nebraska,"3. Pronunciation of ""a"" and ""o"": Nebraskans tend to pronounce the short ""a"" sound as a slightly more rounded vowel, giving words such as ""bag"" and ""cat"" a distinct pronunciation. Similarly, the vowel sound in words like ""cot"" and ""lot"" may be more open and rounded compared to other regional accents."
Nebraska,"4. ""R"" pronunciations: In Nebraska English, the postvocalic ""r"" is often dropped or pronounced with a retroflex sound. This means that words like ""car"" and ""farm"" may be pronounced more like ""cah"" and ""fahm"" respectively."
Nebraska,"5. Lexical differences: Nebraska English features some unique vocabulary and lexical choices. For instance, Nebraskans might use terms like ""diner"" instead of ""restaurant"" or ""pop"" instead of ""soda"" to refer to carbonated beverages. Additionally, there may be specific regional vocabulary related to agricultural practices and the natural environment of the state."
Nevada,"1. Vowel Shift: One key linguistic feature of Nevada English is the vowel shift, specifically in regard to the pronunciation of the ""a"" vowel sound. Many speakers in Nevada tend to pronounce the ""a"" sound in words like ""cat"" or ""can"" with a more open and central quality, often sounding closer to the ""ah"" sound."
Nevada,"2. Syllable Reduction: Another prominent feature of Nevada English is syllable reduction, where certain syllables in words are reduced or even omitted. This often occurs with unstressed syllables, resulting in words like ""camera"" being pronounced as ""cam-ra"" or ""important"" as ""im-por-nt."""
Nevada,"3. Flap T: Nevada English is known to have a unique pronunciation of the ""t"" sound when it appears between vowels. Instead of a clear ""t"" sound, it is often pronounced as a ""flap"" or ""tap"" sound, similar to the ""d"" sound. For example, the word ""water"" may be pronounced as ""wader."""
Nevada,"4. Vocabulary: The vocabulary used in Nevada English can differ from other regional dialects. Certain terms and phrases may be unique to the state or associated with specific industries or activities, such as ""casino,"" ""slot machine,"" or ""the Strip"" when referring to Las Vegas."
Nevada,"5. Spanish Influence: Given Nevada's proximity to the Spanish-speaking border region, Spanish influence is also seen in Nevada English. Some speakers may incorporate Spanish words or phrases into their speech, or borrow Spanish phonetic features, such as rolling the ""r"" sound in words like ""car"" or ""park."" This influence is more noticeable among bilingual speakers or those with a Spanish-speaking background."
New Hampshire,"1. Non-rhotic pronunciation: New Hampshire English is characterized by a non-rhotic accent, where the ""r"" sound is often dropped or weakened at the end of words or syllables. For example, ""car"" may be pronounced as ""cah""."
New Hampshire,"2. Northern Cities Vowel Shift: New Hampshire English is influenced by the Northern Cities Vowel Shift, which results in vowel sounds shifting in certain words. For example, the ""a"" sound in words like ""cat"" and ""hat"" may be raised and fronted, sounding more like ""keht"" and ""het""."
New Hampshire,"3. Centralization of vowels: In New Hampshire English, vowels may be centralized or pronounced more towards the center of the mouth. This can be observed in words like ""cot"" and ""caught"", where the vowel sounds may be pronounced similarly."
New Hampshire,"4. Use of the word ""wicked"": New Hampshire English often uses the word ""wicked"" as an intensifier, similar to ""very"" or ""extremely"". For example, ""That movie was wicked good!"" means ""That movie was very good!""."
New Hampshire,"5. Vocabulary and lexical items: New Hampshire English includes some regional vocabulary and lexical items that are specific to the area. For example, ""penny candy"" refers to individually wrapped pieces of inexpensive candy, and ""bubbler"" is used to describe a drinking fountain. These words may not be commonly used in other regional dialects."
New Jersey,"1. The pronunciation of vowels: New Jersey English is characterized by the ""cot-caught"" merger, where the vowels in the words like ""cot"" and ""caught"" are pronounced the same way, typically as a rounded vowel similar to ""aw."" Additionally, the vowel in words like ""coffee"" or ""dog"" may be pronounced as a nasalized vowel, resembling ""aw"" but with a slight ""ng"" sound at the end."
New Jersey,"2. Rhoticity: New Jersey English maintains final /r/ sounds, which means words like ""car"" and ""park"" are pronounced with a distinct ""r"" sound at the end. This is in contrast to non-rhotic accents, where the /r/ sound is often dropped or modified."
New Jersey,"3. Vocabulary: New Jersey English has several regional words and phrases that are unique to the area. For example, ""jughandle"" refers to a type of highway ramp, ""down the shore"" is used to describe going to the beach, ""pork roll"" refers to a type of processed meat, and ""weird or wild"" is used as an intensifier in phrases like ""that's weird or wild."""
New Jersey,"4. Use of ""the"" with highways: In New Jersey English, it is common to use the definite article ""the"" before highway names. For example, one might say ""I'm taking the Turnpike"" or ""I got stuck on the Parkway."" This is different from many other varieties of American English where the definite article is typically omitted."
New Jersey,"5. Intonational patterns: New Jersey English often includes distinct intonational patterns. There may be a tendency to use a rising pitch at the end of sentences, which can give the impression of a question, even in declarative statements. This intonation is sometimes referred to as the ""Jersey question"" or ""up-talk."" Additionally, there may be a slight emphasis on certain syllables, which can give a noticeable rhythm to New Jersey English speech."
New Mexico,"1. Spanish loanwords and expressions: Due to historical and cultural connections with Spanish-speaking populations, New Mexico English incorporates numerous Spanish loanwords and expressions. These can be seen in everyday vocabulary, such as ""gracias"" (thank you), ""adios"" (goodbye), and ""hola"" (hello)."
New Mexico,"2. Pronunciation: New Mexico English exhibits unique phonetic features, including a tendency to retain Spanish-influenced pronunciation patterns. For instance, speakers may use an alveolar tap or trill for the English ""r"" sound, resulting in pronunciations like ""car"" with a rolled ""r"" sound instead of the typical English ""r"" sound."
New Mexico,"3. Vocabulary: New Mexico English has distinct vocabulary influenced by the region's diverse cultural history. Terms related to Native American culture, Mexican cuisine, and local geographical features are commonly used. Examples include ""arroyo"" (a dry creek bed) and ""chile"" (referring to the spicy pepper, often used as a topping or ingredient in local dishes)."
New Mexico,"4. Incorporation of Native American languages: As New Mexico is home to several Native American communities, the English spoken in this region may also showcase influence from local Native American languages. This can manifest in the use of Native American names for places or borrowings from languages like Navajo, Apache, or Pueblo dialects."
New Mexico,"5. Syntax and grammar: New Mexico English displays certain syntactic and grammatical features that differ from Standard American English. For instance, double negatives are more commonly used, such as ""I don't have none"" instead of ""I don't have any."" Additionally, the use of ""ustedes"" (a formal second-person plural pronoun) is more widespread in New Mexico English compared to other varieties of English spoken in the United States."
New York,"1. Non-rhoticity: One key linguistic feature of New York English is the non-rhotic pronunciation, where the ""r"" sound is often dropped at the end of words and syllables. For example, ""car"" is pronounced as ""cah."""
New York,"2. The ""th"" pronunciation: Another feature is the substitution of the ""th"" sound, typically with an ""f"" or ""v"" sound. For example, ""this"" may be pronounced as ""dis"" or ""dat."""
New York,"3. Low back vowel merger: New York English is known for the merger of the vowels in words like ""cot"" and ""caught,"" where both are pronounced with the same vowel sound, often as a nasalized ""aw"" sound."
New York,"4. The hustle and schwa: The vowel in words like ""hustle"" and ""coffee"" is often pronounced as a centralized schwa sound [ə], making it sound like ""hussel"" and ""cawfee."""
New York,"5. The ""aw"" vowel: The ""aw"" vowel sound in words like ""dog"" and ""walk"" is pronounced with a slight nasalization and raised back tongue position, resulting in a unique New York accent."
North Carolina,"1. Southern Vowel Shift: North Carolina English exhibits the Southern Vowel Shift, which involves changes in vowel pronunciation. For example, the ""ah"" sound in words like ""cot"" and ""caught"" are pronounced more similarly, often represented as the ""caught-cot"" merger."
North Carolina,"2. Rhoticity: North Carolina English is a rhotic dialect, meaning that the ""r"" sound is pronounced after vowels, even when it is not indicated in spelling. This is in contrast to non-rhotic dialects where the ""r"" sound is often dropped."
North Carolina,"3. Monophthongs: The pronunciation of certain vowel sounds in North Carolina English can sometimes be different from standard accents. For instance, the ""i"" sound in words like ""ride"" is often pronounced as a monophthong, similar to the ""ah"" sound in words like ""cot."""
North Carolina,"4. Lexical features: North Carolina English has distinct vocabulary that reflects its regional identity. For example, ""barbecue"" is often used to refer to a slow-cooked meat dish, and ""y'all"" is a popular regional term for the second person plural pronoun."
North Carolina,"5. Syntactic patterns: North Carolina English exhibits specific syntactic patterns, such as the use of double modals (e.g., ""might could"" instead of ""might be able to"") and the deletion of the copula in sentences (e.g., ""The car broke down"" instead of ""The car is broken down"")."
North Carolina,These linguistic features are just a snapshot of the unique aspects of North Carolina English and can vary among speakers and regions within the state.
North Dakota,"1) Nasal vowels: One key linguistic feature of North Dakota English is the prominence of nasal vowels. Speakers in this region often produce vowels with a nasal quality, particularly before nasal consonants. For example, the vowel in ""man"" may be pronounced as a nasalized ""æ̃"" sound."
