state,feature
Alabama,"1. Southern Vowel Shift: Alabama English exhibits the Southern vowel shift, which involves changes in the pronunciation of certain vowel sounds. For example, the vowel /aɪ/ (as in ""ride"") is often pronounced as /aː/ (as in ""rod"") in words like ""mice"" or ""right."""
Alabama,"2. Rhoticity: Alabama English is rhotic, meaning that the ""r"" sound is typically pronounced in all positions, including at the end of words. This differs from some other dialects, such as General American English, where the ""r"" is often dropped in certain contexts."
Alabama,"3. Monophthongization of Diphthongs: Alabama English exhibits a tendency to simplify diphthongs into monophthongs. For instance, the diphthong /aɪ/ (as in ""time"") is often pronounced as a long monophthong /aː/ in words like ""five"" or ""ride""."
Alabama,"4. Yod-Dropping: The pronunciation of the consonant cluster ""t + r"" as /t/ is a feature of Alabama English. For example, words like ""tree"" or ""try"" are pronounced as ""tee"" or ""ty"", respectively."
Alabama,"5. High Rising Terminal (HRT): The High Rising Terminal is a rising intonation pattern, often associated with a question-like inflection, that occurs at the end of statements. This feature is commonly found in Alabama English, where speakers may add a rising tone to the end of declarative sentences, as in ""I'm going to the store?"""
Alaska,"1. Phonological features: Alaska English often exhibits a distinct pronunciation pattern. Some common features include the reduction of certain vowel sounds, like the merging of the vowel sounds in words like ""cot"" and ""caught"" or the pronunciation of the ""r"" sound at the end of words."
Alaska,"2. Vocabulary: Alaska English incorporates several vocabulary items that are unique to the region. This includes words from indigenous languages such as Inupiaq, Yup'ik, or Aleut. Additionally, certain terms related to the local environment and culture, such as ""mushing"" (dog sledding) or ""gumboots"" (rubber boots), are commonly used in Alaska English."
Alaska,"3. Idiomatic expressions: Like any regional dialect, Alaska English has its own set of idiomatic expressions that may not be commonly used elsewhere. These expressions often reflect the unique Alaskan lifestyle, such as ""breakup"" (the melting of winter ice) or ""bush"" (referring to rural or remote areas outside of major cities)."
Alaska,"4. Syntax: Alaska English may display distinct sentence structure and word order patterns compared to other varieties of English. For instance, it is not uncommon to hear questions phrased as statements, such as ""You going to town?"" instead of ""Are you going to town?"""
Alaska,"5. Loanwords: Given Alaska's history and multicultural context, Alaska English incorporates loanwords from a variety of languages. For example, words from Russian, such as ""banya"" (steam bath) or ""pribalt"" (a person of Russian or Baltic descent), have found their way into the Alaskan lexicon. Similarly, loanwords from Native American languages, like ""kayak"" or ""igloo,"" are also widely used in Alaska English."
Arizona,"1. Vowel Merger: In Arizona English, there is a tendency to merge certain vowel sounds. For example, the vowels in words like ""cot"" and ""caught"" are often pronounced the same way, resulting in a merger of the /ɑ/ and /ɔ/ sounds. This is known as the cot-caught merger."
Arizona,"2. Fronting of /aʊ/: Another characteristic of Arizona English is the fronting of the /aʊ/ diphthong. Instead of pronouncing words like ""house"" with a back and rounded vowel sound, Arizonans tend to pronounce it with a more fronted sound, making it sound closer to ""hoes""."
Arizona,"3. Flapping of /t/ and /d/: Arizonans often exhibit the flapping phenomenon, where the /t/ and /d/ sounds at the beginning and middle of words are pronounced with a quick, flapped /ɾ/ sound. For instance, words like ""butter"" may sound more like ""budder"" in Arizona English."
Arizona,"4. Use of ""y'all"" or ""you guys"": In Arizona English, it is common for speakers to use the inclusive plural pronouns ""y'all"" or ""you guys"" when referring to a group of people. This usage reflects a blend of different regional influences, including southern and western dialects."
Arizona,"5. Syllable-final /r/ deletion: Similar to other western dialects, Arizona English often involves the deletion of the /r/ sound at the end of syllables. For example, words like ""car"" or ""beer"" may be pronounced as ""cah"" and ""bee,"" respectively. This is known as syllable-final /r/ deletion."
Arkansas,"1. Vowel Shifts: The Arkansas English dialect is characterized by significant vowel shifts, particularly in the pronunciation of the /a/ and /o/ sounds. For example, words like ""cot"" and ""caught"" may be pronounced with the same vowel sound, often closer to the /a/ sound."
Arkansas,"2. Southern Drawl: Like many Southern dialects, Arkansas English is characterized by a distinct southern drawl, which involves elongating and adding a breathy quality to vowel sounds."
Arkansas,"3. Rhoticity: Unlike some Southern dialects, Arkansas English is generally rhotic, meaning that the /r/ sound is pronounced at the end of words and before consonants. For example, ""car"" and ""far"" are pronounced with a distinct /r/ sound."
Arkansas,"4. Grammar: Arkansas English displays certain unique grammatical features. For instance, the use of double modals, such as ""might could"" or ""might would,"" is common in colloquial speech. There may also be a tendency to use the past tense form ""done"" instead of ""did,"" such as in ""I done told you."""
Arkansas,"5. Lexical Items: Arkansas English contains regional vocabulary, with many words having roots in Southern and Ozark Mountain culture. Some examples include ""holler"" (a narrow valley), ""bless your heart"" (a Southern expression of empathy or pity), and ""fixin' to"" (meaning ""about to"" or ""planning on"")."
Arkansas,It's important to note that these features can vary among different speakers in Arkansas and that not all individuals in the state will exhibit every feature listed.
California,"1. Vowel Shift: California English exhibits a vowel shift known as the California Vowel Shift, where certain vowel sounds are pronounced differently compared to other English varieties. For example, the ""a"" sound in words like ""cat"" may be pronounced more like ""a-e"" or ""ae""."
California,"2. Vocal Fry: California English is known for its use of vocal fry, a creaky or low-pitched sound that occurs when speaking. This feature is especially common among younger speakers and is characterized by a crackling or popping quality in the voice."
California,"3. Valleyspeak or Upspeak: California English is associated with the use of a rising intonation at the end of statements, also known as valleyspeak or upspeak. This linguistic feature has become synonymous with the stereotype of Californians ending their sentences as if they were asking a question."
California,"4. Use of Surfer/Skater Slang: Due to the influence of California's surfing and skateboarding culture, California English incorporates various surfers and skaters slang terms. Some examples include ""dude,"" ""gnarly,"" ""rad,"" and ""shred."""
California,"5. Use of Spanglish: California English, particularly in areas with a high Hispanic population, showcases the blending of English and Spanish known as Spanglish. It can involve the use of Spanish words or phrases interspersed within English sentences, or the fusion of English grammar with Spanish vocabulary."
Colorado,"1. The cot-caught merger: In Colorado English, like many Western dialects, the vowels in words like ""cot"" and ""caught"" are often merged, so they sound alike. Instead of distinct pronunciations, both words may be pronounced with the vowel sound of ""cot""."
Colorado,"2. The pin-pen merger: Similar to other Western dialects, Colorado English tends to have a merger of the vowels in words like ""pin"" and ""pen"". This means that the distinction between the vowel sounds in these two words (i.e., the short ""i"" sound in ""pin"" and the short ""e"" sound in ""pen"") is often lost, and both are pronounced with the same vowel sound."
Colorado,"3. Monophthongization of the diphthong /aɪ/: Colorado English exhibits a tendency to simplify the diphthong /aɪ/ (as in ""price"" or ""ride"") into a monophthong, resulting in a pronunciation like [a:]. This is commonly referred to as the ""low-back merger""."
Colorado,"4. Vocabulary and idiomatic expressions: Colorado English incorporates unique vocabulary and idiomatic expressions that may differ from other regions. For example, specific terms related to outdoor activities and mountain region culture, such as ""14er"" (referring to a peak exceeding 14,000 feet in elevation) or ""powder day"" (referring to a snowfall suitable for skiing/snowboarding)."
Colorado,"5. Occasional retention of older English features: Some Colorado English speakers may retain certain archaic features of English, such as pronouncing ""r"" sounds more prominently in words like ""horse"" or ""car"", which is sometimes associated with accents influenced by earlier English dialects. These retention patterns can vary among individuals."
Connecticut,"1. R-dropping: A characteristic feature of Connecticut English is the tendency to drop the /r/ sound at the end of words or syllables. For example, ""car"" may be pronounced as ""caw"" and ""teacher"" as ""teachah."""
Connecticut,"2. Non-rhoticity: Following the pattern of many New England dialects, Connecticut English is non-rhotic, meaning that the /r/ sound is typically not pronounced before a consonant or at the end of a word. This leads to words like ""party"" being pronounced as ""pah-tee."""
Connecticut,"3. ""Ahn"" vowel: Connecticut English exhibits a unique vowel sound in words like ""orange"" and ""horrible,"" where the /ɔ/ sound typically found in standard American English is pronounced as an ""ahn"" sound, similar to the British English pronunciation. So, ""orange"" may be pronounced as ""ahnge"" and ""horrible"" as ""hahn-rible."""
Connecticut,"4. Flattened vowel sounds: Some vowel sounds in Connecticut English can be pronounced with a slightly flattened quality compared to standard American English. For instance, the ""o"" sound in words like ""dog"" may be pronounced as a shorter and flatter sound, more like ""dahg."""
Connecticut,"5. Pronunciation of ""th"": In Connecticut English, the /θ/ and /ð/ sounds, typically represented by the ""th"" letters, may be pronounced differently. The ""th"" sound in words like ""thin"" may be pronounced as a ""t"" sound, so it sounds more like ""tin,"" and the ""th"" sound in words like ""that"" may be pronounced as a ""d"" sound, making it closer to ""dat."""
Delaware,"1. Vowel Pronunciation: Delaware English exhibits several distinct vowel pronunciations compared to other varieties of English. For example, the vowel sound in words like ""cot"" is often realized as a rounded vowel [ɔ], so that ""cot"" sounds more like ""caht."""
Delaware,"2. Non-rhoticity: Delaware English is non-rhotic, meaning the ""r"" sound is not pronounced at the ends of words or before consonants. So, words like ""car"" and ""far"" are pronounced without the final ""r,"" sounding more like ""cah"" and ""fah."""
Delaware,"3. Vocabulary: Delaware English has a number of unique regional words and expressions not commonly found in other varieties of English. For instance, terms like ""wooder"" (water), ""jawn"" (used for referring to a person, place, or thing), and ""hoagie"" (a type of sandwich) are commonly used in Delaware."
Delaware,"4. Midland Grammar: Delaware English is influenced by the grammatical patterns of the Midland dialect, which is characteristic of the central region of the United States. This includes features like using ""to be"" as an auxiliary verb (""The car needs washed"") and double modals (""might could"" instead of ""might be able to"")."
Delaware,"5. Tonal Accent: In Delaware English, there is a distinct tonal accent called the ""Delaware Melody."" It involves marked pitch rises and falls on certain syllables, giving the language a unique musical quality. This tonal accent is reminiscent of the intonation found in some African languages and may be a result of the influence of Delaware's African American heritage."
Florida,"1. Southern Vowel Shift: Florida English exhibits the Southern Vowel Shift, a feature common in Southern dialects. This shift involves changes in vowel pronunciation, such as the raising of the /ɑ/ vowel sound to /æ/ (as in ""cat"" becoming ""kyat"") and the diphthongization of the /eɪ/ sound (as in ""face"" sounding like ""fayce"")."
Florida,"2. Non-rhoticity: Similar to other Southern dialects, Florida English is non-rhotic, meaning that the ""r"" sound at the end of words or before consonants is often not pronounced. For example, ""car"" may be pronounced as ""cah."""
Florida,"3. Pronunciation of ""th"": Many speakers of Florida English, particularly in rural or older generations, may replace the ""th"" sounds with a /d/ or /t/ sound. This results in ""think"" sounding like ""tink"" or ""that"" sounding like ""dat."""
Florida,"4. Use of ""y'all"": Like other Southern states, Florida English often employs the contraction ""y'all"" as a plural form of ""you."" For example, ""Are y'all going to the beach today?"""
Florida,"5. Influence of Spanish: Given Florida's proximity to Spanish-speaking countries, Spanish has had a significant influence on Florida English. Speakers may incorporate Spanish vocabulary or pronunciation into their speech, such as pronouncing the Spanish-derived ""piñata"" as ""pee-NYAH-ta"" instead of ""pi-NAH-ta."""
Georgia,"1. Phonological features: Georgia English has its own distinct phonological system, characterized by features such as the presence of a unique vowel system. For example, the ""a"" vowel is often pronounced as a fronted /æ/ sound, as in ""bad"" being pronounced as ""bed."""
Georgia,"2. Lexical features: Georgia English incorporates a variety of unique lexical items that are specific to the region. These terms may reflect cultural and historical influences, such as words borrowed from Native American languages, or regional food and traditions. For example, ""gator"" for alligator or ""grits"" for a traditional Southern food made from ground corn."
Georgia,"3. Syntactical features: Georgia English exhibits certain syntactical patterns that differ from Standard American English. One common feature is the use of the double modal, where two modal verbs are used together, such as ""might could"" or ""might should"" instead of ""might be able to"" or ""should."" Another feature is the use of ""fixing to"" as a replacement for ""going to"" to express future intentions."
Georgia,"4. Morphological features: Georgia English may exhibit morphological features that differ from other varieties of English. For example, the use of the present progressive form with the word ""be"" omitted, as in ""He talking"" instead of ""He is talking."" This is commonly referred to as the ""zero copula"" or ""be-less"" construction."
Georgia,"5. Intonation features: Intonation patterns in Georgia English can be distinct from other dialects. It may include features such as a rising intonation at the end of statements, particularly among younger speakers. Additionally, there may be variations in pitch accent placement and stress patterns within sentences, contributing to the unique melodic patterns of Georgia English."
Hawaii,"1. Hawaiian Pidgin Influence: The most salient feature of Hawaii English is its strong influence from Hawaiian Pidgin, a creole language spoken in multiethnic communities in Hawaii. Hawaiian Pidgin features include the use of simplified grammar structures, vocabulary borrowings, and unique pronunciation patterns."
Hawaii,"2. Vowel Pronunciation: Hawaii English exhibits distinct vowel pronunciation patterns, particularly with the vowels /a/, /e/, and /o/. For example, the vowel in words like ""can"" and ""man"" may be pronounced as [æ] instead of the standard American English [æ]. Similarly, the vowel in words like ""bed"" and ""said"" may be pronounced as [ɛ] instead of [ɛ] in American English."
Hawaii,"3. Glottal Stop: The glottal stop, represented by the apostrophe symbol (ʻ), is a prominent feature in Hawaii English. It is used to replace the ""t"" sound in words like ""water"" ([wɑʔɛr]) and ""mountain"" ([maʊn.ɨn])."
Hawaii,"4. Lexical Borrowings from Hawaiian: Hawaii English incorporates many loanwords from the Hawaiian language. For example, words like ""aloha,"" ""mahalo,"" and ""luau"" are commonly used in everyday speech, both within and outside of Hawaii."
Hawaii,"5. Cultural References: Hawaii English often includes cultural references specific to the islands, reflecting the unique cultural heritage of Hawaii. This includes terms related to surfing, hula, local cuisine, and other aspects of Hawaiian culture that have become part of the local lexicon."
Idaho,"1. Vowel Shift: One key linguistic feature of Idaho English is the vowel shift, particularly the fronting of the ""a"" vowel sound. Words like ""cat"" may be pronounced with a fronted vowel closer to ""æ"" as in ""cæt"" rather than the more centralized vowel sound found in other dialects."
Idaho,"2. Nasalization: Another notable feature of Idaho English is the nasalization of vowels. Vowels before nasal consonants tend to be nasalized, which means that the airflow passes through the nasal cavity, giving them a distinct sound. For example, the vowel in ""man"" may be pronounced with a nasalized quality."
Idaho,"3. Non-rhoticity: Idaho English displays non-rhoticity, meaning that the ""r"" sound is not pronounced in certain contexts. For instance, the ""r"" at the end of words or syllables is often dropped. Instead of saying ""car,"" someone might say ""cah."""
Idaho,"4. Lexical Features: Idaho English exhibits several lexical features specific to the region. For example, terms like ""potato,"" ""spud,"" or ""tater"" are commonly used to refer to potatoes due to the relevance of potato farming in Idaho. Additionally, Idahoans may also use regional terms like ""buckaroo"" for a cowboy or ""huckleberry"" as a term of endearment."
Idaho,"5. Intonation patterns: Intonation patterns in Idaho English may differ from other dialects. Idahoans tend to have a more relaxed, laid-back intonation, with a slower tempo and a flatter pitch contour compared to other regions. This intonation pattern can give the speech a distinctive, relaxed feel."
Illinois,"1. The nasalization of vowels: One key feature of Illinois English is the nasalization of vowels, which means that vowels often have a nasal quality to them. For example, words like ""man"" and ""bat"" may sound more like ""mahn"" and ""baht"" in the Illinois English dialect."
Illinois,"2. The Northern Cities Vowel Shift (NCS): Another prominent linguistic feature of Illinois English is the presence of the Northern Cities Vowel Shift, which is a vowel shift affecting the short vowel sounds /a/, /e/, /i/, and /o/. This shift causes pronunciation changes such as pronouncing ""pen"" like ""pin"" and ""cot"" like ""cat""."
Illinois,"3. The absence of the cot-caught merger: Unlike some other North American dialects, Illinois English maintains a distinction between the vowel sounds in words like ""cot"" and ""caught"". In this dialect, ""cot"" has a short vowel sound while ""caught"" has a longer vowel sound."
Illinois,"4. The use of the word ""pop"": In many parts of Illinois, particularly in the northern region, the term ""pop"" is commonly used to refer to carbonated beverages, rather than ""soda"" or ""cola"" which are more common in other dialects of English."
Illinois,"5. The pronunciation of ""cot"" and ""caught"" as homophones in some regions: While the absence of the cot-caught merger was mentioned earlier as a feature, it's important to note that the merger does occur in some areas of Illinois. In these regions, the words ""cot"" and ""caught"" are pronounced the same, with a longer vowel sound similar to ""cot""."
Indiana,"1. Indiana Vowel Shift: One of the distinctive features of Indiana English is the vowel shift, particularly in words like ""cot"" and ""caught."" Many speakers in Indiana pronounce the ""ah"" sound (as in ""cot"") and the ""aw"" sound (as in ""caught"") with a similar vowel quality, resulting in a merger of these two vowel sounds. "
Indiana,"2. Hoosier Accent: The Hoosier accent is a regional accent found in Indiana that is characterized by certain vowel and consonant shifts. It includes features such as the lowering of the ""a"" sound (as in ""cat"" pronounced almost like ""ket"") and the pronunciation of certain ""r"" sounds, such as the ""r"" in ""car,"" as more of a rounded vowel sound."
Indiana,"3. Midwest Lexicon: Indiana English incorporates a range of terms and vocabulary that are commonly used in the Midwest region of the United States. This includes words like ""pop"" for soda, ""bubbler"" for water fountain, and ""sack"" for bag. The lexical choices in Indiana English reflect the linguistic heritage and cultural influences of the Midwest."
Indiana,"4. Flat ""a"" Sound: Another notable feature of Indiana English is the pronunciation of the ""a"" sound in certain words. It is often pronounced with a flat sound, represented as the ""æ"" vowel, as in ""cat."" This sound is typically not as ""rounded"" or pronounced as in some other English accents."
Indiana,"5. Nasalization of Vowels: Indiana English exhibits some nasality in vowel sounds. For example, words like ""pen"" may be pronounced with more nasalization, similar to the ""n"" sound in ""sing."" This nasalization feature is also prevalent in other Midwestern accents."
Iowa,"1. The nasal vowels: One notable linguistic feature of Iowa English is the pronunciation of nasal vowels. In Nasalization, vowels, especially the short vowel sounds, are pronounced with a nasal quality, resembling the ""ng"" sound in words like ""sing"" or ""pong."" For example, the word ""pan"" may sound more like ""pang"" in Iowa English."
Iowa,"2. The cot-caught merger: Another distinct feature of Iowa English is the merger of the vowel sounds in the words ""cot"" and ""caught."" In other dialects, these two words have different vowel sounds, but in Iowa English, they are pronounced the same, often with an ""aw"" sound, like in the word ""caught."" "
Iowa,"3. Rhoticity: Iowa English is generally a rhotic dialect, which means that the ""r"" sound is pronounced in words ending in ""r"" and in certain other contexts. This contrasts with non-rhotic dialects where the ""r"" sound is often not pronounced at the ends of words or before consonant sounds."
Iowa,"4. Substitution of ""th"" with ""d"": In Iowa English, the ""th"" sounds (both voiced and voiceless) are often substituted with a ""d"" sound. For example, the word ""this"" may be pronounced more like ""dis,"" and ""three"" may sound more like ""dree."""
Iowa,"5. Lexical peculiarities: Iowa English also has certain unique vocabulary and expressions, which can differ from standard American English or other regional dialects. These lexical features may include specific words or phrases used predominantly in Iowa or the Midwest region, as well as unique place or people names that reflect the local culture. For example, ""hotdish"" is used to describe a casserole dish, and ""Iowa Nice"" refers to the friendly and helpful nature often associated with Iowans."
Kansas,"1. Nasalization: Kansas English is known for its distinctive nasalization, where vowel sounds are pronounced with a nasal quality. For example, the vowel in words like ""cat"" and ""hat"" may be pronounced with more nasal resonance, similar to a slight ""n"" sound."
Kansas,"2. Kansas City Vowel Shift: A notable linguistic feature is the Kansas City Vowel Shift, which affects the pronunciation of certain vowels. This shift involves changes in the pronunciation of the long ""a"" sound, resulting in a more raised and fronted vowel pronunciation, often heard in words like ""bag"" or ""flag."""
Kansas,"3. Rhoticity: Kansas English is generally characterized by rhoticity, meaning that the ""r"" sound is pronounced in words where it is written. This is different from non-rhotic varieties of English, where the ""r"" sound is often dropped or vocalized."
Kansas,"4. Monophthongization: Another feature of Kansas English is the tendency to monophthongize certain diphthongs, particularly the ""oi"" and ""ou"" sounds. Instead of maintaining the glide between the two vowels, Kansas English speakers may pronounce them as single, pure vowel sounds, as in words like ""oil"" or ""out."""
Kansas,"5. Midwestern Accent: Kansas English shares many features with the broader Midwestern accent. This includes features such as the flattening of certain vowel sounds, known as the ""Midwestern flat A"" or ""pure A"" sound, where words like ""cat"" or ""hat"" may be pronounced without the typical raising of the vowel found in other dialects. Additionally, there is often a lack of noticeable regional markers, making it less distinct compared to other regional American English dialects."
Kentucky,"1) Southern Vowel Shift: Kentucky English is characterized by the Southern Vowel Shift, which involves changes in vowel pronunciation. For example, the ""a"" sound in words like ""cat"" is pronounced as a more open, back vowel, similar to ""kyat"" in Kentucky English."
Kentucky,"2) Monophthongization of Diphthongs: Kentucky English often exhibits the monophthongization of diphthongs. In words like ""ride"" or ""fire,"" the diphthong is simplified to a single vowel sound, resulting in pronunciations like ""rahd"" or ""far."""
