state,feature
Kentucky,"3) Rhoticity: Kentucky English is generally rhotic, meaning that the ""r"" sound is consistently pronounced at the end of words and before consonants. This is in contrast to non-rhotic accents found in some other dialects, like those in the American Northeast."
Kentucky,"4) Lexical Differences: Kentucky English has distinct regional vocabulary. Certain words or phrases may be unique to the region or used in different ways. For example, in Kentucky, ""holler"" may be used to describe a small valley or a way of calling out, while in other parts of the country, ""hollow"" or ""shout"" might be used instead."
Kentucky,"5) Grammar and Syntax: Kentucky English may exhibit distinct grammatical and syntactic features. One example is the use of the double modal construction, such as ""might could"" or ""might should"" instead of the standard ""might be able to"" or ""should be able to."" There may also be variation in verb forms and word order, influenced by Appalachian English dialects."
Louisiana,"1) Cajun French Influence: Louisiana English is heavily influenced by Cajun French, a dialect spoken by the Acadian people who settled in Louisiana. This influence can be seen in the pronunciation of certain sounds, such as the use of a fronted /ɔ/ sound in words like ""boat"" (pronounced as ""bout""), as well as the use of French loanwords and phrases."
Louisiana,"2) Vowel Pronunciations: Louisiana English has distinct vowel pronunciations compared to standard American English. One well-known feature is the ""yat"" vowel, where words like ""block"" and ""caught"" are pronounced with a similar vowel sound. Additionally, there is often a merger of the short vowel sounds in words like ""cot"" and ""caught,"" so they are pronounced the same."
Louisiana,"3) Rhoticity: Louisiana English is generally non-rhotic, meaning the ""r"" sound is often not pronounced at the end of words or before a consonant. For example, ""car"" may be pronounced as ""cah."""
Louisiana,"4) Vocabulary and Phrases: Louisiana English incorporates unique vocabulary and phrases, reflecting its cultural and historical influences. For instance, terms like ""lagniappe"" (meaning a little something extra) and ""fais do-do"" (meaning a Cajun dance party) are commonly used."
Louisiana,"5) Grammar: Louisiana English also exhibits distinctive grammatical features. One example is the frequent use of the double-modal construction, where two modal auxiliaries are used together, such as ""might could,"" ""might should,"" or ""might would,"" to express possibility or uncertainty. Another grammatical feature is the use of the present tense ""be"" to indicate ongoing or habitual actions, as in ""I be going to the store"" (meaning ""I frequently go to the store"")."
Maine,"1. R-dropping: One distinguishing feature of Maine English is the tendency to drop the r sound at the end of words or syllables, especially after vowels. For example, ""car"" may be pronounced as ""cah"" and ""water"" as ""watah."""
Maine,"2. Nasalization: Mainers often nasalize vowels, particularly the short ""a"" sound. This means that words like ""cat"" may be pronounced with a nasal quality, sounding more like ""caaat."""
Maine,"3. Fronting of /ɑ/: Instead of pronouncing the vowel /ɑ/ (as in ""father"") with the typical back-of-the-mouth position, Mainers tend to front this sound, making it more like /æ/ (as in ""cat""). So, ""father"" may sound more like ""fatha."""
Maine,"4. Vocabulary: Maine English has its own unique vocabulary, influenced by the region's maritime and rural history. Words like ""lobster,"" ""moxie,"" ""dungarees"" (for pants), and ""bubbler"" (for drinking fountain) are commonly used in Maine but not necessarily in other English dialects."
Maine,"5. Flattening of /ɔ/: Mainers often flatten the vowel /ɔ/ (as in ""caught"" or ""coffee""), making it sound more like /ɒ/ (as in ""cot"" or ""hot""). So, words like ""coffee"" may be pronounced more like ""caw-fee"" or ""cot-fee."""
Maryland,"1. Merger of cot and caught: In Maryland English, speakers typically pronounce the words ""cot"" and ""caught"" with the same vowel sound, resulting in a merger. Both words are pronounced with the vowel sound found in ""caught."" "
Maryland,"2. Non-rhoticity: Speakers of Maryland English often drop the ""r"" sound at the end of words or syllables, which is known as non-rhoticity. For example, ""car"" might be pronounced as ""cah"" and ""party"" as ""pah-ty."""
Maryland,"3. The ""O"" vowel: Maryland English features a distinct pronunciation of the ""O"" vowel in words like ""dog"" and ""coffee."" Instead of a pure ""o"" sound, it is often pronounced as a more central vowel closer to ""ah."" So, ""dog"" might be pronounced as ""dahg"" and ""coffee"" as ""cah-fee."""
Maryland,"4. Fronted /oh/ vowel: The long ""oh"" sound in words like ""boat"" or ""coat"" is often fronted in Maryland English. Instead of pronouncing it as a back vowel, it is pronounced closer to a central vowel, similar to the ""ah"" sound. Thus, ""boat"" might be pronounced as ""baht"" and ""coat"" as ""caht."""
Maryland,"5. Vocabulary and expressions: Maryland English has specific regional vocabulary and expressions that are distinct to the area. For example, the word ""hon"" is frequently used as a term of endearment for someone, and ""downy ocean"" is a colloquial term for the beach or the ocean."
Massachusetts,"1. Non-rhoticity: One of the most distinct features of Massachusetts English is the non-rhotic pronunciation, meaning that the /r/ sound is typically not pronounced at the end of a word or before a consonant. For example, ""car"" may be pronounced as ""cah"" or ""water"" as ""watah."""
Massachusetts,"2. The ""ah"" sound: Another distinctive feature is the pronunciation of the ""a"" sound as an ""ah"" sound. This occurs in words like ""park"" pronounced as ""pahk"" and ""car"" pronounced as ""cah."""
Massachusetts,"3. The ""r"" coloring: Despite the non-rhoticity mentioned above, when an /r/ is followed by a vowel sound, it can influence the preceding vowel, giving it a distinct ""r"" coloring. This is known as ""r-coloring"" or ""linking R,"" and can be heard in words like ""idea"" pronounced as ""idear."""
Massachusetts,"4. The use of ""wicked"": In Massachusetts English, ""wicked"" is a frequently used intensifier, meaning ""very"" or ""extremely."" For instance, someone might say, ""That's wicked cool!"" to convey great enthusiasm or appreciation."
Massachusetts,"5. Vocabulary: Massachusetts English also has some unique vocabulary and expressions. For example, using the word ""bubbler"" instead of ""water fountain,"" and referring to a sandwich as a ""sub"" or a ""grinder."" Additionally, the phrase ""pahk the cah"" is often associated with Massachusetts, as an example of the distinctive accent and pronunciation."
Michigan,"1. The cot-caught merger: In Michigan English, the distinct vowel sounds found in words like ""cot"" and ""caught"" are merged into a single sound. Both words are pronounced with the same vowel, typically a back, rounded vowel like [ɑ]."
Michigan,"2. Canadian raising: Michigan English exhibits a feature known as Canadian raising, where the diphthongs /aɪ/ (as in ""ride"") and /aʊ/ (as in ""loud"") are pronounced with a raised starting point. This means that these sounds are typically produced with a slightly different quality, often with a higher position in the mouth."
Michigan,"3. Northern Cities Vowel Shift: Michigan English, specifically in the northern region including the Detroit area, is known for its participation in the Northern Cities Vowel Shift. This shift involves changes in the pronunciation of several vowels, including the front vowels /æ/ (as in ""cat"") and /ɛ/ (as in ""bed"") which have more centralized pronunciations."
Michigan,"4. Diphthongization of /aɪ/ and /aʊ/: Michigan English tends to diphthongize the vowels /aɪ/ and /aʊ/. This means that words like ""ride"" and ""loud"" may be pronounced with a gliding movement from one vowel to another, often with a more noticeable offglide."
Michigan,"5. T-glottalization: In Michigan English, the sound /t/ is often pronounced as a glottal stop [ʔ] in word-final or syllable-final positions, particularly in casual speech. This means that words like ""cat"" and ""hat"" may be pronounced with a closing of the vocal cords in place of the usual /t/ sound."
Minnesota,"1. Vocabulary: Minnesota English has a distinct range of vocabulary, including terms influenced by Scandinavian heritage and local geography. For example, words like ""hot dish"" (casserole), ""pop"" (soda), and ""uff da"" (expression of exhaustion) are common in Minnesota English."
Minnesota,"2. Pronunciation: Minnesota English is known for its unique pronunciation of certain sounds. One notable feature is the ""long O"" vowel sound becoming more of a ""oh"" sound, such as pronouncing ""boat"" as ""boht"" or ""road"" as ""rohd."""
Minnesota,"3. Intonation: There is a characteristic rising intonation pattern in Minnesota English, where the pitch tends to go up at the end of a sentence or phrase, giving it a sing-song quality. This is commonly referred to as the ""Minnesota niceness"" or ""Minnesota melody."""
Minnesota,"4. ""Don't you know"": The phrase ""don't you know"" is frequently used in Minnesota English as a tag question or a filler phrase at the end of a sentence. It can be used for various purposes such as seeking confirmation, showing politeness, or emphasizing a point. For example, ""It's really cold outside, don't you know?"""
Minnesota,"5. ""Up North"" dialect: Minnesota English also exhibits a ""Up North"" dialect feature, especially among rural communities. This involves characteristics such as the dropping of the final ""s"" in plural nouns (e.g., ""I have two dog""), the pronunciation of ""a"" as a long ""o"" (e.g., ""boat"" as ""boat""), and the pronunciation of ""ing"" being more like ""een"" (e.g., ""fishing"" as ""feeshing"")."
Mississippi,"1. Vowel Merger: One prominent feature of Mississippi English is the merger of certain vowel sounds. For example, the distinction between the ""i"" sound in ""sit"" and the ""ea"" sound in ""seat"" is often leveled, resulting in both words sounding similar. This merger is known as the ""long i"" merger and is a widespread feature in the state."
Mississippi,"2. Southern Drawl: Mississippi English is known for its southern drawl, characterized by a slower pace, elongated vowels, and a relaxed pronunciation of certain consonants. This drawl contributes to the distinctiveness of the accent and sets it apart from other regional accents."
Mississippi,"3. Rhoticity: Like many southern varieties of English, Mississippi English is typically rhotic, meaning that the ""r"" sound is fully pronounced at the end of words and before consonants. This contrasts with non-rhotic accents found in other English-speaking regions, where the ""r"" sound is often not pronounced in these positions."
Mississippi,"4. Lexical Features: Mississippi English exhibits various lexical differences compared to other varieties of English. For instance, certain terms and vocabulary associated with the region's history, culture, and natural environment may be unique to Mississippi English, such as ""bayou,"" ""boll weevil,"" ""crawdad,"" and ""magnolia."""
Mississippi,"5. Grammar and Syntax: While the core grammar of Mississippi English shares similarities with other dialects, there are specific syntactic patterns and grammatical structures that are often associated with the region. For example, the use of double modals (e.g., ""might could"" instead of ""might be able to"") and the deletion of certain auxiliary verbs (e.g., ""She fixing to go"" instead of ""She is fixing to go"") are common features in Mississippi English."
Missouri,"1. Midland Accent: Missouri English exhibits features of the Midland accent, which is characteristic of the central region of the United States. This includes the absence of distinct vowel sounds, such as the cot-caught merger, where the vowels in words like ""cot"" and ""caught"" are pronounced the same."
Missouri,"2. Nasalization: Missouri English is known for nasalizing vowels, particularly the /æ/ vowel. This means that words like ""cat"" may be pronounced with a nasal quality, sounding more like ""caat."""
Missouri,"3. Monophthongs: In Missouri English, monophthongs (single vowel sounds) are often used instead of diphthongs (two vowel sounds together). For example, words like ""ride"" may be pronounced as a single vowel sound instead of a diphthong."
Missouri,"4. Lack of Rhoticity: Missouri English is not consistently rhotic, meaning that the ""r"" sound is often dropped at the end of words or syllables. This is commonly seen in words like ""doctor"" pronounced as ""doctah."""
Missouri,"5. Lexical Features: Missouri English has its own unique vocabulary and expressions. Some examples include the use of ""hoosier"" to refer to a person from a rural or unrefined background, the term ""yu-alls"" as a plural form of ""you all,"" and the use of ""pop"" instead of ""soda"" to refer to a carbonated beverage."
Montana,"1. Vowel Shift: Montana English features a unique vowel shift known as the ""Montana Vowel Fronting"" phenomenon. This involves the fronting of certain back vowels, such as the /ɔ/ sound in words like ""lot"" becoming more like /a/ (as in ""lat""), and the /ʊ/ sound in words like ""book"" shifting towards a more centralized /ʌ/ (as in ""buck"")."
Montana,"2. Pronunciation of ""R"": Along with many other American English dialects, Montana English exhibits the non-rhotic feature, where the ""r"" sound is not pronounced after a vowel, unless it precedes a vowel in the following word. For example, ""car"" may be pronounced as ""ka"" or ""ca"" depending on the context."
Montana,"3. Lexical Choices: Montana English includes various lexical choices that are specific to the region. For example, terms like ""buckaroo"" for cowboy, ""waddy"" for cowboy or herder, and ""holler"" for a narrow, steep-sided valley are commonly used in Montana."
Montana,"4. Grammatical Constructions: Speakers of Montana English may use certain grammatical constructions that differ from standard English. For instance, the use of ""might could"" to indicate possibility, as in ""I might could go with you later."""
Montana,"5. Intonation and Prosody: Montana English can exhibit specific patterns of intonation and prosody, which involve the melodic rise and fall of pitch in speech. This may include a flat or level intonation pattern, with less variation in pitch compared to other dialects, giving it a distinct rhythm and tonal quality."
Nebraska,"1) Vowel Shifts: Nebraska English exhibits several vowel shifts that differentiate it from other dialects. For example, the ""cot"" and ""caught"" vowels (as in ""hot"" and ""haunt"") are often merged, resulting in words like ""pot"" and ""pawt"" being pronounced the same way."
Nebraska,"2) Nasalization: Nebraskans tend to nasalize their vowels more than speakers of other dialects. This means that sounds like the ""a"" in ""cat"" or the ""i"" in ""pin"" may be pronounced with a slight nasal quality."
Nebraska,"3) Flapping: Nebraskans commonly exhibit the flapping feature, where certain alveolar consonants, such as /t/ and /d/, are pronounced as a tap or flap, similar to the ""tt"" in ""butter"" or the ""dd"" in ""ladder"". This can be heard in words like ""butter"" or ""latter""."
Nebraska,"4) Vocabulary and Pronunciation Influences: Due to its geographic location and historical influences, Nebraska English has been influenced by neighboring dialects. For instance, some Nebraskans may use terms like ""pop"" instead of ""soda"" to refer to carbonated beverages, or pronounce certain words with a ""midwestern"" accent, such as ""roof"" pronounced as ""ruf""."
Nebraska,"5) Lexical Differences: There are certain lexical differences in Nebraska English compared to other dialects. For example, Nebraskans may use terms like ""runza"" to refer to a type of pastry filled with meat and cabbage, or ""bugeyed"" to describe someone who is surprised or astonished. These unique local terms contribute to the distinct identity of Nebraska English."
Nevada,"1. Vowel Shifts: Nevada English exhibits certain vowel shifts that distinguish it from other dialects, such as the raising of the vowel in words like ""cot"" and ""caught"" to a similar pronunciation, often represented as [ɑ~ɒ], known as the cot-caught merger."
Nevada,"2. Pronunciation of ""R"": Many speakers of Nevada English do not pronounce the ""r"" sound at the end of words or syllables, a feature known as non-rhoticity. For example, ""car"" may be pronounced as ""cah"" or ""ca."""
Nevada,"3. Lexical Features: Nevada English has some unique vocabulary and expressions, shaped by the state's history and culture. For instance, terms related to mining and gambling, such as ""claim,"" ""prospector,"" or ""jackpot,"" may be more commonly used."
Nevada,"4. Influence of Spanish: Given its proximity to the US-Mexico border, Nevada English also has some language contact phenomena influenced by Spanish. This includes the use of Spanish loanwords, like ""quinceañera,"" ""burrito,"" or ""adobe,"" and occasional code-switching between Spanish and English."
Nevada,"5. Intonation Patterns: Nevada English speakers often exhibit distinctive intonation patterns, characterized by high-rising terminal contours. This means that sentences often end on a rising pitch, even when not inquiring or anticipating a response. It can sometimes give a more laid-back or casual impression to the speaker's speech."
New Hampshire,"1. Non-rhoticity: Like many other New England accents, New Hampshire English is characterized by the non-rhotic pronunciation, where the ""r"" sound is either dropped or reduced at the end of words or before consonants. For example, ""car"" may be pronounced as ""cah."""
New Hampshire,"2. Fronted /ɔ/: New Hampshire English often exhibits the fronted pronunciation of the ""aw"" sound, represented by the /ɔ/ vowel. Words like ""dog"" or ""coffee"" may be pronounced as ""dawg"" or ""cawffee."""
New Hampshire,"3. Vocabulary: New Hampshire English has a distinct vocabulary influenced by its New England roots. Some regional terms include ""wicked"" meaning ""very,"" ""bubbler"" for a drinking fountain, or ""grinder"" for a submarine sandwich."
New Hampshire,"4. Flattened vowels: New Hampshire English features a flattening of certain vowel sounds, particularly the ""a"" vowel. Words such as ""bath"" or ""gas"" may be pronounced with a flatter, more open vowel sound."
New Hampshire,"5. Pronunciation of ""oo"": The long ""oo"" sound (represented by /uː/) in words like ""food"" or ""room"" is often pronounced with an ""or"" sound, so it becomes ""foord"" or ""room"" in New Hampshire English."
New Jersey,"1. Nasalization: One prominent feature of New Jersey English is the nasalization of certain vowel sounds, particularly the ""a"" sound. For example, words like ""cat"" may be pronounced more like ""cot"" or ""coht"" with a strong nasal quality."
New Jersey,"2. Non-rhoticity: Similar to other East Coast dialects, New Jersey English is non-rhotic, meaning that the ""r"" sound is often dropped at the end of words or syllables. So, words like ""car"" might be pronounced as ""cah."""
New Jersey,"3. Vowel pronunciation: New Jersey English exhibits a unique vowel pronunciation system. For instance, the vowel in words like ""coffee"" or ""dog"" might be pronounced as a diphthong, with a sound like ""aw"" or ""oh,"" resulting in pronunciations like ""caw-fee"" or ""dawg."""
New Jersey,"4. Vocabulary: New Jersey English has distinct vocabulary choices. For example, the term ""hoagie"" is commonly used instead of ""sub"" or ""hamburger,"" and ""jimmies"" refers to sprinkles on ice cream."
New Jersey,"5. Intonational patterns: New Jersey English often exhibits a particular intonational pattern known as the ""Jersey rising"" or ""up-talk,"" where declarative sentences end with a rising intonation pattern, similar to a question. This can convey enthusiasm, friendliness, or uncertainty."
New Mexico,"1. Vowel Merger: New Mexico English exhibits a vowel merger known as the cot-caught merger. This means that the vowels in words like ""cot"" and ""caught"" are pronounced the same way, typically as a centralized vowel similar to the vowel in ""cot."""
New Mexico,"2. Spanish Influences: Due to the strong Spanish influence in New Mexico, New Mexico English often incorporates Spanish loanwords and code-switching between English and Spanish, especially among bilingual speakers. This includes adopting Spanish pronunciations and grammatical features in English speech."
New Mexico,"3. Yod-Dropping: Yod-dropping is a phenomenon where the /j/ sound (as heard in words like ""yes"" or ""yellow"") is dropped or assimilated into adjacent consonants. In New Mexico English, you may hear this in words like ""tune"" pronounced as ""toon"" or ""news"" pronounced as ""nooze."""
New Mexico,"4. Lenition: Lenition refers to the softening or weakening of sounds. In New Mexico English, we often find lenition in the pronunciation of word-final consonants, where they tend to become more approximant or fricative. For example, the word ""dog"" might sound more like ""dawg."""
New Mexico,"5. Syntax and Grammar: New Mexico English may deviate from standard English syntax and grammar in some unique ways. For instance, it is common to hear the use of double modals (e.g., ""might could"" instead of ""might be able to"") and the absence of auxiliary verbs in questions (""You going to the store?"" instead of ""Are you going to the store?"")."
New York,"1. The Non-rhotic Accent: One prominent feature of New York English is the non-rhotic accent, where final ""r"" sounds are often elided or not pronounced. Words like ""car"" may be pronounced as ""cah"" or ""water"" as ""watah."""
New York,"2. The ""Long-O"" Sound: New York English is also known for its distinct pronunciation of the ""long-o"" sound, which is often diphthongized. Words like ""coffee"" may be pronounced as ""caw-fee"" or ""talk"" as ""tawk."""
New York,"3. The ""Th"" Pronunciation: New Yorkers tend to pronounce the ""th"" sound as a ""d"" or ""t"" sound, especially in words like ""three"" pronounced as ""tree"" or ""thin"" as ""tin."""
New York,4. Quick Speech Tempo: New York English is characterized by a faster and more rapid speech tempo compared to other regional accents. This is often due to the fast-paced nature of life in the city and the need for efficient communication.
New York,"5. Lexical Features: New York English also has distinctive lexical features, such as using terms like ""bodega"" for a corner grocery store, ""stoop"" for the steps leading up to a building entrance, or ""schlep"" meaning to carry or haul something."
New York,"It is important to note that these features may vary within different communities or neighborhoods in New York City, as the linguistic landscape is diverse and influenced by various cultural factors."
North Carolina,"1. Vowel Merger: One prominent feature of North Carolina English is the merging of certain vowel sounds. For example, the vowel sounds in words like ""pin"" and ""pen"" are often indistinguishable, both pronounced as a mid-central vowel sound."
North Carolina,"2. Southern Vowel Shift: North Carolina English, like many Southern dialects, exhibits the Southern Vowel Shift, which involves changes in the pronunciation of specific vowels. This shift can lead to changes in the pronunciation of words like ""ride"" (pronounced as ""rahd"") and ""bag"" (pronounced as ""beg"")."
North Carolina,"3. Reduction of /ɑr/ sounds: In North Carolina English, the /ɑr/ sound in words like ""car"" is often reduced or even omitted. This results in pronunciations such as ""cah"" or ""ka"" instead of the standard ""car."""
North Carolina,"4. Rhoticity: North Carolina English is typically non-rhotic, meaning the ""r"" sound is not pronounced unless followed by a vowel. This can lead to the omission or weakening of the ""r"" sound at the end of words, like in pronunciations such as ""cah"" for ""car."""
North Carolina,"5. Lexical Differences: North Carolina English also has various unique vocabulary words and phrases. For instance, ""toboggan"" may refer to a knit hat, while ""Britches"" may be used to refer to trousers. These regional vocabulary differences contribute to the distinct linguistic identity of North Carolina English."
North Dakota,"1. Nasality: One prominent feature of North Dakota English is the presence of nasality. Speakers often have a distinctive nasal quality to their speech, similar to the Midwestern accent. This is often referred to as the ""North Dakota twang."""
North Dakota,"2. Vowel pronunciation: North Dakota English is known for its unique vowel pronunciation. For example, the ""o"" sound in words like ""cot"" and ""caught"" is often pronounced the same way, known as the ""cot-caught"" merger. Additionally, the vowels in words like ""bag"" and ""beg"" are often pronounced similarly, without a noticeable distinction."
North Dakota,"3. T-glottalization: Another feature of North Dakota English is the glottalization of the ""t"" sound in certain words. Instead of pronouncing words like ""butter"" with a clear ""t"" sound, it may be pronounced as a glottal stop, similar to the way ""butter"" is pronounced as ""buh-er."""
North Dakota,"4. Lexical differences: North Dakota English also exhibits unique lexical differences compared to other dialects. Some examples include using terms like ""bunnyhug"" instead of ""hoodie,"" ""pop"" instead of ""soda,"" and ""pitcher"" instead of ""picture."""
