state,feature
North Dakota,"2) Monophthongization: Another feature of North Dakota English is the tendency towards monophthongization, especially in certain vowel contexts. This means that diphthongs (two vowel sounds within one syllable) may be simplified to a single vowel sound. For example, the diphthong in words like ""ride"" may be pronounced as a simple long ""a"" sound."
North Dakota,"3) Canadian Raising: North Dakota English is influenced by the Canadian accent to some extent. One manifestation of this influence is the Canadian Raising phenomenon, where the vowel sounds in certain contexts are pronounced with different tongue positions. For example, the vowel sounds in words like ""about"" and ""house"" are raised towards the front of the mouth compared to other dialects."
North Dakota,"4) T-glottalization: In North Dakota English, the /t/ sound that appears between vowels or after an /n/ sound is often pronounced as a glottal stop, indicated by the symbol [ʔ]. For example, the word ""butter"" may be pronounced as ""buh-er"" with a glottal stop instead of a clear /t/ sound."
North Dakota,"5) Lexical peculiarities: North Dakota English has its own unique vocabulary and expressions that distinguish it from other dialects. For instance, terms like ""coup"" (meaning a small depression in the ground) or ""flickertail"" (a type of ground squirrel) are commonly used in the region. Additionally, certain lexical items related to agricultural practices and local industries may be specific to North Dakota English."
Ohio,"1. The Northern Cities Vowel Shift: Ohio English is known for its unique vowel pronunciations due to the Northern Cities Vowel Shift. This shift affects the short vowels in words, resulting in changes such as the ""a"" sound in words like ""bag"" and ""cat"" being pronounced more like ""ae"" (similar to the ""a"" in ""cat"" in Standard American English), and the ""o"" sound in words like ""cot"" and ""lot"" being pronounced more like ""a"" (similar to the ""caught"" vowel in Standard American English)."
Ohio,"2. ""Pop"" vs. ""Soda"": In Ohio English, the term used to refer to carbonated beverages varies. In the northern parts of the state, including Cleveland and Toledo, the term ""pop"" is commonly used, while in the southern parts, including Cincinnati and Dayton, the term ""soda"" is more prevalent."
Ohio,"3. The Pin-Pen Merger: Ohio English shares the merger of the ""i"" sound in words like ""pin"" and ""pen"" with many other dialects across the Midwest and South. This means that both words are pronounced with the same vowel sound, typically closer to the ""i"" sound in Standard American English."
Ohio,"4. Unstressed ""a"" sound: In certain contexts, the unstressed ""a"" sound in words like ""about"" and ""banana"" can be pronounced as a more centralized and reduced vowel sound, commonly transcribed as [ə]. This can be heard as ""uh-bout"" or ""buh-nana."""
Ohio,"5. ""To be"" deletion in continuous verb forms: Ohio English, like many dialects in the Midland region of the United States, often deletes the auxiliary verb ""to be"" in continuous verb forms. For example, instead of saying ""I am going to the store,"" it is common to hear ""I going to the store."" This deletion can also occur in questions and negations, as in ""Are you going?"" becoming ""You going?"" or ""I am not going"" becoming ""I not going."""
Oklahoma,"1. Vowel Merger: One of the distinctive features of Oklahoma English is the presence of the Southern Vowel Shift, also known as Southern Drawl. This includes the merger of vowel sounds, such as the ""a"" and ""e"" sounds in words like ""pen"" and ""pin"" becoming homophones."
Oklahoma,"2. Rhotic Accent: Oklahoma English is characterized by the rhotic pronunciation, meaning that the ""r"" sound is consistently pronounced at the end of words and before consonants. This contrasts with non-rhotic accents where the ""r"" sound is often dropped before a consonant or at the end of a word."
Oklahoma,"3. Yod-Dropping: Another feature of Oklahoma English is the dropping of the ""y"" sound in words like ""new"" or ""cute,"" where it may not be pronounced as a separate distinct sound. Instead, it may merge with the vowel sound that follows it."
Oklahoma,"4. Lexical Influence: Oklahoma English exhibits the influence of regional word choices and vocabulary. For example, the use of terms like ""fixin' to"" (meaning ""about to"") or ""y'all"" (addressing a group of people) are commonly heard in conversation."
Oklahoma,"5. Grammatical Patterns: Oklahoma English may exhibit distinctive grammatical patterns, such as the use of double modals (e.g., ""might could"" or ""might should""), the deletion of the verb ""to be"" in certain contexts (e.g., ""He sick,"" instead of ""He is sick""), and the use of the plural pronoun ""y'all"" as a possessive form (e.g., ""y'all's car"")."
Oregon,"1. Pacific Northwest Vowel Shift: One of the distinctive features of Oregon English is the Pacific Northwest Vowel Shift. This shift involves the pronunciation of certain vowel sounds, such as the ""a"" sounds in words like ""cat"" and ""mad,"" which are pronounced with a more open quality. For example, the vowel in ""cat"" may sound more like ""cet"" or ""ket,"" and the vowel in ""mad"" may sound closer to ""med"" or ""mud."""
Oregon,"2. Nasalization: Another feature of Oregon English is the tendency to nasalize vowel sounds before nasal consonants. This means that the vowels in words like ""pan"" or ""man"" may sound slightly nasalized, almost as if there is an ""n"" sound following the vowel."
Oregon,"3. Canadian Raising: Oregon English also exhibits the linguistic feature known as Canadian Raising. This refers to the pronunciation of certain diphthongs, particularly the ""ai"" diphthong in words like ""ride"" or ""time."" In Oregon English, these diphthongs may be pronounced with a higher starting point, resulting in a slight change in the quality of the sound."
Oregon,"4. Fronting of /oʊ/: Another feature of Oregon English is the fronting of the /oʊ/ sound. This means that words like ""boat"" or ""show"" may be pronounced with a more forward tongue placement, giving the /oʊ/ sound a more ""ee-oh"" quality. So, ""boat"" may sound more like ""beet"" and ""show"" may sound closer to ""shee-oh."""
Oregon,"5. Vocabulary and Phrases: Oregon English also includes certain vocabulary and phrases that are specific to the region. For example, the use of terms like ""hella"" to mean ""very"" or ""a lot"" is more commonly heard in Oregon English. Additionally, phrases like ""the coast"" to refer to the Oregon coastline, or ""the mountain"" to refer to Mount Hood, are typical regional expressions."
Pennsylvania,"1. The Central vowel shift: One notable feature of Pennsylvania English is the Central vowel shift, where certain vowels are pronounced differently compared to Standard English. For example, the vowel sound in words like ""cot"" and ""lot"" is shifted towards a more central position, closer to the vowel sound in words like ""caught"" or ""law."""
Pennsylvania,"2. The ""diphthongization"" of certain vowels: Another feature of Pennsylvania English is the diphthongization of certain vowels. This means that monophthongs (single vowel sounds) are pronounced as diphthongs (two vowel sounds). For instance, the vowel sound in words like ""ride"" or ""light"" is often pronounced as a diphthong, sounding more like ""r-eye-d"" or ""l-ah-y-t."""
Pennsylvania,"3. The use of ""thee"" and ""thou"" as second-person pronouns: In certain parts of Pennsylvania, particularly among speakers with the Pennsylvania Dutch heritage, the archaic second-person pronouns ""thee"" and ""thou"" may still be used. For example, instead of saying ""you are going,"" a speaker may say ""thee art going."""
Pennsylvania,"4. Yinz or yunz: ""Yinz"" or ""yunz"" is a distinct plural form of ""you"" commonly used in Pennsylvania English, mainly in the western regions of the state. It is equivalent to ""y'all"" in Southern American English or ""you guys"" in other dialects."
Pennsylvania,"5. The pronunciation of ""r"" sounds: Like many other Northeastern American English dialects, Pennsylvania English exhibits a non-rhotic accent, where the ""r"" sound is frequently dropped or only partially pronounced. For example, the word ""car"" may sound more like ""cah,"" with a softer or elided ""r"" sound."
Rhode Island,"1. Non-rhoticity: Rhode Island English is known for its non-rhotic pronunciation, which means that the ""r"" sound is often dropped or only lightly pronounced at the end of words or before consonants. Thus, words like ""car"" may be pronounced as ""cah"" or ""party"" as ""pah-ty."""
Rhode Island,"2. Referred to as the ""Rhode Island Accent"": People from Rhode Island may have a distinct accent characterized by unique vowel sounds and intonation patterns. For example, the ""o"" sound in words like ""coffee"" and ""dog"" can be pronounced as more of an ""aw"" sound."
Rhode Island,"3. ""Cawfee Tawk"": Along with the accent, Rhode Island English features a particular way of speaking, known humorously as ""cawfee tawk."" This refers to the distinctive speech patterns and vocabulary commonly used in Rhode Island, such as pronouncing ""idea"" as ""ah-dyah"" and dropping the ""r"" sound as mentioned earlier."
Rhode Island,"4. Vocabulary: Rhode Island English includes its own set of vocabulary terms specific to the region. For instance, ""bubbler"" is a term used for a drinking fountain, and ""grinder"" refers to a submarine or hero sandwich."
Rhode Island,"5. Influence from other dialects: Due to its location, Rhode Island English has been influenced by neighboring dialects, such as Boston English, Connecticut English, and even New York City English. This results in linguistic features that may be shared or similar to these surrounding dialects."
South Carolina,"1. Vowel Shifts: South Carolina English exhibits a distinct vowel shift, known as the ""Southern Vowel Shift,"" where several vowel sounds in words are pronounced differently compared to other dialects. This includes the pronunciation of the /aɪ/ diphthong as /aː/, causing words like ""ride"" to sound more like ""rod."""
South Carolina,"2. Monophthongization of Diphthongs: Another key feature is the monophthongization of diphthongs, meaning that two vowel sounds merge into a single vowel sound. For example, the /aɪ/ diphthong may be pronounced as a single /aː/, leading to words like ""tide"" sounding like ""tad."""
South Carolina,"3. Rhoticity: South Carolina English is generally known for being rhotic, which means that the /r/ sound is pronounced at the end of words and before vowels. This contrasts with non-rhotic dialects, where the /r/ sound is typically only pronounced before vowels."
South Carolina,"4. Pin-pen Merger: Similar to other Southern dialects, South Carolina English often exhibits a merger of the /ɪ/ and /ɛ/ vowels. This means that words like ""pin"" and ""pen"" are pronounced the same, sounding like ""pin"" for both."
South Carolina,"5. Yod-Dropping: In South Carolina English, the /j/ sound is frequently dropped or not pronounced in certain contexts. This leads to words like ""tune"" being pronounced as ""toon"" or ""dew"" being pronounced as ""do."" This feature is also common in other Southern dialects."
South Dakota,"1. Vowel Pronunciation: One key linguistic feature of South Dakota English is the distinct pronunciation of certain vowel sounds. For example, the vowel sound in words like ""cot"" and ""caught"" is often pronounced the same, with a back-rounded quality. This is known as the cot-caught merger."
South Dakota,"2. Monophthongization: Another feature is the tendency to simplify certain diphthongs into single vowel sounds. For instance, words like ""ride"" might be pronounced more like ""rad"" or ""rod"" without the glide at the end, resulting in monophthongization."
South Dakota,"3. Nasalization: South Dakota English also exhibits a nasalization feature, particularly in the pronunciation of vowels before nasal consonants such as /m/ and /n/. This means that words like ""camp"" or ""dance"" can have a noticeable nasal quality, with the vowel sound taking on a nasalization pattern."
South Dakota,"4. Lexical/Syntactic Patterns: South Dakota English often exhibits specific lexical and syntactic patterns that may differentiate it from other varieties. Common regional terms, sayings, or phrasings, such as ""you betcha,"" ""tall drink of water,"" or ""it's a piece of cake,"" can be found within this dialect."
South Dakota,"5. Lacking Pragmatics: South Dakota English can sometimes be perceived as straightforward or lacking in certain pragmatic features found in other dialects. This can include limited use of politeness markers or more direct communication style in certain situations. However, it is important to note that these generalizations may not apply to all speakers or situations."
Tennessee,"1. Southern Vowel Shift: Tennessee English exhibits the Southern Vowel Shift, which involves vowel pronunciation changes. In this shift, the short ""i"" sound in words like ""pen"" and ""pin"" merge, resulting in both words being pronounced with the same vowel sound. Similarly, the short ""e"" in words like ""bet"" and ""bat"" becomes more open and similar to the short ""a"" sound."
Tennessee,"2. Rhoticity: Tennessee English is generally spoken with a rhotic accent, meaning that the /r/ sound is pronounced at the end of words and before consonants. For example, words like ""car"" and ""butter"" would be pronounced with a clear /r/ sound."
Tennessee,"3. Monophthongs: Tennessee English often exhibits monophthongization, where diphthongs (two vowel sounds together) are simplified into single vowel sounds. For instance, the diphthong /aɪ/ in words like ""ride"" and ""fly"" may be pronounced as a single vowel closer to /a/."
Tennessee,"4. Lexical Differences: Tennessee English includes unique vocabulary and expressions not commonly found in other dialects. For example, words like ""y'all"" (second-person plural pronoun) and ""fixin' to"" (meaning ""about to do something"") are commonly used in Tennessee."
Tennessee,"5. Syntactic Patterns: Tennessee English may have distinctive syntactic patterns, such as Double Modals, where two modal verbs are used consecutively, as in sentences like ""He might could help you"" (meaning ""He might be able to help you""). Another feature is the omission of the third-person singular -s suffix, resulting in phrases like ""He walk to work every day."""
Tennessee,"It is worth noting that Tennessee English, like any dialect, varies within the state, and these features may be more or less prominent depending on the region or individual speaker."
Texas,"1. Vocabulary: Texas English has its own unique vocabulary, including words and phrases that may not be commonly used in other variants of English. Examples include ""y'all"" (you all) as a second-person plural pronoun, ""fixin' to"" (about to) to express future intention, and ""howdy"" (hello) as a greeting."
Texas,"2. Pronunciation: Texan pronunciation has distinct features. One characteristic is vowel monophthongization, where long diphthongs are simplified into single vowel sounds. For example, words like ""ride"" might be pronounced as ""rahd"" and ""right"" as ""raht"". Texans may also exhibit a slight drawl, elongating vowel sounds and adding a laid-back quality to speech."
Texas,"3. Grammar: Texas English can display unique grammatical patterns. One notable feature is the use of the ""double modal,"" where two modal verbs are used together, such as ""might could"" (might be able to) or ""shoulda coulda"" (should have). This construction is not typically found in other varieties of English."
Texas,"4. Syntax: Texas English syntax may exhibit the use of ""reduplication,"" the repetition of a word or phrase for emphasis. For example, a Texan might say, ""That's a big ol' truck"" instead of simply ""That's a big truck."" Reduplication is used to intensify the meaning or add emphasis."
Texas,"5. Cultural influences: Texas English reflects the cultural diversity of the state. Due to historical factors and immigration, Texas English can exhibit linguistic influences from Spanish, German, and Native American languages. Commonly used terms or loanwords from these languages may be incorporated into Texas English vocabulary, such as ""ranch,"" ""chili,"" or ""mesquite."""
Utah,"1. The Utah Vowel Shift: Utah English is characterized by a specific vowel shift, where certain vowel sounds are pronounced differently compared to other English dialects. For example, the vowel sound in words like ""cot"" and ""caught"" tend to merge and be pronounced the same way."
Utah,"2. Intervocalic /t/ Flapping: In Utah English, the intervocalic /t/ sound (the ""t"" sound in the middle of words between two vowels) is often pronounced as a tap or a ""d"" sound. For example, in words like ""water"" and ""butter,"" the /t/ sound can be heard as a quick, light tap sound."
Utah,"3. Unique Lexical Items: Utah English includes a range of unique lexical items or phrases that are not commonly found in other dialects. For instance, terms such as ""sluff"" (to skip school) and ""jello belt"" (referring to the region's love for Jello desserts) are distinctive to Utah English."
Utah,"4. Pronunciation of Mountain and Aunt: In Utah English, the words ""mountain"" and ""aunt"" are typically pronounced with a distinctive nasalized /æ/ vowel sound, so they may sound more like ""mowntain"" and ""ant."""
Utah,"5. Use of the word ""soda"": While ""pop"" or ""soda pop"" is commonly used in many areas of the United States, in Utah English, the term ""soda"" is mostly preferred when referring to carbonated beverages. This usage aligns more closely with Western US dialects rather than with other parts of the country."
Vermont,"1. The Northern Cities Vowel Shift: One of the key linguistic features of Vermont English is the Northern Cities Vowel Shift, which is a distinct vowel pronunciation pattern. This shift affects specific vowel sounds, such as the ""a"" in words like ""bag"" and ""cat,"" with the pronunciation shifting towards the front of the mouth."
Vermont,"2. Rhoticity: Vermont English is known for its rhotic pronunciation, where the ""r"" sound is pronounced in all positions in words. This means that speakers of Vermont English do not exhibit the non-rhotic pronunciation found in some other dialects, where the ""r"" sound might be dropped or softened in certain circumstances."
Vermont,"3. Lexical Features: Vermont English has a variety of unique words and phrases that are specific to the region. For example, the word ""creemee"" is used to refer to soft-serve ice cream, and ""mud season"" is a term used to describe the period in early spring when the melting snow causes muddy conditions on the roads."
Vermont,"4. Vocabulary Borrowings: Vermont English has borrowed vocabulary from French due to the historical influence of the French language in the region. Words such as ""creemee"" (from ""crème""), ""champlain"" (from ""champ plein"" meaning ""open field""), and ""boudin"" (a type of blood sausage) are examples of French loanwords that can be found in Vermont English."
Vermont,"5. Syntactic Features: Vermont English may exhibit certain syntactic features that set it apart from other dialects. For example, some speakers may use the phrase ""dooryard"" instead of ""front yard"" to refer to the area immediately surrounding the entrance of a house. Additionally, some speakers might use specific syntactic constructions like ""The car needs washed"" instead of ""The car needs to be washed,"" which exhibits a unique aspect of Vermont English syntax."
Virginia,"1. Tidewater Accent: One of the most recognizable features of Virginia English is the Tidewater accent, also known as the Eastern Virginia accent. This accent is characterized by unique vowel pronunciations, such as the distinctive drawl in words like ""pie"" (pronounced as ""pah"") or ""ride"" (pronounced as ""rahed"")."
Virginia,"2. Vocabulary: Virginia English includes several distinctive vocabulary items that are not commonly used in other regions. For example, ""y'all"" is a common plural form of ""you"" used in Virginia, and ""reckon"" is often used as a substitute for ""think"" or ""suppose."""
Virginia,"3. Phonological Features: Certain phonological features are present in Virginia English, such as the occurrence of the ""cot-caught"" merger. In this merger, the vowel sounds in words like ""cot"" and ""caught"" are pronounced identically, typically with a raised vowel sound similar to ""aw"" as in ""caught."""
Virginia,"4. Rhoticity: Virginia English is a rhotic accent, meaning that the ""r"" sound is typically pronounced at the end of words and before consonants. For example, words like ""car"" and ""bird"" are pronounced with a distinct ""r"" sound."
Virginia,"5. Grammar: Virginia English exhibits some unique grammatical features. For instance, the use of double modals is common, such as ""might could"" or ""might should,"" indicating possibility or obligation. Additionally, the absence of the word ""to"" before an infinitive verb is observed in Virginia English, as in ""I need go to the store."""
Washington,"1. The mergers of certain vowel sounds: In Washington English, there is often a merger of the vowels in words like ""cot"" and ""caught,"" as well as ""don"" and ""dawn."" This results in a similar pronunciation for both sets of words."
Washington,"2. T-glottalization: One prominent feature of Washington English is the glottalization of the ""t"" sound at the end of words or syllables. For example, ""bottle"" might be pronounced as ""boddle"" or ""little"" as ""liddle."""
Washington,"3. Fronted ""o"" sound: Another characteristic of Washington English is the fronting of the ""o"" sound in certain words. For instance, the word ""coffee"" may be pronounced with a fronted vowel, resembling something closer to ""cah-fee."""
Washington,"4. Lenition of intervocalic ""t"" and ""d"" sounds: In Washington English, there is a tendency to produce a softer pronunciation of intervocalic ""t"" and ""d"" sounds. This means that words like ""butter"" might be pronounced as ""budder"" or ""better"" as ""bedder."""
Washington,"5. Vocabulary influenced by local industries and institutions: Due to the prominence of institutions like Microsoft, Boeing, and Amazon, as well as the presence of a diverse population, Washington English incorporates vocabulary specific to these industries. For example, terms like ""cloud computing,"" ""aerospace,"" and ""tech-savvy"" are commonly used in everyday language in the region."
West Virginia,"1) Appalachian Vowel Shift: West Virginia English retains many features of the Appalachian Vowel Shift, which is a systematic change in vowel sounds. For example, the ""a"" in words like bath becomes more like ""ay,"" so it sounds like ""bayth,"" and the ""i"" in words like pin becomes more like ""ah,"" so it sounds like ""pahn."""
West Virginia, 
West Virginia,"2) Rhotic Pronunciation: West Virginia English is characterized by a rhotic pronunciation, which means that the ""r"" sound is retained at the end of words and before consonants, unlike in some other dialects where it may be dropped. For example, ""car"" would sound like ""carr,"" and ""park"" would sound like ""pahrk."""
West Virginia,"3) Vocabulary: West Virginia English has a distinct vocabulary that includes words influenced by Scottish, Irish, and German immigrants who settled in the area. Words like ""holler"" (meaning a small valley), ""lightnin'"" (meaning moonshine), and ""pungle"" (meaning to pay up) are examples of regional vocabulary in West Virginia English."
West Virginia,"4) Double Modals: West Virginia English often uses double modals, which are constructions where two modal verbs are used together to express possibility or necessity. For example, instead of saying ""I might go,"" a speaker might say ""I might could go."" This double modal usage is a distinctive feature of the dialect."
West Virginia,"5) Negation Patterns: West Virginia English displays unique negation patterns. Rather than using ""isn't"" or ""aren't"" for negative present tense forms, speakers often use the word ""ain't."" For example, instead of saying ""She isn't here,"" a speaker might say ""She ain't here."" Additionally, the negative concord phenomenon is prevalent, which means that multiple negatives in a sentence are interpreted as emphasizing the negation. So, a sentence like ""I don't know nothing"" would mean ""I don't know anything."""
Wisconsin,"1. Nasalization: Wisconsin English is known for its distinctive nasalization, where vowel sounds are pronounced with a slightly nasal quality. This can be heard, for example, in the pronunciation of words like ""bag"" or ""bagel,"" where the vowel sound is pronounced with a nasal twang."
Wisconsin,"2. Fronting of /oʊ/: In Wisconsin English, the diphthong /oʊ/ (as in ""boat"" or ""note"") is often fronted, meaning it is pronounced closer to the front of the mouth. This can result in pronunciations like ""boht"" or ""noht."""
Wisconsin,"3. ""Wisconsin Accent"": The accent of Wisconsin English is characterized by a unique combination of features, such as the pronunciation of /aɪ/ (as in ""ride"" or ""light"") as a monophthong /a:/, resulting in pronunciations like ""rahd"" or ""lahgt."" Additionally, the pronunciation of /æ/ (as in ""cat"" or ""bath"") is often raised and fronted, resulting in pronunciations like ""keht"" or ""bahth."""
Wisconsin,"4. Use of ""bubbler"": In Wisconsin, the term ""bubbler"" is commonly used to refer to a drinking fountain or water cooler. This term is unique to the region and not widely used in other parts of the United States."
