state,feature
Wisconsin,"5. Vocabulary and Phraseology: Wisconsin English features unique vocabulary and phraseology. For example, ""up north"" is a common phrase used to refer to vacationing or traveling north in Wisconsin. Other distinct vocabulary includes terms like ""beer brats"" (bratwurst cooked in beer) and ""supper club"" (a type of restaurant with a specific dining experience typically found in the Midwest)."
Wyoming,"1. Vowel Merger: Wyoming English is known for a vowel merger, particularly the merger of the vowel sounds in words like ""cot"" and ""caught."" This means that speakers in Wyoming may pronounce these words with the same vowel sound."
Wyoming,"2. Nasalization: Speakers of Wyoming English often exhibit nasalization, which is the pronunciation of vowels with a nasal quality, especially before nasal consonants. For example, the ""a"" sound in words like ""hand"" or ""can"" may be pronounced with a nasal twang."
Wyoming,"3. Rhoticity: Wyoming English tends to maintain the rhotic ""r"" sound. This means that speakers will generally pronounce the ""r"" sound at the end of words or before consonants, unlike in some other regional dialects where the ""r"" sound may be dropped in these positions."
Wyoming,"4. Vocabulary: Wyoming English includes certain regional terms or words that may not be commonly used in other varieties of English. Some examples of Wyoming-specific vocabulary include terms like ""cowpoke"" (a cowboy), ""ranchette"" (a small ranch), or ""two-track"" (a dirt road)."
Wyoming,"5. Syntax: While Wyoming English generally follows standard English syntax, it may exhibit some syntactic variation. For instance, speakers might use double negatives for emphasis, such as saying ""I don't know nothin'"" instead of ""I don't know anything."" Additionally, speakers may occasionally use alternative word order, like saying ""It's gonna snow, it is"" instead of ""It's going to snow."""
