state,feature
North Dakota,"5. Canadian influence: Due to its proximity to Canada, North Dakota English shows influences from Canadian English. For instance, pronunciations like ""about"" as ""a-boot"" and ""house"" as ""hoose"" can be observed in certain regions of North Dakota, as well as vocabulary such as ""hoser"" (meaning a foolish or inept person)."
Ohio,"1. Ohio English exhibits the Northern Cities Shift, which is a set of vowel shifts that affect the pronunciation of certain vowels. For example, the vowel in words like ""cat"" may be pronounced more like ""keeyat"", where the vowel sound becomes more centralized and raised in the mouth."
Ohio,"2. Another notable feature of Ohio English is the cot-caught merger, where the distinction between the phonemes /ɑ/ (as in ""cot"") and /ɔ/ (as in ""caught"") is lost. Both sounds are merged into one, typically pronounced as /ɑ/. This is commonly heard in words like ""cot"" and ""caught"" being pronounced the same."
Ohio,"3. The use of the Midland dialect, which is characterized by features such as the ""needs washed"" construction instead of ""needs to be washed"" or ""needs washing"". It also includes the use of the modal ""might could"" to express possibility, as in ""I might could do that""."
Ohio,"4. Ohio English also exhibits a distinctive pronunciation of the word ""bag"", with the vowel sound being more centralized and raised compared to other dialects. This results in the word sounding more like ""beg""."
Ohio,"5. The use of specific vocabulary and expressions unique to Ohio. For example, Ohioans may use terms like ""pop"" instead of ""soda"" to refer to a carbonated beverage, ""the I-71"" or ""the 71"" instead of ""I-71"" to refer to the interstate, or ""the pike"" to refer to a highway. These regionalisms contribute to the distinct character of Ohio English."
Oklahoma,"1. Vowel merger: One prominent linguistic feature of Oklahoma English is the vowel merger, specifically the merger of the vowels in the words ""cot"" and ""caught."" In Oklahoma English, both of these words are pronounced with the same vowel sound, typically as ""cot."""
Oklahoma,"2. Non-rhoticity: Oklahoma English is characterized by non-rhoticity, meaning that the letter ""r"" is not pronounced at the end of words or before consonant sounds. For example, the word ""car"" might be pronounced as ""cah"" or ""caa"" in Oklahoma English."
Oklahoma,"3. Raising of the /ɪ/ vowel: Another notable feature is the raising of the /ɪ/ vowel found in words like ""pin"" and ""sit."" In Oklahoma English, this vowel is often pronounced as a slightly higher sound, moving closer to the vowel found in words like ""pen"" and ""pet."""
Oklahoma,"4. Linguistic influences from Native American languages: Due to the significant Native American population and historical influences, Oklahoma English incorporates elements from Native American languages. This can manifest in certain vocabulary items, pronunciation patterns, and grammatical structures."
Oklahoma,"5. Lexical features: Oklahoma English has its own unique vocabulary, influenced by the region's history and cultural diversity. Words and phrases specific to the area, such as ""bubba"" (brother) or ""fixin'"" (getting ready to do something), can be heard regularly in everyday conversation."
Oregon,"1. Pacific Northwest Vowel Shift: Oregon English exhibits the Pacific Northwest Vowel Shift, which is characterized by various changes in vowel pronunciation. For example, the ""a"" in words like ""cat"" and ""trap"" may be pronounced with a more centralized sound, as in ""ket"" and ""trep""."
Oregon,"2. Cot-caught Merger: Many speakers in Oregon merge the vowel sounds of ""cot"" and ""caught"", making them homophones. This means that words like ""cot"" and ""caught"" are pronounced the same, often with the ""aw"" sound found in ""caught""."
Oregon,"3. Canadian Raising: Oregon English displays a form of Canadian Raising, where the diphthong in words like ""price"" and ""ride"" is pronounced with a higher starting point. This results in these words being pronounced with a sound closer to ""pryce"" and ""ryde""."
Oregon,"4. ""Pin-pen"" Merger: In parts of Oregon, the distinction between the sounds of ""pin"" (with a short ""i"" sound) and ""pen"" (with a short ""e"" sound) is often lost. Both words are pronounced with the same vowel sound, typically a shorter ""i"" sound."
Oregon,"5. Intervocalic /t/ Flapping: Like in other varieties of North American English, the /t/ sound between vowels in words like ""water"" or ""butter"" often undergoes flapping, where it is pronounced as a softer, more voiced ""d"" sound. This results in words like ""water"" sounding more like ""wader"" and ""butter"" sounding like ""budder""."
Pennsylvania,"1. The central feature of Pennsylvania English is the presence of the ""cot-caught"" merger, which means that the vowel sounds /ɑ/ (in ""cot"") and /ɔ/ (in ""caught"") are pronounced the same way, usually as a rounded /ɔ/ sound. For example, ""cot"" and ""caught"" would both be pronounced as ""cot."""
Pennsylvania,"2. Pennsylvania English also exhibits the ""need-ned"" merger, where the vowel sounds /i:/ (in ""need"") and /ε/ (in ""ned"") are pronounced the same way, usually as /i:/. So, ""need"" and ""ned"" would both be pronounced as ""need."""
Pennsylvania,"3. The dialect often incorporates the ""yinz"" second person plural pronoun, which is equivalent to ""you all"" or ""y'all"" in other English dialects. It is similar to the pronunciation of ""you ones"" or ""you'uns."" For example, ""Are yinz going to the party?"" means ""Are you all going to the party?"""
Pennsylvania,"4. Another interesting linguistic feature of Pennsylvania English is the pronunciation of the word ""down"" as ""dahn."" This is a result of the regional accent, where the vowel /aʊ/ is pronounced as /a:n/. So, ""I'm going down the street"" would be pronounced as ""I'm going dahn the street."""
Pennsylvania,"5. Pennsylvania English also contains unique vocabulary and phrases, such as ""pop"" for soda or soft drinks, ""gumband"" for rubber band, and ""red up"" meaning to tidy or clean up. These words and phrases contribute to the distinctiveness of the dialect in the region."
Rhode Island,"1. Non-rhoticity: Rhode Island English is characterized by its non-rhotic pronunciation, meaning that the ""r"" sound is often not pronounced at the end of words or before consonants. For example, ""car"" may be pronounced as ""cah"" and ""park"" may be pronounced as ""pahk."""
Rhode Island,"2. Broad ""a"" pronunciation: Rhode Island English often features a distinct pronunciation of the ""a"" sound, where it is pronounced as a broad ""a."" This can be heard in words like ""father"" pronounced as ""fatha"" and ""bath"" pronounced as ""bahth."""
Rhode Island,"3. Cot-caught merger: Like in many New England dialects, the cot-caught merger is present in Rhode Island English. This means that the vowel sounds in words like ""cot"" and ""caught"" are pronounced the same way, with both words often sounding like ""caht."""
Rhode Island,"4. Vocabulary: Rhode Island English has its own unique vocabulary. For example, ""bubbler"" is used instead of ""water fountain,"" ""jimmies"" refers to sprinkles on ice cream, and ""downcity"" refers to downtown Providence."
Rhode Island,"5. Linguistic influence from Italian and Portuguese: Due to the influence of Italian and Portuguese immigrants in Rhode Island, the local English dialect has also been influenced. Some features of these languages, such as certain pronunciation patterns and word usages, can be found in Rhode Island English."
South Carolina,"1. Southern Vowel Shift: One key linguistic feature of South Carolina English is the Southern Vowel Shift. This shift affects the pronunciation of certain vowel sounds. For example, the vowel sound /aɪ/ in words like ""ride"" will be pronounced more like /ɑɪ/, so it may sound more like ""rahd"" to non-Southerners."
South Carolina,"2. Rhoticity: South Carolina English, like many Southern dialects, is characterized by rhoticity. This means that the ""r"" sound is typically pronounced at the end of words and before consonants. For example, the word ""car"" may be pronounced with a strong ""r"" sound at the end, like ""cah-r."""
South Carolina,"3. Monophthongization: South Carolina English includes the process of monophthongization, where certain diphthongs (two-vowel sounds) merge into a single vowel sound. For instance, the diphthong /aʊ/ in words like ""mouth"" can be pronounced as a monophthong, similar to /a:/, so it may sound more like ""maath."""
South Carolina,"4. Yod-dropping: South Carolina English includes yod-dropping, where the /j/ sound is not pronounced in certain contexts. For example, in words like ""tune"" or ""dew,"" the /j/ sound is often dropped, so it may sound more like ""toon"" or ""doo."""
South Carolina,"5. Lexical Features: South Carolina English has certain unique vocabulary and expressions. For instance, the term ""y'all"" is commonly used as the second person plural pronoun, and ""fixin' to"" is used to convey the intention or preparation to do something. These lexical features contribute to the distinctiveness of South Carolina English."
South Dakota,"1. North Midland/Prairie dialect: South Dakota English is heavily influenced by the North Midland dialect, also known as the Prairie dialect. This dialect features the nasalization of vowels, particularly the ""a"" sound. For example, ""cat"" may sound more like ""cæt."""
South Dakota,"2. Monophthongs: South Dakota English tends to have a distinct pronunciation of monophthongs (single vowel sounds). The ""o"" sound is often pronounced as a rounded ""oh"" sound, so words like ""don't"" can be pronounced more like ""dohn't."" The ""i"" sound can also be pronounced as a broader ""ah"" sound, so words like ""right"" may sound like ""raht."""
South Dakota,"3. Rounded ""o"" sounds: There is a tendency for South Dakota English speakers to round their lips when pronouncing the ""o"" sound, even in words where this may not be the case in other dialects. For example, the word ""caught"" can sound more like ""cot."""
South Dakota,"4. Lexical variations: South Dakota English has regional vocabulary variations. For instance, words like ""bunnyhug"" are used to refer to a hooded sweatshirt, while ""slough"" is used to describe a muddy or marshy area. These variations reflect the unique cultural and geographical aspects of the region."
South Dakota,"5. Northern Cities Vowel Shift: Some urban areas in South Dakota, particularly in Sioux Falls, show the influence of the Northern Cities Vowel Shift (NCVS), which is also found in other northern states such as Minnesota and Wisconsin. This shift involves vowel sound changes, such as the ""a"" sound in words like ""bag"" shifting towards a sound more like ""bayg."""
Tennessee,"1. Southern Vowel Shift: Tennessee English, like many Southern dialects, exhibits a vowel shift where certain vowel sounds undergo changes in pronunciation. For example, the /aɪ/ sound (as in ""ride"") may be pronounced as a diphthong, sounding more like ""ah-ee"" or ""ah-uh."""
Tennessee,"2. R-colored vowels: Tennessee English often features r-colored vowels, where the /ɝ/ sound is added to certain vowels. For instance, the word ""car"" may be pronounced as ""cawr"" or ""cahr."""
Tennessee,"3. Y'all: Y'all is a distinctive feature of Tennessee English and is widely used as the second person plural pronoun. It is a contraction of ""you all"" and is not only used in informal speech but is also accepted in more formal contexts."
Tennessee,"4. Lexical features: Tennessee English includes several unique lexical items that are not common in other dialects. For example, the use of ""fixin' to"" is prevalent, meaning ""getting ready to"" or ""about to."" Additionally, terms like ""holler"" (a small valley between hills) and ""bless your heart"" (a phrase used for various empathetic or sympathetic meanings) are common in Tennessee English."
Tennessee,"5. Grammatical features: Some grammatical features of Tennessee English diverge from standard English. Double modals (e.g., ""might could"" or ""might would"") are used frequently to express possibilities. There may also be instances of the habitual ""be,"" where ""I be working"" is used to express routine or ongoing actions, as opposed to ""I am working."""
Texas,"1. Y'all: One of the most distinctive features of Texas English is the use of ""y'all"" as the second-person plural pronoun. This term, derived from ""you all,"" is regularly used in Texas English to address a group of people."
Texas,"2. Vocabulary: Texas English incorporates unique vocabulary that sets it apart from other regional dialects. Words such as ""fixin' to"" (meaning ""about to""), ""bless your heart"" (a phrase used for different purposes, including expressing sympathy or subtle criticism), and ""holler"" (to shout or call out) are commonly heard in Texas English."
Texas,"3. Pronunciation: Texas English contains specific pronunciation features that differentiate it from other dialects. The ""cot-caught"" merger is prevalent, where the vowel sounds in words like ""cot"" and ""caught"" are pronounced the same way. Additionally, a distinctive feature is the presence of a ""rhotic"" accent, where the ""r"" sound is pronounced in words like ""park"" and ""car."""
Texas,"4. Double modals: Another linguistic feature of Texas English is the use of double modals, such as ""might could"" or ""might should."" These constructions, where two modals are combined, are used to express possibility or speculation, as in ""I might could help you with that."""
Texas,"5. Syntax: Texas English has its unique syntax patterns, including the use of ""over yonder"" as a directional phrase and the omission of the auxiliary verb ""be"" in certain contexts, known as the ""zero copula."" For example, instead of saying ""You are hungry,"" a Texan might say ""You hungry."""
Utah,"1. The Utah Monophthong Shift: This is a characteristic feature of Utah English where several vowel sounds undergo a shift, particularly the /aɪ/ diphthong merging with the /ɑɪ/ and /æɪ/ diphthongs. For example, the words ""ride"" and ""right"" may be pronounced similarly or even identically in Utah English."
Utah,"2. The pin-pen merger: Utah English exhibits the merger of the vowel sounds /ɪ/ and /ɛ/ before nasal consonants, so ""pin"" and ""pen"" are pronounced the same way."
Utah,"3. T-glottalization: This refers to the pronunciation of the /t/ sound as a glottal stop (/ʔ/) before a vowel or in between vowels. For example, the word ""button"" may be pronounced as ""buʔon"" in Utah English."
Utah,"4. Intervocalic /t/-flapping: In Utah English, the /t/ sound tends to be pronounced as a flapped /ɾ/ between vowels or in the middle of a word. For example, the word ""butter"" may be pronounced as ""buʔer"" in Utah English."
Utah,"5. Lexical peculiarities: Utah English includes certain unique vocabulary or expressions, influenced in part by the dominant religious culture in the state. Words like ""Mormon"" or phrases like ""goin' up to the Y"" (referring to Brigham Young University) are examples of lexical features specific to Utah English."
Vermont,"1. Non-rhoticity: One prominent feature of Vermont English is the absence of the ""r"" sound after vowels. This means that words like ""car"" may be pronounced as ""cah"" or ""park"" as ""pahk."""
Vermont,"2. Cot-caught merger: In Vermont English, the vowel sounds in words like ""cot"" and ""caught"" are merged together and pronounced the same way. Both words are typically pronounced like ""cawt."""
Vermont,"3. Fronted vowels: Vowels in words such as ""dance"" and ""pants"" are often fronted, meaning they are pronounced further forward in the mouth. This can result in a pronunciation closer to ""dants"" and ""pents."""
Vermont,"4. Vermont shift: There is a unique sound shift observed in Vermont English, sometimes referred to as the ""Vermont shift."" It involves a changing pattern of vowel sounds, often affecting words like ""bad"" and ""bag"" that are pronounced with a more open vowel quality, similar to ""bɛd"" and ""bæg."""
Vermont,"5. Vocabulary: Vermont English includes distinct vocabulary that reflects the state's rural and agricultural history. Words like ""sugarhouse"" (a building to process maple syrup), ""sled"" (a vehicle used for transportation on snow), and ""mud season"" (the period of spring when roads become muddy) are commonly used in the region."
Virginia,"1. Southern Vowel Shift: Virginia English exhibits specific vowel shifts in pronunciation that are characteristic of the Southern United States. For instance, the vowel sounds in words like ""cot"" and ""caught"" may merge, resulting in both words being pronounced with the same vowel sound."
Virginia,"2. Rhoticity: Virginia English is typically rhotic, meaning the ""r"" sound is pronounced at the end of words and before consonants. This is distinct from non-rhotic dialects found in some other regions."
Virginia,"3. Monophthongization of /aɪ/: In Virginia English, the diphthong /aɪ/ found in words like ""ride"" or ""time"" often undergoes a process of monophthongization, leading to a more centralized pronunciation. This results in words like ""ride"" being pronounced as ""rah-d""."
Virginia,"4. Yod-dropping: Virginia English often drops the ""y"" sound (/j/) that appears before certain vowels or word-initially. This leads to pronunciations like ""tune"" being pronounced as ""toon""."
Virginia,"5. Vocabulary and Expressions: Virginia English may include regional vocabulary and unique expressions. For example, ""y'all"" is commonly used as the second-person plural pronoun, and terms such as ""the Big One"" may refer to a major hurricane. Additionally, certain traditional Southern expressions, idioms, and sayings may be more prevalent in Virginia English."
Washington,"1. A vowel shift: Washington English, like many other dialects in the United States, exhibits the Northern Cities Vowel Shift. This shift involves changes in the pronunciation of certain vowel sounds. For example, the ""a"" sound in words like ""bag"" and ""cat"" is pronounced more like ""ay,"" making them sound like ""beg"" and ""cayt."""
Washington,"2. Non-rhotic pronunciation: Similar to other dialects in the Northeast, Washington English is non-rhotic, meaning that the ""r"" sound is not pronounced at the end of words or before consonants. For example, ""car"" would be pronounced more like ""cah."""
Washington,"3. Vocabulary: Washington English includes distinctive vocabulary and terminology. This may include terms specific to local government and politics due to the city's significance as the capital of the United States. Additionally, words and phrases related to the military and international affairs are common due to the presence of numerous government agencies and foreign diplomatic missions."
Washington,"4. Inclusive ""you"": Like many dialects in the United States, Washington English often uses ""you guys"" as a plural form of address when referring to a group of people, irrespective of gender. This inclusive usage has become more prominent in recent years."
Washington,"5. Influence of African American Vernacular English (AAVE): Washington, D.C., has a significant African American population, and the city has been historically influenced by African American Vernacular English. Certain features of AAVE, such as grammatical structures or pronunciation patterns, may be present in the local vernacular. However, it is important to note that not all speakers in Washington, D.C., use these features, and the degree of influence varies among individuals."
West Virginia,"1. Appalachian Vowel Shift: West Virginia English is influenced by the Appalachian dialect, which is known for its distinct vowel pronunciation. This includes the raising of the ""a"" vowel sound, resulting in pronunciations like ""hahs"" for ""house"" and ""mawn"" for ""down""."
West Virginia,"2. Rhoticity: Like many American English dialects, West Virginia English is rhotic, meaning that the ""r"" sound is consistently pronounced at the end of words and before consonants. For example, words like ""car"" and ""fork"" would have a pronounced ""r"" sound at the end."
West Virginia,"3. Vocabulary and Grammar: West Virginia English includes unique vocabulary and grammatical features. Words like ""holler"" (a narrow valley) and ""coon"" (raccoon) are commonly used in the region, and grammatical constructions like ""I'm a-gonna"" (I'm going to) and ""Warshington"" (Washington) are characteristic of the dialect."
West Virginia,"4. Double Modals: West Virginia English is known for the use of double modals, where two modal verbs are used together for emphasis. For example, instead of saying ""might have,"" speakers may say ""might could"" or ""might should"" (e.g., ""I might could go to the store"")."
West Virginia,"5. Pronunciation of ""pin"" and ""pen"": Many speakers of West Virginia English, like other Southern dialects, have the ""pin-pen merger"". This means that the sounds represented by the letters ""i"" and ""e"" are pronounced the same way, resulting in both ""pin"" and ""pen"" being pronounced as ""pin""."
Wisconsin,"1. Northern Cities Vowel Shift: Wisconsin English is notable for its pronunciation patterns, particularly the Northern Cities Vowel Shift. This shift involves the fronting and raising of several vowels, such as the ""a"" in ""cat"" being pronounced more like ""cet"" and the ""e"" in ""bed"" being pronounced more like ""bid""."
Wisconsin,"2. Lexical Differences: Wisconsin English includes a variety of unique vocabulary terms. For example, ""bubbler"" is used instead of ""water fountain"", ""sack"" is used instead of ""bag"", and ""brat"" refers to a type of sausage, specifically a bratwurst."
Wisconsin,"3. ""Ya Know"" Phrase: The phrase ""ya know"" is commonly used in Wisconsin English and is often inserted as a filler or conversational marker. It can be used to express agreement, seek confirmation, or simply to indicate that the speaker is engaging with the listener."
Wisconsin,"4. Syntactic Variation: Wisconsin English exhibits certain syntactic patterns that differ from Standard American English. For instance, the use of double modals, such as ""might could"" (e.g., ""I might could help you with that"") or ""used to could"" (e.g., ""I used to could play the piano""), is a common feature of the dialect."
Wisconsin,"5. Pronunciation of ""o"" sounds: In Wisconsin English, the vowel sound ""o"" in words like ""boat"" or ""goat"" is often pronounced with more rounded lips, giving it a slightly different quality compared to other dialects. This is sometimes referred to as the ""rounded o"" or the ""Canadian vowel."""
Wyoming,"1. Vowel pronunciation: One key feature of Wyoming English is the pronunciation of certain vowel sounds. For example, the vowel in words like ""cot"" and ""lot"" may be pronounced with a slight nasalization, giving it a sound closer to ""caht"" and ""laht"". Similarly, the vowel in words like ""cat"" and ""trap"" may be pronounced with a slight rounding, giving it a sound closer to ""kyat"" and ""tryap""."
Wyoming,"2. Non-rhoticity: Wyoming English is generally non-rhotic, meaning that the ""r"" sound is not pronounced at the end of words, or in the middle before a consonant. For example, the word ""car"" may be pronounced as ""cah"" or ""cah-uh"" rather than ""car""."
Wyoming,"3. Monophthongs: Wyoming English tends to have monophthongal vowel sounds, meaning that diphthongs (two vowel sounds merged together) are less common. For example, the pronunciation of the word ""boat"" may be a simple /o/ sound instead of a diphthongized /oʊ/ sound."
Wyoming,"4. Lexical features: Wyoming English includes some unique lexical features. For example, the term ""breezer"" is used to refer to a type of convertible car, and ""sprinkle"" is used instead of ""rain"" for light rain showers. Additionally, some Wyoming English speakers may use words like ""holler"" instead of ""yell"" or ""honey bucket"" instead of ""portable toilet""."
Wyoming,"5. Syntax and grammar: Wyoming English may exhibit some syntactic and grammatical patterns that differ from other English dialects. For instance, the use of double modals, such as ""might could"" (e.g., ""I might could go to the store"") and ""should oughta"" (e.g., ""You should oughta ask her""), is more common in Wyoming English. Furthermore, the phrase ""you guys"" is often used as a gender-neutral form of address."
