state,feature
Alabama,"1. Southern Vowel Shift: Like many dialects in the Southern United States, Alabama English exhibits the Southern Vowel Shift. This shift involves changes in individual vowel sounds, such as the fronting of the /a/ sound (as in ""cat"") towards the /æ/ sound (as in ""cat"" sounding more like ""kyat"") or the backing and lowering of the /i/ sound (as in ""kit"" sounding more like ""ket"")."
Alabama,"2. Rhoticity: Alabama English is generally rhotic, which means that the /r/ sound is pronounced in words where it appears, unlike in non-rhotic dialects where the /r/ sound is dropped at the end of syllables."
Alabama,"3. Biscuit Baking: A common linguistic feature in Alabama English is the pronunciation of certain words related to food, particularly ""biscuit."" In some cases, the /ɪ/ sound is added in the second syllable, resulting in a pronunciation like ""bis-kwit"" or even ""biskit."""
Alabama,"4. Y'all: One well-known feature of Alabama English is the use of ""y'all"" as a second-person plural pronoun. It is used to address a group of people, and the term has spread beyond the Southern region, gaining recognition throughout the United States."
Alabama,"5. Double Modals: In Alabama English, it is not uncommon to use double modals, where two modal auxiliary verbs are used together, such as ""might could"" or ""might should."" This linguistic phenomenon is characteristic of many Southern dialects, including Alabama English."
Alaska,"1. Vowel pronunciation: Alaskan English is known for its unique vowel sounds. One particular feature is the pronunciation of the vowel in words like ""cat"" and ""trap"" as a central or back vowel, similar to the sound in ""father"" or ""lot."" This is commonly referred to as the ""Alaskan front vowel merger."" "
Alaska,"2. ""Alaskan"" R: Another prominent feature is the pronunciation of the letter ""r."" In Alaskan English, the ""r"" sound is often dropped or only lightly pronounced. For example, words like ""car"" might be pronounced as ""cah"" or ""ca."""
Alaska,"3. Vocabulary: Alaskan English includes several words and phrases specific to the region, influenced by native languages and the unique environment. For instance, words like ""mukluk"" (a type of boot) or ""musk ox"" (a large Arctic mammal) are commonly used in everyday conversations in Alaska."
Alaska,"4. Idiomatic expressions: There are idiomatic expressions unique to Alaskan English that reflect the region's culture and location, such as ""break up"" (the melting of ice in spring) or ""bush"" (referring to rural areas outside the major cities)."
Alaska,"5. Pronunciation of native Alaskan names: Alaskan English includes specific pronunciation patterns for native Alaskan names. The way these names are pronounced may differ from standard English phonetics, with different stress patterns and combinations of consonants that are not typical in other English dialects."
Arizona,"1. Vowel Merger: One of the key linguistic features of Arizona English is the vowel merger. This merger involves the vowel sounds in words like ""cot"" and ""caught"" being pronounced the same way, usually as a low back vowel. This feature is similar to the merger found in other western dialects."
Arizona,"2. Desert Accent: Another prominent feature of Arizona English is its desert accent. It is characterized by a relaxed pronunciation style, with speech patterns influenced by the surrounding arid landscape. This can result in a slower pace of speech and a slightly drawling or melodious quality to the vowels."
Arizona,"3. Vocabulary: Arizona English has some vocabulary that is unique to the region. For example, terms like ""monsoon"" and ""haboob"" are commonly used to describe weather phenomena specific to the desert climate. The influence of Native American languages is also noticeable in certain terms related to local flora, fauna, and geographic features."
Arizona,"4. Spanish Loanwords: Due to Arizona's proximity to Mexico and its historical ties to Spanish-speaking populations, Spanish loanwords are commonly integrated into everyday language. Words like ""coyote,"" ""burrito,"" and ""mesa"" are frequently used and understood by Arizonans, even by those who do not speak Spanish fluently."
Arizona,"5. Pronunciation: Arizona English exhibits some unique pronunciations. For instance, some Arizonans may pronounce the word ""huge"" as ""yuge"" or ""minute"" as ""minnit."" Additionally, common terms like ""tortilla"" or ""saguaro"" may have a more Anglicized pronunciation, reflecting the influence of English on Spanish loanwords."
Arizona,It's important to note that these linguistic features are general tendencies and may not be strictly representative of every individual or community in Arizona.
Arkansas,"1. Arkansas Vowel Shift: One key linguistic feature of Arkansas English is the presence of a vowel shift. This shift affects specific vowel sounds, such as the ""a"" sound in words like ""pan,"" which is often pronounced more like ""pin."" Similarly, the ""e"" sound in words like ""pen"" can be pronounced more like ""pin."""
Arkansas,"2. Dropping of the ""r"" sound: In many parts of Arkansas, the ""r"" sound at the end of words or before a consonant is often dropped. For example, words like ""car"" may be pronounced as ""cah"" and ""for"" as ""fo."""
Arkansas,"3. Use of Southern expressions and idioms: Arkansas English includes numerous Southern expressions and idiomatic phrases that are unique to the region, reflecting the cultural and historical influences of the South. These expressions may include phrases like ""bless your heart,"" ""fixin' to,"" or ""y'all."""
Arkansas,"4. Syllable-timed rhythm: Arkansas English exhibits a syllable-timed rhythm, meaning that each syllable is given equal stress and duration. This differs from the stress-timed rhythm found in other English dialects, where stressed syllables receive more prominence and can cause unstressed syllables to be shortened or even dropped."
Arkansas,"5. Monophthongization of diphthongs: Another linguistic feature of Arkansas English is the monophthongization of certain diphthongs. For instance, the diphthong ""ai"" in words like ""ride"" is often pronounced as a single vowel sound, closer to ""ah"" rather than the standard ""ai"" sound found in other dialects. Similarly, the ""ou"" in words like ""house"" may be pronounced as a simple ""o."""
California,"1. Vowel Shifts: California English is known for its distinctive vowel shifts. One common vowel shift is the fronting of the ""o"" sound, so words like ""cot"" and ""caught"" are pronounced with a similar vowel sound. Another shift is the raising of the ""ae"" sound, so words like ""bag"" and ""bad"" may be pronounced with a similar vowel sound."
California,"2. Vocal Fry: California English is often associated with the use of vocal fry, which is a low, creaky voice quality that occurs at the end of phrases or sentences. This feature has gained attention in popular culture and is notably associated with the ""Valley Girl"" stereotype."
California,"3. High Rising Terminal (HRT): The HRT, also known as the ""uptalk,"" is a rising pitch pattern at the end of a declarative statement, giving it a questioning or uncertain tone. It is commonly used in California English and is often associated with the stereotype of Californians."
California,"4. Lexical Innovations: California English has contributed several lexical innovations to the English language. For example, words like ""gnarly"" (meaning cool or impressive) and ""hella"" (meaning very or a lot) originated in California and have since spread to other regions."
California,"5. Surfer Slang and Surfer Syntax: Due to the influence of California's surf culture, some unique surfer slang terms have emerged in California English, such as ""stoked"" (excited) and ""hang ten"" (a surfing maneuver). Additionally, the influence of surfer syntax is sometimes seen, with shortened phrases or omission of certain grammatical elements, like dropping ""to be"" verbs or using incomplete sentences in casual speech."
Colorado,"1. High Rising Terminal: One of the most distinctive features of Colorado English is the use of the high rising terminal, also known as upspeak or uptalk. This is the tendency to end statements with a rising intonation, making them sound like questions. For example, ""I went to the store?"" This feature is especially prominent among younger speakers in Colorado."
Colorado,"2. Vowel Shifts: Colorado English exhibits certain vowel shifts that distinguish it from other regional accents. One such shift is the ""cot-caught"" merger, where the vowel sounds in words like ""hot"" and ""cot"" are pronounced the same. Additionally, the ""horse-hoarse"" merger is prevalent, resulting in the merging of the vowel sounds in words like ""horse"" and ""hoarse."""
Colorado,"3. Pronunciation of ""Mountain"": One specific lexical feature of Colorado English is the pronunciation of the word ""mountain"" as ""moun-in"". The [t] sound is often omitted or replaced with a glottal stop, resulting in the more relaxed pronunciation."
Colorado,"4. Vocabulary: Colorado English includes some unique vocabulary terms that reflect the local culture and geography. For instance, terms like ""14er"" are commonly used to refer to the state's numerous peaks above 14,000 feet. Similarly, ""green chile"" refers to a specific regional variety of chili pepper used in local cuisine."
Colorado,"5. Lexical Borrowings: Due to the influence of Spanish, Native American languages, and neighboring states, Colorado English has borrowed certain lexical items from these sources. For example, words like ""creek"" and ""butte"" from Native American languages, as well as Spanish loanwords like ""canyon"" and ""arroyo,"" are commonly used in Colorado English vocabulary."
Connecticut,"1. Non-rhoticity: One of the most noticeable features of Connecticut English is non-rhoticity, where the ""r"" sound is not pronounced at the ends of words or before consonants. For example, ""car"" is pronounced ""cah"" and ""party"" is pronounced ""pahty."""
Connecticut,"2. Nasalization: Connecticut English exhibits nasalization of certain vowel sounds, especially the ""a"" vowel. This means that words like ""cat"" and ""fast"" may have a tendency to sound more like ""cay-at"" and ""fay-ast,"" with the vowel sound taking on a nasal quality."
Connecticut,"3. The ""aw"" vowel shift: In Connecticut English, there is often an alteration of the ""a"" sound in certain words, particularly those with the ""aw"" sound. This can result in pronunciations such as ""coffee"" sounding more like ""caw-fee"" or ""dog"" sounding like ""dawg."""
Connecticut,"4. Vocabulary variations: Connecticut English includes some unique regional vocabulary. For instance, the use of the word ""package store"" for a liquor store or ""grinder"" for a sub or sandwich. Additionally, certain words like ""jimmies"" for sprinkles or ""tag sale"" for a yard sale are also common in Connecticut English."
Connecticut,"5. Flattening of vowel sounds: Another notable feature is the flattening of certain vowel sounds. The pronunciation of words like ""dance,"" ""pants,"" and ""glass"" may lose the typical vowel distinction found in other accents, resulting in these words sounding more similar to ""dents,"" ""pents,"" and ""gless."""
Delaware,"1. Phonology: Delaware English is characterized by the merger of certain vowel sounds. For example, the distinction between the vowels in words like ""cot"" and ""caught"" is often lost, with both pronunciations being realized as /ɑ/. Additionally, the vowel in words like ""about"" and ""house"" is often pronounced as a centralized vowel, closer to /ʌ/."
Delaware,"2. Vocabulary: Delaware English has certain regional vocabulary items that are distinct from standard American English. These include terms like ""jawn"" (used to refer to a generic object or person), ""hoagie"" (a sandwich), and ""wudder"" (water)."
Delaware,"3. Syntax: Delaware English may exhibit syntactic variations, particularly in the use of certain auxiliary verbs. For instance, the absence of ""to be"" in sentences like ""The car needs washed"" or the use of ""needs done"" instead of ""needs to be done."""
Delaware,"4. Intonation: Intonation patterns in Delaware English can differ from other varieties of English. Delaware speakers may exhibit rising intonation at the end of declarative sentences, which can convey a different meaning or emphasis compared to standard English intonation patterns."
Delaware,"5. Lexical Borrowings: Due to its history and proximity to other regions, Delaware English has borrowed words and phrases from neighboring dialects and languages. For example, terms from African American Vernacular English (AAVE) may be incorporated into speech, such as ""ain't"" for negation, or ""finna"" meaning ""going to."" Additionally, loanwords from Native American languages such as Lenape, like ""moccasin"" or ""squash,"" can be found in Delaware English."
Florida,"1. Flapping: Flapping is a characteristic feature of Florida English, particularly in southern and central Florida. It involves the pronunciation of /t/ and /d/ sounds as a tap or flap [ɾ] when they occur between vowels or after a vowel within a word. For example, ""butter"" may be pronounced as ""bu'er"" or ""better"" as ""be'er""."
Florida,"2. Vowel Shifts: Florida English exhibits certain vowel shifts, particularly in the South Florida region. One such shift is the ""cot-caught"" merger, where the vowels in words like ""cot"" and ""caught"" are pronounced the same. Additionally, there may be a distinction between the vowels in ""pin"" and ""pen"" for some speakers, with the latter pronounced as [ɛ] instead of [ɪ]."
Florida,"3. Southern Accent Features: Florida English shares some features with other Southern dialects. For instance, the Southern vowel shift may be present, where vowel sounds are shifted in specific contexts. The ""monophthongization"" of diphthongs, such as pronouncing ""idea"" as ""ah-dee-yah,"" is another feature present in some speakers."
Florida,"4. Influence of Spanish: Due to the significant Hispanic population in Florida, Spanish influences can be observed in the spoken English. Bilingual speakers might exhibit code-switching, borrowing of Spanish words, or the incorporation of Spanish phonological patterns, like the trilling of the ""r"" sound or the pronunciation of ""s"" as [s] instead of [z] in certain contexts."
Florida,"5. Use of ""Y'all"": Like many Southern dialects, Florida English frequently uses ""y'all"" as a second-person plural pronoun. It is used to address a group of people, replacing ""you all"" or ""you guys"" found in other varieties of English. This feature is especially prevalent in the northern and central parts of the state, influenced by the Southern dialects of surrounding states."
Georgia,"1. Pronunciation: Georgia English has distinct pronunciation features, with a tendency to pronounce ""r"" sounds as a retroflex approximant [ɹ], similar to Southern American English. Additionally, some speakers may exhibit a cot-caught merger, pronouncing these words with the same vowel sound."
Georgia,  
Georgia,"2. Vocabulary: Georgia English includes several unique words and phrases specific to the region. For example, ""y'all"" is a common second-person plural pronoun used for addressing a group of people, while ""fixin' to"" or ""mighty"" are commonly used to indicate intention or emphasis respectively."
Georgia,"3. Grammar: Georgia English includes certain grammatical features that differ from standard American English. Double modals, such as ""might could"" or ""might should,"" are commonly used to express possibility or uncertainty. Moreover, the use of the past tense form ""done"" followed by a verb (e.g., ""I done told you"") is typical in some varieties of Georgia English."
Georgia,"4. Intonation: Georgia English exhibits distinctive intonation patterns. Speakers often employ a rising intonation at the end of declarative sentences, which can give the impression of a question in certain contexts."
Georgia,"5. Lexical borrowing: Georgia English has borrowed words and phrases from African American Vernacular English (AAVE), due to historical African American influence in the region. Some examples include ""ain't"" as a negation marker or ""reckon"" meaning ""to think"" or ""to suppose."""
Hawaii,"1. Hawaiian Pidgin influence: Hawaii English is heavily influenced by Hawaiian Pidgin, a creole language that developed in the islands. It is common to hear Hawaiian Pidgin vocabulary, grammar, and pronunciation in Hawaii English."
Hawaii,"2. Pronunciation: Hawaii English has distinct pronunciation patterns, such as the substitution of ""th"" sounds with ""d"" or ""f"" sounds. For example, ""think"" is pronounced as ""fink"" and ""that"" is pronounced as ""dat."" Additionally, the ""r"" sound at the end of words and syllables is often dropped or pronounced softly."
Hawaii,"3. Vocabulary: Hawaii English has a unique vocabulary that reflects the multicultural nature of the state. It includes loanwords from Hawaiian, Japanese, Filipino, and other languages present in the islands. For example, words like ""aloha,"" ""mahi-mahi,"" and ""haole"" are commonly used."
Hawaii,4. Code-switching: Hawaii English speakers often code-switch between standard English and Hawaiian Pidgin or other languages depending on the context and the people they are interacting with. This bilingualism is a distinctive feature of the language in Hawaii.
Hawaii,"5. Cultural expressions and idioms: Hawaii English incorporates cultural expressions and idioms that are specific to the Hawaiian culture. For example, phrases like ""talk story"" (meaning to have a casual conversation) and ""hang loose"" (meaning to relax or take it easy) are commonly used in everyday speech."
Idaho,"1. Vowel shift: One key linguistic feature of Idaho English is the vowel shift, particularly the pronunciation of the ""a"" vowel. In Idaho, the ""a"" sound is often fronted and pronounced closer to an ""ay"" sound, so words like ""bag"" may sound more like ""beg."""
Idaho,"2. Pin-pen merger: Another notable feature is the pin-pen merger, where the distinction between the vowels in words like ""pin"" and ""pen"" is blurred. Both vowels are pronounced more similarly, making it difficult to differentiate the two words in certain contexts."
Idaho,"3. Rhoticity: Idaho English is generally rhotic, meaning that the /r/ sound is pronounced in all positions. This differs from non-rhotic varieties in which the /r/ sound is only pronounced before vowel sounds."
Idaho,"4. Intonation patterns: The intonation patterns of Idaho English may also differ from other dialects. There is often a tendency to end declarative sentences with a rising pitch, almost resembling a question, which is commonly referred to as the ""High Rising Terminal"" or HRT."
Idaho,"5. Lexical variations: In terms of vocabulary, there may be some unique regional terms or phrases specific to Idaho English. For example, words like ""spud"" are commonly used to reference potatoes, as Idaho is well-known for its potato production. Additionally, certain phrases or idioms might be more prevalent in Idaho English compared to other dialects."
Illinois,"1. The cot-caught merger: In Illinois English, the distinction between the vowel sounds in words like ""cot"" and ""caught"" is often eliminated, with both words being pronounced with the same vowel sound. This merger is also common in other Midwestern dialects."
Illinois,"2. The nortern cities vowel shift: Illinois English, particularly in urban areas such as Chicago, is influenced by the Northern Cities Vowel Shift. This shift involves changes in the pronunciation of certain vowel sounds, such as the ""a"" in words like ""cat"" becoming more like ""eh"" and the ""o"" in words like ""cot"" becoming more like ""aw."""
Illinois,"3. Flat /a/ vowel: Illinois English features a distinct vowel sound for words with the ""a"" letter, typically pronounced as a flattened version of the original /æ/ vowel sound. This is often evident in words like ""have"" or ""cat,"" where the vowel sounds closer to ""hav"" or ""cet"" respectively."
Illinois,"4. ""Pop"" versus ""soda"": In Illinois English, the term ""pop"" is more commonly used to refer to carbonated beverages, whereas other regions of the U.S. might use terms like ""soda"" or ""coke"". This linguistic feature aligns with the wider ""pop"" usage found in the Midwest."
Illinois,"5. ""R"" pronunciation: Illinois English tends to have a distinct ""r"" pronunciation, with the /r/ sound being more prominent and often fully articulated at the end of words, such as in ""car"" or ""door."" This differs from other dialects, such as some Eastern varieties of American English, where the /r/ sound might be softened or dropped entirely."
Indiana,"1. Midwestern Vowel Shift: One prominent linguistic feature of Indiana English is the Midwestern Vowel Shift. This shift involves the pronunciation of certain vowels in a distinct way. For example, the ""a"" sound in words like ""cat"" may be pronounced more like ""kyat"" or ""kyet."""
Indiana,"2. Nasalization: Another feature of Indiana English is the nasalization of certain vowels, particularly the short ""a"" sound. This means that words like ""cat"" may be pronounced with a slight nasally twang, similar to ""cayt."""
Indiana,"3. Backing of the ""o"" sound: In Indiana English, the short ""o"" sound in words like ""lot"" and ""hot"" is often pronounced further back in the mouth. Instead of the typical pronunciation found in other dialects, the ""o"" sound may be closer to ""a"" or even ""aw."""
Indiana,"4. Northern Cities Shift: Indiana English is also influenced by the Northern Cities Shift, a vowel shift common in the Great Lakes region. This shift involves several vowel changes, such as the pronunciation of ""bet"" as ""baht"" or ""bet"" and ""cat"" as ""kyat"" or ""kyet."""
Indiana,"5. Lexical variations: Like any regional dialect, Indiana English has its own set of unique words and phrases. Certain terms specific to the state may be used, such as ""Hoosier"" to refer to someone from Indiana. Additionally, there may be distinct local vocabulary related to agriculture, common industries, and regional traditions."
Iowa,"1. Nasalization: One key linguistic feature of Iowa English is the nasalization of vowels. This means that vowels are pronounced with a nasal quality, particularly before nasal consonants like ""m"" and ""n."" For example, the word ""man"" may be pronounced as ""mæ̃n"" with a nasalized ""a"" sound."
Iowa,"2. Midwestern accent: Iowa English is characterized by a Midwestern accent, which is characterized by the absence of distinctive features found in other American regional accents. The Midwestern accent is generally considered to be a ""standard"" or ""neutral"" American accent with little variation in vowel sounds."
Iowa,"3. Monophthongs: Another characteristic of Iowa English is the pronunciation of monophthongs, which means that there is little to no diphthongization of vowel sounds. For example, the word ""ride"" may be pronounced as ""raɪd"" with a single vowel sound, rather than ""rəɪd"" with a diphthongized vowel sound."
Iowa,"4. Do-support: Iowa English tends to use ""do-support,"" which means that the auxiliary verb ""do"" is used in questions, negations, and emphatic statements. For instance, instead of saying ""You went to the store?"", a speaker of Iowa English may say ""Did you go to the store?"""
Iowa,"5. Vocabulary: Iowa English includes certain regional vocabulary terms that are not commonly used elsewhere. For example, the term ""pop"" is often used to refer to a carbonated beverage, instead of ""soda"" or ""soft drink."" Similarly, the term ""barnstorm"" is used to describe someone who engages in a series of impromptu performances or activities."
Kansas,"1. Vowel merger: One prominent linguistic feature of Kansas English is the vowel merger, specifically the /oʊ/ and /ɔ/ merger. This means that words like ""goat"" and ""boat"" are pronounced with the same vowel sound."
Kansas,"2. Non-rhoticity: Kansas English, like many other Midwestern dialects, is non-rhotic. This means that the /r/ sound is often dropped after vowels, particularly at the ends of words. For example, ""car"" may be pronounced as ""cah""."
Kansas,"3. The Kansas City accent: There is a distinct accent specific to Kansas City, characterized by the pronunciation of certain words. For instance, ""cot"" and ""caught"" might both be pronounced with the same vowel sound, similar to the vowel merger mentioned earlier."
Kansas,"4. The Kansas City pitch pattern: In Kansas City English, there is a specific pitch pattern that sets it apart from other dialects. This pattern involves a rising intonation at the end of sentences, often perceived as giving a friendly or helpful tone."
Kansas,"5. Lexical features: Kansas English also has some unique vocabulary, influenced by various factors such as regional agriculture, Native American words, and the historical settlement patterns of the state. For example, you may hear terms like ""sunflower state"" to refer to Kansas, or ""jimmies"" to refer to sprinkles on ice cream."
Kentucky,"1. Southern Vowel Shift: Kentucky English reflects the Southern Vowel Shift, which is a system of vowel pronunciation unique to the Southern United States. This shift involves changes in the pronunciation of certain vowels, such as the /aɪ/ diphthong becoming more centralized and pronounced as /ʌɪ/ (""pie"" becomes ""puh"")."
Kentucky,"2. Rhoticity: Kentucky English is generally rhotic, meaning that the ""r"" sound is pronounced in words ending in ""r"" and before consonants. For example, ""far"" sounds like ""fahr"" and ""car"" sounds like ""cahr."""
